[
    {
        "id": "e2f7d285-7b47-40c0-802e-b7de9e51da56",
        "name": "Oak Fire",
        "year": 2025,
        "county": "Santa Barbara",
        "latitude": 34.883723,
        "longitude": -120.246601,
        "location": "VQM3+F9 Sisquoc, CA, USA",
        "acres_burned": 42.0,
        "url": "https://wildfiretoday.com/wp-content/uploads/2022/07/Oak-Fire-3-D-map-looking-north-at-9-p.m.-July-24-2022.jpg",
        "description": "The Oak Fire was a wildfire that took place in Santa Barbara County in the year 2025. This fire was located near VQM3+F9 Sisquoc, CA, USA and burned an estimated 42.0 acres. With coordinates at (34.883723, -120.246601), the fire posed a significant threat to nearby communities, natural habitats, and local infrastructure. Emergency response teams worked diligently to contain the spread and mitigate potential damage. Local authorities issued alerts to residents, urging them to take necessary precautions. Efforts such as firebreaks, controlled burns, and aerial firefighting were employed to limit its impact. While the fire was eventually brought under control, its effects highlighted the ongoing challenges posed by wildfires in the region."
    },
    {
        "id": "4eef0191-65aa-46a0-8227-d1553896a5b0",
        "name": "Border Fire",
        "year": 2025,
        "county": "San Diego",
        "latitude": 32.59853,
        "longitude": -116.82817,
        "location": "H5XC+CP Doghouse Junction, CA, USA",
        "acres_burned": 25.0,
        "url": "https://d.newsweek.com/en/full/2573199/cal-fire-map-border-fire-blaze.jpg",
        "description": "The Border Fire was a wildfire that took place in San Diego County in the year 2025. This fire was located near H5XC+CP Doghouse Junction, CA, USA and burned an estimated 25.0 acres. With coordinates at (32.59853, -116.82817), the fire posed a significant threat to nearby communities, natural habitats, and local infrastructure. Emergency response teams worked diligently to contain the spread and mitigate potential damage. Local authorities issued alerts to residents, urging them to take necessary precautions. Efforts such as firebreaks, controlled burns, and aerial firefighting were employed to limit its impact. While the fire was eventually brought under control, its effects highlighted the ongoing challenges posed by wildfires in the region."
    },
    {
        "id": "abfed7a3-794a-4294-9852-43176dcbc18a",
        "name": "Palisades Fire",
        "year": 2025,
        "county": "Los Angeles",
        "latitude": 34.07022,
        "longitude": -118.54453,
        "location": "3FC4+35 Los Angeles, CA, USA",
        "acres_burned": 23706.6,
        "url": "https://media-cldnry.s-nbcnews.com/image/upload/t_fit-760w,f_auto,q_auto:best/rockcms/2025-01/250109-Matthew-Heller-palisades-drone-ew-555p-d67907.jpg",
        "description": "The Palisades Fire was a wildfire that took place in Los Angeles County in the year 2025. This fire was located near 3FC4+35 Los Angeles, CA, USA and burned an estimated 23706.6 acres. With coordinates at (34.07022, -118.54453), the fire posed a significant threat to nearby communities, natural habitats, and local infrastructure. Emergency response teams worked diligently to contain the spread and mitigate potential damage. Local authorities issued alerts to residents, urging them to take necessary precautions. Efforts such as firebreaks, controlled burns, and aerial firefighting were employed to limit its impact. While the fire was eventually brought under control, its effects highlighted the ongoing challenges posed by wildfires in the region."
    },
    {
        "id": "dbfa574e-1b10-4467-b5e5-7d1c06ebc8dc",
        "name": "Eaton Fire",
        "year": 2025,
        "county": "Los Angeles",
        "latitude": 34.203483,
        "longitude": -118.069155,
        "location": "6W3J+98 Mount Wilson, CA, USA",
        "acres_burned": 14021.0,
        "url": "https://caltech-prod.s3.amazonaws.com/main/images/Eaton-Fire-Satellite.2e16d0ba.fill-1600x810-c100.jpg",
        "description": "The Eaton Fire was a wildfire that took place in Los Angeles County in the year 2025. This fire was located near 6W3J+98 Mount Wilson, CA, USA and burned an estimated 14021.0 acres. With coordinates at (34.203483, -118.069155), the fire posed a significant threat to nearby communities, natural habitats, and local infrastructure. Emergency response teams worked diligently to contain the spread and mitigate potential damage. Local authorities issued alerts to residents, urging them to take necessary precautions. Efforts such as firebreaks, controlled burns, and aerial firefighting were employed to limit its impact. While the fire was eventually brought under control, its effects highlighted the ongoing challenges posed by wildfires in the region."
    },
    {
        "id": "ed36cf94-75d8-43f6-913a-d15646907311",
        "name": "Hurst Fire",
        "year": 2025,
        "county": "Los Angeles",
        "latitude": 34.32533,
        "longitude": -118.478134,
        "location": "15850 Yarnell St, Sylmar, CA 91342, USA",
        "acres_burned": 799.0,
        "url": "https://d.newsweek.com/en/full/2559253/hurst-fire-map.jpg?w=1200&f=23785254f67b3ae68fee2e5c0f7bb64d",
        "description": "The Hurst Fire was a wildfire that took place in Los Angeles County in the year 2025. This fire was located near 15850 Yarnell St, Sylmar, CA 91342, USA and burned an estimated 799.0 acres. With coordinates at (34.32533, -118.478134), the fire posed a significant threat to nearby communities, natural habitats, and local infrastructure. Emergency response teams worked diligently to contain the spread and mitigate potential damage. Local authorities issued alerts to residents, urging them to take necessary precautions. Efforts such as firebreaks, controlled burns, and aerial firefighting were employed to limit its impact. While the fire was eventually brought under control, its effects highlighted the ongoing challenges posed by wildfires in the region."
    },
    {
        "id": "c3e0b57e-f5b9-41e0-b9ec-eb524797c874",
        "name": "Tyler Fire",
        "year": 2025,
        "county": "Riverside",
        "latitude": 33.706565,
        "longitude": -116.164126,
        "location": "46297 Tyler St, Coachella, CA 92236, USA",
        "acres_burned": 11.0,
        "url": "https://images.foxtv.com/static.livenowfox.com/www.livenowfox.com/content/uploads/2025/01/932/524/fires-burning.jpg?ve=1&tl=1",
        "description": "The Tyler Fire was a wildfire that took place in Riverside County in the year 2025. This fire was located near 46297 Tyler St, Coachella, CA 92236, USA and burned an estimated 11.0 acres. With coordinates at (33.706565, -116.164126), the fire posed a significant threat to nearby communities, natural habitats, and local infrastructure. Emergency response teams worked diligently to contain the spread and mitigate potential damage. Local authorities issued alerts to residents, urging them to take necessary precautions. Efforts such as firebreaks, controlled burns, and aerial firefighting were employed to limit its impact. While the fire was eventually brought under control, its effects highlighted the ongoing challenges posed by wildfires in the region."
    },
    {
        "id": "c2159108-ab33-4b74-8ef1-3706df7aecda",
        "name": "Woodley Fire",
        "year": 2025,
        "county": "Los Angeles",
        "latitude": 34.17973,
        "longitude": -118.47438,
        "location": "5GHG+V6 Los Angeles, CA, USA",
        "acres_burned": 30.0,
        "url": "https://www.usatoday.com/gcdn/authoring/authoring-images/2025/01/08/USAT/77551198007-20250108-t-193327-z-1179765052-rc-2-u-5-ca-7-y-7-nv-rtrmadp-3-californiawildfires-1.JPG?width=660&height=440&fit=crop&format=pjpg&auto=webp",
        "description": "The Woodley Fire was a wildfire that took place in Los Angeles County in the year 2025. This fire was located near 5GHG+V6 Los Angeles, CA, USA and burned an estimated 30.0 acres. With coordinates at (34.17973, -118.47438), the fire posed a significant threat to nearby communities, natural habitats, and local infrastructure. Emergency response teams worked diligently to contain the spread and mitigate potential damage. Local authorities issued alerts to residents, urging them to take necessary precautions. Efforts such as firebreaks, controlled burns, and aerial firefighting were employed to limit its impact. While the fire was eventually brought under control, its effects highlighted the ongoing challenges posed by wildfires in the region."
    },
    {
        "id": "8ea1537d-2560-4d08-bfe0-060cf5275e54",
        "name": "Olivas Fire",
        "year": 2025,
        "county": "Ventura",
        "latitude": 34.244456,
        "longitude": -119.2567768,
        "location": "3241 E Harbor Blvd, Ventura, CA 93001, USA",
        "acres_burned": 11.0,
        "url": "https://www.vcstar.com/gcdn/authoring/authoring-images/2025/01/08/PVCS/77549914007-olivas-fire-8.jpg?width=700&height=440&fit=crop&format=pjpg&auto=webp",
        "description": "The Olivas Fire was a wildfire that took place in Ventura County in the year 2025. This fire was located near 3241 E Harbor Blvd, Ventura, CA 93001, USA and burned an estimated 11.0 acres. With coordinates at (34.244456, -119.2567768), the fire posed a significant threat to nearby communities, natural habitats, and local infrastructure. Emergency response teams worked diligently to contain the spread and mitigate potential damage. Local authorities issued alerts to residents, urging them to take necessary precautions. Efforts such as firebreaks, controlled burns, and aerial firefighting were employed to limit its impact. While the fire was eventually brought under control, its effects highlighted the ongoing challenges posed by wildfires in the region."
    },
    {
        "id": "83adc92b-bd6c-458a-a2b1-43b3ee2c27b3",
        "name": "Lidia Fire",
        "year": 2025,
        "county": "Los Angeles",
        "latitude": 34.4408,
        "longitude": -118.2433,
        "location": "CQR4+8M Acton, CA, USA",
        "acres_burned": 395.0,
        "url": "https://media.abc10.com/assets/KXTV/images/6f247f14-2f89-4385-878b-19c4e4a4ac99/20250109T070526/6f247f14-2f89-4385-878b-19c4e4a4ac99_1920x1080.jpg",
        "description": "The Lidia Fire was a wildfire that took place in Los Angeles County in the year 2025. This fire was located near CQR4+8M Acton, CA, USA and burned an estimated 395.0 acres. With coordinates at (34.4408, -118.2433), the fire posed a significant threat to nearby communities, natural habitats, and local infrastructure. Emergency response teams worked diligently to contain the spread and mitigate potential damage. Local authorities issued alerts to residents, urging them to take necessary precautions. Efforts such as firebreaks, controlled burns, and aerial firefighting were employed to limit its impact. While the fire was eventually brought under control, its effects highlighted the ongoing challenges posed by wildfires in the region."
    },
    {
        "id": "3b0d8af8-f3c9-4629-8735-641d9f6af3e7",
        "name": "Sunset Fire ",
        "year": 2025,
        "county": "Los Angeles",
        "latitude": 34.1105,
        "longitude": -118.3536,
        "location": "Runyon Canyon Flag, W Ridge Hiking Trail, Los Angeles, CA 90046, USA",
        "acres_burned": 42.8,
        "url": "https://www.newsnationnow.com/wp-content/uploads/sites/108/2025/01/GettyImages-2192430789.jpg?w=1280",
        "description": "The Sunset Fire  was a wildfire that took place in Los Angeles County in the year 2025. This fire was located near Runyon Canyon Flag, W Ridge Hiking Trail, Los Angeles, CA 90046, USA and burned an estimated 42.8 acres. With coordinates at (34.1105, -118.3536), the fire posed a significant threat to nearby communities, natural habitats, and local infrastructure. Emergency response teams worked diligently to contain the spread and mitigate potential damage. Local authorities issued alerts to residents, urging them to take necessary precautions. Efforts such as firebreaks, controlled burns, and aerial firefighting were employed to limit its impact. While the fire was eventually brought under control, its effects highlighted the ongoing challenges posed by wildfires in the region."
    },
    {
        "id": "98dad47e-805e-4300-8220-c908df687b4b",
        "name": "Kenneth Fire",
        "year": 2025,
        "county": "Los Angeles, Ventura",
        "latitude": 34.185198,
        "longitude": -118.66991,
        "location": "24901 Victory Blvd, West Hills, CA 91307, USA",
        "acres_burned": 1052.0,
        "url": "https://d.newsweek.com/en/full/2561938/los-angeles-fire.jpg?w=1200&f=bbcb4104d02002bc69136834041e53a6",
        "description": "The Kenneth Fire was a wildfire that took place in Los Angeles, Ventura County in the year 2025. This fire was located near 24901 Victory Blvd, West Hills, CA 91307, USA and burned an estimated 1052.0 acres. With coordinates at (34.185198, -118.66991), the fire posed a significant threat to nearby communities, natural habitats, and local infrastructure. Emergency response teams worked diligently to contain the spread and mitigate potential damage. Local authorities issued alerts to residents, urging them to take necessary precautions. Efforts such as firebreaks, controlled burns, and aerial firefighting were employed to limit its impact. While the fire was eventually brought under control, its effects highlighted the ongoing challenges posed by wildfires in the region."
    },
    {
        "id": "a93eab36-e8a3-4a4e-be4d-2372e3ba4957",
        "name": "Archer Fire",
        "year": 2025,
        "county": "Los Angeles",
        "latitude": 34.3087,
        "longitude": -118.5111,
        "location": "17300 O'Melveny Park, Granada Hills, CA 91344, USA",
        "acres_burned": 19.0,
        "url": "https://ktla.com/wp-content/uploads/sites/4/2025/01/archer-fire.jpg?w=1920",
        "description": "The Archer Fire was a wildfire that took place in Los Angeles County in the year 2025. This fire was located near 17300 O'Melveny Park, Granada Hills, CA 91344, USA and burned an estimated 19.0 acres. With coordinates at (34.3087, -118.5111), the fire posed a significant threat to nearby communities, natural habitats, and local infrastructure. Emergency response teams worked diligently to contain the spread and mitigate potential damage. Local authorities issued alerts to residents, urging them to take necessary precautions. Efforts such as firebreaks, controlled burns, and aerial firefighting were employed to limit its impact. While the fire was eventually brought under control, its effects highlighted the ongoing challenges posed by wildfires in the region."
    },
    {
        "id": "11055429-59f4-49dc-b759-a0c0d1225efc",
        "name": "Auto Fire",
        "year": 2025,
        "county": "Ventura",
        "latitude": 34.23661,
        "longitude": -119.20224,
        "location": "6QPX+J4 Ventura, CA, USA",
        "acres_burned": 61.0,
        "url": "https://static01.nyt.com/images/2025/01/14/multimedia/14lafire-auto1-lghm/14lafire-auto1-lghm-articleLarge.jpg?quality=75&auto=webp&disable=upscale",
        "description": "The Auto Fire was a wildfire that took place in Ventura County in the year 2025. This fire was located near 6QPX+J4 Ventura, CA, USA and burned an estimated 61.0 acres. With coordinates at (34.23661, -119.20224), the fire posed a significant threat to nearby communities, natural habitats, and local infrastructure. Emergency response teams worked diligently to contain the spread and mitigate potential damage. Local authorities issued alerts to residents, urging them to take necessary precautions. Efforts such as firebreaks, controlled burns, and aerial firefighting were employed to limit its impact. While the fire was eventually brought under control, its effects highlighted the ongoing challenges posed by wildfires in the region."
    },
    {
        "id": "8a3dcaf5-4724-4176-83d4-08f96c79ffb6",
        "name": "Scout Fire",
        "year": 2025,
        "county": "Riverside",
        "latitude": 33.989,
        "longitude": -117.3887,
        "location": "4785 Scout Ln, Riverside, CA 92501, USA",
        "acres_burned": 2.0,
        "url": "https://lookaside.fbsbx.com/lookaside/crawler/threads/DE0fR3tT7Cl/0/image.jpg",
        "description": "The Scout Fire was a wildfire that took place in Riverside County in the year 2025. This fire was located near 4785 Scout Ln, Riverside, CA 92501, USA and burned an estimated 2.0 acres. With coordinates at (33.989, -117.3887), the fire posed a significant threat to nearby communities, natural habitats, and local infrastructure. Emergency response teams worked diligently to contain the spread and mitigate potential damage. Local authorities issued alerts to residents, urging them to take necessary precautions. Efforts such as firebreaks, controlled burns, and aerial firefighting were employed to limit its impact. While the fire was eventually brought under control, its effects highlighted the ongoing challenges posed by wildfires in the region."
    },
    {
        "id": "6c143c7e-d33c-4d0b-b434-d33a13705328",
        "name": "Little Mountain Fire",
        "year": 2025,
        "county": "San Bernardino",
        "latitude": 34.154384,
        "longitude": -117.32064,
        "location": "1500 W Edgehill Rd, San Bernardino, CA 92405, USA",
        "acres_burned": 34.0,
        "url": "https://www.sbsun.com/wp-content/uploads/2017/12/1206_sbs-l-mountainfire-1-jv26.jpg?w=978",
        "description": "The Little Mountain Fire was a wildfire that took place in San Bernardino County in the year 2025. This fire was located near 1500 W Edgehill Rd, San Bernardino, CA 92405, USA and burned an estimated 34.0 acres. With coordinates at (34.154384, -117.32064), the fire posed a significant threat to nearby communities, natural habitats, and local infrastructure. Emergency response teams worked diligently to contain the spread and mitigate potential damage. Local authorities issued alerts to residents, urging them to take necessary precautions. Efforts such as firebreaks, controlled burns, and aerial firefighting were employed to limit its impact. While the fire was eventually brought under control, its effects highlighted the ongoing challenges posed by wildfires in the region."
    },
    {
        "id": "db6f387b-2654-44a6-815e-20491c5a37a2",
        "name": "Lilac Fire",
        "year": 2025,
        "county": "San Diego",
        "latitude": 33.30932,
        "longitude": -117.152114,
        "location": "Old Hwy 395, Bonsall, CA 92003, USA",
        "acres_burned": 85.0,
        "url": "https://d.newsweek.com/en/full/2569684/lilac-fire-evacuation-map.jpg?w=1200&f=331ceffdf1685eef9ab42e802812ee98",
        "description": "The Lilac Fire was a wildfire that took place in San Diego County in the year 2025. This fire was located near Old Hwy 395, Bonsall, CA 92003, USA and burned an estimated 85.0 acres. With coordinates at (33.30932, -117.152114), the fire posed a significant threat to nearby communities, natural habitats, and local infrastructure. Emergency response teams worked diligently to contain the spread and mitigate potential damage. Local authorities issued alerts to residents, urging them to take necessary precautions. Efforts such as firebreaks, controlled burns, and aerial firefighting were employed to limit its impact. While the fire was eventually brought under control, its effects highlighted the ongoing challenges posed by wildfires in the region."
    },
    {
        "id": "74af6e1b-0ca9-4094-869d-ecae0a778cfb",
        "name": "Pala Fire",
        "year": 2025,
        "county": "San Diego",
        "latitude": 33.363226,
        "longitude": -117.162897,
        "location": "1608 Old Hwy 395, Fallbrook, CA 92028, USA",
        "acres_burned": 16.8,
        "url": "https://news.caloes.ca.gov/wp-content/uploads/sites/10/2023/07/IMG-0677-scaled.jpg",
        "description": "The Pala Fire was a wildfire that took place in San Diego County in the year 2025. This fire was located near 1608 Old Hwy 395, Fallbrook, CA 92028, USA and burned an estimated 16.8 acres. With coordinates at (33.363226, -117.162897), the fire posed a significant threat to nearby communities, natural habitats, and local infrastructure. Emergency response teams worked diligently to contain the spread and mitigate potential damage. Local authorities issued alerts to residents, urging them to take necessary precautions. Efforts such as firebreaks, controlled burns, and aerial firefighting were employed to limit its impact. While the fire was eventually brought under control, its effects highlighted the ongoing challenges posed by wildfires in the region."
    },
    {
        "id": "6bb588ff-4f53-492f-9e3a-1ff5900f6345",
        "name": "Friars Fire",
        "year": 2025,
        "county": "San Diego",
        "latitude": 32.7702,
        "longitude": -117.1698,
        "location": "7017 Friars Rd, San Diego, CA 92108, USA",
        "acres_burned": 3.0,
        "url": "https://media.cbs8.com/assets/KFMB/images/84923465-1c1a-46a7-a893-715c00cb4c09/20250122T002827/84923465-1c1a-46a7-a893-715c00cb4c09_1920x1080.jpg",
        "description": "The Friars Fire was a wildfire that took place in San Diego County in the year 2025. This fire was located near 7017 Friars Rd, San Diego, CA 92108, USA and burned an estimated 3.0 acres. With coordinates at (32.7702, -117.1698), the fire posed a significant threat to nearby communities, natural habitats, and local infrastructure. Emergency response teams worked diligently to contain the spread and mitigate potential damage. Local authorities issued alerts to residents, urging them to take necessary precautions. Efforts such as firebreaks, controlled burns, and aerial firefighting were employed to limit its impact. While the fire was eventually brought under control, its effects highlighted the ongoing challenges posed by wildfires in the region."
    },
    {
        "id": "8dcc0ed8-641f-4b85-b853-9ed4473f5e51",
        "name": "Ncfr3 4 Fire",
        "year": 2025,
        "county": "San Diego",
        "latitude": 33.299921,
        "longitude": -117.174205,
        "location": "7RXG+X8 Bonsall, CA, USA",
        "acres_burned": 80.0,
        "url": "https://media.nbclosangeles.com/2025/01/GettyImages-2192341074.jpg?quality=85&strip=all",
        "description": "The Ncfr3 4 Fire was a wildfire that took place in San Diego County in the year 2025. This fire was located near 7RXG+X8 Bonsall, CA, USA and burned an estimated 80.0 acres. With coordinates at (33.299921, -117.174205), the fire posed a significant threat to nearby communities, natural habitats, and local infrastructure. Emergency response teams worked diligently to contain the spread and mitigate potential damage. Local authorities issued alerts to residents, urging them to take necessary precautions. Efforts such as firebreaks, controlled burns, and aerial firefighting were employed to limit its impact. While the fire was eventually brought under control, its effects highlighted the ongoing challenges posed by wildfires in the region."
    },
    {
        "id": "b8b66c83-2a4d-495e-b51c-6dc071ddaa5a",
        "name": "Clay Fire",
        "year": 2025,
        "county": "Riverside",
        "latitude": 33.96682,
        "longitude": -117.47055,
        "location": "8432 Lakeview Ave, Riverside, CA 92509, USA",
        "acres_burned": 39.0,
        "url": "https://ktla.com/wp-content/uploads/sites/4/2025/01/Clay-Fire.jpg?w=1920",
        "description": "The Clay Fire was a wildfire that took place in Riverside County in the year 2025. This fire was located near 8432 Lakeview Ave, Riverside, CA 92509, USA and burned an estimated 39.0 acres. With coordinates at (33.96682, -117.47055), the fire posed a significant threat to nearby communities, natural habitats, and local infrastructure. Emergency response teams worked diligently to contain the spread and mitigate potential damage. Local authorities issued alerts to residents, urging them to take necessary precautions. Efforts such as firebreaks, controlled burns, and aerial firefighting were employed to limit its impact. While the fire was eventually brought under control, its effects highlighted the ongoing challenges posed by wildfires in the region."
    },
    {
        "id": "7eee0dc7-7020-4a86-9be7-82b084f105d9",
        "name": "Center Fire",
        "year": 2025,
        "county": "San Diego",
        "latitude": 33.001,
        "longitude": -117.0887,
        "location": "11223 Redbud Ct, San Diego, CA 92127, USA",
        "acres_burned": 7.0,
        "url": "https://californiasciencecenter.org/sites/default/files/images/2021-10/126%20Fire-Jamie%20Pham.jpg",
        "description": "The Center Fire was a wildfire that took place in San Diego County in the year 2025. This fire was located near 11223 Redbud Ct, San Diego, CA 92127, USA and burned an estimated 7.0 acres. With coordinates at (33.001, -117.0887), the fire posed a significant threat to nearby communities, natural habitats, and local infrastructure. Emergency response teams worked diligently to contain the spread and mitigate potential damage. Local authorities issued alerts to residents, urging them to take necessary precautions. Efforts such as firebreaks, controlled burns, and aerial firefighting were employed to limit its impact. While the fire was eventually brought under control, its effects highlighted the ongoing challenges posed by wildfires in the region."
    },
    {
        "id": "bf194e6a-78cb-46bc-849b-567bceaabbb6",
        "name": "Hughes Fire",
        "year": 2025,
        "county": "Los Angeles",
        "latitude": 34.553008,
        "longitude": -118.56687,
        "location": "HC3M+67 Santa Clarita, CA, USA",
        "acres_burned": 10425.0,
        "url": "https://i0.wp.com/www.directrelief.org/wp-content/uploads/2025/01/hughes-fire.jpg?resize=1280%2C720&ssl=1",
        "description": "The Hughes Fire was a wildfire that took place in Los Angeles County in the year 2025. This fire was located near HC3M+67 Santa Clarita, CA, USA and burned an estimated 10425.0 acres. With coordinates at (34.553008, -118.56687), the fire posed a significant threat to nearby communities, natural habitats, and local infrastructure. Emergency response teams worked diligently to contain the spread and mitigate potential damage. Local authorities issued alerts to residents, urging them to take necessary precautions. Efforts such as firebreaks, controlled burns, and aerial firefighting were employed to limit its impact. While the fire was eventually brought under control, its effects highlighted the ongoing challenges posed by wildfires in the region."
    },
    {
        "id": "0434262e-c6ca-4232-a2b4-ad0f5589b036",
        "name": "Sepulveda Fire",
        "year": 2025,
        "county": "Los Angeles",
        "latitude": 34.0968,
        "longitude": -118.47541,
        "location": "3GWF+PR Los Angeles, CA, USA",
        "acres_burned": 45.0,
        "url": "https://cloudfront-us-east-1.images.arcpublishing.com/opb/TZOZ4CRMEFOKFAT7MLUCFRX6YM.jpg",
        "description": "The Sepulveda Fire was a wildfire that took place in Los Angeles County in the year 2025. This fire was located near 3GWF+PR Los Angeles, CA, USA and burned an estimated 45.0 acres. With coordinates at (34.0968, -118.47541), the fire posed a significant threat to nearby communities, natural habitats, and local infrastructure. Emergency response teams worked diligently to contain the spread and mitigate potential damage. Local authorities issued alerts to residents, urging them to take necessary precautions. Efforts such as firebreaks, controlled burns, and aerial firefighting were employed to limit its impact. While the fire was eventually brought under control, its effects highlighted the ongoing challenges posed by wildfires in the region."
    },
    {
        "id": "d45df9b2-8dc5-4d88-864b-f3a842c8a2fc",
        "name": "Laguna Fire",
        "year": 2025,
        "county": "Ventura",
        "latitude": 34.1655,
        "longitude": -119.059,
        "location": "5W8R+6C Camarillo, CA, USA",
        "acres_burned": 83.0,
        "url": "https://d.newsweek.com/en/full/2572136/fires-southern-california-laguna-fire.jpg?w=1600&h=1600&q=88&f=8d2475fac0df6dc7abddca4d45fc4745",
        "description": "The Laguna Fire was a wildfire that took place in Ventura County in the year 2025. This fire was located near 5W8R+6C Camarillo, CA, USA and burned an estimated 83.0 acres. With coordinates at (34.1655, -119.059), the fire posed a significant threat to nearby communities, natural habitats, and local infrastructure. Emergency response teams worked diligently to contain the spread and mitigate potential damage. Local authorities issued alerts to residents, urging them to take necessary precautions. Efforts such as firebreaks, controlled burns, and aerial firefighting were employed to limit its impact. While the fire was eventually brought under control, its effects highlighted the ongoing challenges posed by wildfires in the region."
    },
    {
        "id": "a9719e0a-db5d-48d4-895c-5b096ae1802d",
        "name": "Border 2 Fire",
        "year": 2025,
        "county": "San Diego",
        "latitude": 32.5947,
        "longitude": -116.8437,
        "location": "14495 Otay Lakes Rd, Dulzura, CA 91917, USA",
        "acres_burned": 6625.0,
        "url": "https://d.newsweek.com/en/full/2573199/cal-fire-map-border-fire-blaze.jpg",
        "description": "The Border 2 Fire was a wildfire that took place in San Diego County in the year 2025. This fire was located near 14495 Otay Lakes Rd, Dulzura, CA 91917, USA and burned an estimated 6625.0 acres. With coordinates at (32.5947, -116.8437), the fire posed a significant threat to nearby communities, natural habitats, and local infrastructure. Emergency response teams worked diligently to contain the spread and mitigate potential damage. Local authorities issued alerts to residents, urging them to take necessary precautions. Efforts such as firebreaks, controlled burns, and aerial firefighting were employed to limit its impact. While the fire was eventually brought under control, its effects highlighted the ongoing challenges posed by wildfires in the region."
    },
    {
        "id": "22ec23e5-b380-4ee4-942f-26c12a4576d7",
        "name": "Gilman Fire",
        "year": 2025,
        "county": "San Diego",
        "latitude": 32.8622,
        "longitude": -117.237,
        "location": "3115 Bremerton Pl, La Jolla, CA 92037, USA",
        "acres_burned": 2.0,
        "url": "https://media.cbs8.com/assets/KFMB/images/af64c2e8-25b3-41f1-94f5-7d3699121bc7/20250124T062258/af64c2e8-25b3-41f1-94f5-7d3699121bc7_1920x1080.jpg",
        "description": "The Gilman Fire was a wildfire that took place in San Diego County in the year 2025. This fire was located near 3115 Bremerton Pl, La Jolla, CA 92037, USA and burned an estimated 2.0 acres. With coordinates at (32.8622, -117.237), the fire posed a significant threat to nearby communities, natural habitats, and local infrastructure. Emergency response teams worked diligently to contain the spread and mitigate potential damage. Local authorities issued alerts to residents, urging them to take necessary precautions. Efforts such as firebreaks, controlled burns, and aerial firefighting were employed to limit its impact. While the fire was eventually brought under control, its effects highlighted the ongoing challenges posed by wildfires in the region."
    },
    {
        "id": "a79b51d3-9ae7-4ec3-a8ca-9f733b89df9a",
        "name": "Gibbel Fire",
        "year": 2025,
        "county": "Riverside",
        "latitude": 33.708601,
        "longitude": -116.964339,
        "location": "P25P+C7 Hemet, CA, USA",
        "acres_burned": 15.0,
        "url": "https://lookaside.fbsbx.com/lookaside/crawler/threads/DFMIfJbgRO5/0/image.jpg",
        "description": "The Gibbel Fire was a wildfire that took place in Riverside County in the year 2025. This fire was located near P25P+C7 Hemet, CA, USA and burned an estimated 15.0 acres. With coordinates at (33.708601, -116.964339), the fire posed a significant threat to nearby communities, natural habitats, and local infrastructure. Emergency response teams worked diligently to contain the spread and mitigate potential damage. Local authorities issued alerts to residents, urging them to take necessary precautions. Efforts such as firebreaks, controlled burns, and aerial firefighting were employed to limit its impact. While the fire was eventually brought under control, its effects highlighted the ongoing challenges posed by wildfires in the region."
    },
    {
        "id": "460e65e4-366e-46d1-8729-7d1756fca41a",
        "name": "Rosa Fire",
        "year": 2025,
        "county": "San Luis Obispo",
        "latitude": 35.303682,
        "longitude": -119.982524,
        "location": "13640 Soda Lake Rd, Santa Margarita, CA 93453, USA",
        "acres_burned": 105.0,
        "url": "https://static.temblor.net/wp-content/uploads/2018/04/California-Wildfire-Santa-Rosa-damage.jpg",
        "description": "The Rosa Fire was a wildfire that took place in San Luis Obispo County in the year 2025. This fire was located near 13640 Soda Lake Rd, Santa Margarita, CA 93453, USA and burned an estimated 105.0 acres. With coordinates at (35.303682, -119.982524), the fire posed a significant threat to nearby communities, natural habitats, and local infrastructure. Emergency response teams worked diligently to contain the spread and mitigate potential damage. Local authorities issued alerts to residents, urging them to take necessary precautions. Efforts such as firebreaks, controlled burns, and aerial firefighting were employed to limit its impact. While the fire was eventually brought under control, its effects highlighted the ongoing challenges posed by wildfires in the region."
    },
    {
        "id": "6d86f896-f2e9-4189-b816-239b65f58d26",
        "name": "Cross Fire",
        "year": 2025,
        "county": "Monterey",
        "latitude": 35.945458,
        "longitude": -121.117684,
        "location": "67375 Cross Rd, Lockwood, CA 93932, USA",
        "acres_burned": 16.1,
        "url": "https://pravoslavie.ru/sas/image/104513/451345.p.jpg?mtime=1736074610",
        "description": "The Cross Fire was a wildfire that took place in Monterey County in the year 2025. This fire was located near 67375 Cross Rd, Lockwood, CA 93932, USA and burned an estimated 16.1 acres. With coordinates at (35.945458, -121.117684), the fire posed a significant threat to nearby communities, natural habitats, and local infrastructure. Emergency response teams worked diligently to contain the spread and mitigate potential damage. Local authorities issued alerts to residents, urging them to take necessary precautions. Efforts such as firebreaks, controlled burns, and aerial firefighting were employed to limit its impact. While the fire was eventually brought under control, its effects highlighted the ongoing challenges posed by wildfires in the region."
    },
    {
        "id": "d49b7509-2632-4153-8252-ec4de0e385ff",
        "name": "Eaton Flood",
        "year": 2025,
        "county": "Los Angeles",
        "latitude": 34.2038707,
        "longitude": -118.1584203,
        "location": "3330 N Lincoln Ave, Altadena, CA 91001, USA",
        "acres_burned": 0.0,
        "url": "https://stateline.org/wp-content/uploads/2025/02/Wildfires-housing.jpg",
        "description": "The Eaton Flood was a wildfire that took place in Los Angeles County in the year 2025. This fire was located near 3330 N Lincoln Ave, Altadena, CA 91001, USA and burned an estimated 0.0 acres. With coordinates at (34.2038707, -118.1584203), the fire posed a significant threat to nearby communities, natural habitats, and local infrastructure. Emergency response teams worked diligently to contain the spread and mitigate potential damage. Local authorities issued alerts to residents, urging them to take necessary precautions. Efforts such as firebreaks, controlled burns, and aerial firefighting were employed to limit its impact. While the fire was eventually brought under control, its effects highlighted the ongoing challenges posed by wildfires in the region."
    },
    {
        "id": "06a7c71b-03ff-4c7b-aff8-1d8bcf3c9def",
        "name": "Penny Fire",
        "year": 2025,
        "county": "San Diego",
        "latitude": 32.922111,
        "longitude": -116.475667,
        "location": "WGCF+RP Pine Valley, CA, USA",
        "acres_burned": 9.0,
        "url": "https://insideclimatenews.org/wp-content/uploads/2024/09/GettyImages-1786025404.jpg",
        "description": "The Penny Fire was a wildfire that took place in San Diego County in the year 2025. This fire was located near WGCF+RP Pine Valley, CA, USA and burned an estimated 9.0 acres. With coordinates at (32.922111, -116.475667), the fire posed a significant threat to nearby communities, natural habitats, and local infrastructure. Emergency response teams worked diligently to contain the spread and mitigate potential damage. Local authorities issued alerts to residents, urging them to take necessary precautions. Efforts such as firebreaks, controlled burns, and aerial firefighting were employed to limit its impact. While the fire was eventually brought under control, its effects highlighted the ongoing challenges posed by wildfires in the region."
    },
    {
        "id": "c59146ec-ab73-416a-b66f-e4b568f5208a",
        "name": "Scout Fire",
        "year": 2025,
        "county": "San Diego",
        "latitude": 33.250188,
        "longitude": -116.688664,
        "location": "7826+3G Warner Springs, CA, USA",
        "acres_burned": 39.0,
        "url": "https://lookaside.fbsbx.com/lookaside/crawler/threads/DE0fR3tT7Cl/0/image.jpg",
        "description": "The Scout Fire was a wildfire that took place in San Diego County in the year 2025. This fire was located near 7826+3G Warner Springs, CA, USA and burned an estimated 39.0 acres. With coordinates at (33.250188, -116.688664), the fire posed a significant threat to nearby communities, natural habitats, and local infrastructure. Emergency response teams worked diligently to contain the spread and mitigate potential damage. Local authorities issued alerts to residents, urging them to take necessary precautions. Efforts such as firebreaks, controlled burns, and aerial firefighting were employed to limit its impact. While the fire was eventually brought under control, its effects highlighted the ongoing challenges posed by wildfires in the region."
    },
    {
        "id": "da0f58a2-b61c-4514-8439-c4ca4792718a",
        "name": "Palmas Fire",
        "year": 2024,
        "county": "Riverside",
        "latitude": 33.5103795,
        "longitude": -115.82784,
        "location": "G56C+5V Rancho Dos Palmas, CA, USA",
        "acres_burned": 239.0,
        "url": "https://media.cnn.com/api/v1/images/stellar/prod/230126114954-laguna-niguel-fire-2022-restricted.jpg?c=16x9&q=h_833,w_1480,c_fill",
        "description": "The Palmas Fire was a wildfire that took place in Riverside County in the year 2024. This fire was located near G56C+5V Rancho Dos Palmas, CA, USA and burned an estimated 239.0 acres. With coordinates at (33.5103795, -115.82784), the fire posed a significant threat to nearby communities, natural habitats, and local infrastructure. Emergency response teams worked diligently to contain the spread and mitigate potential damage. Local authorities issued alerts to residents, urging them to take necessary precautions. Efforts such as firebreaks, controlled burns, and aerial firefighting were employed to limit its impact. While the fire was eventually brought under control, its effects highlighted the ongoing challenges posed by wildfires in the region."
    },
    {
        "id": "c32fd360-9830-4ad1-9595-0b3a67257eba",
        "name": " Bryson Fire",
        "year": 2024,
        "county": "Monterey",
        "latitude": 35.81148,
        "longitude": -121.084104,
        "location": "76904 Bryson Hesperia Rd, Bradley, CA 93426, USA",
        "acres_burned": 11.0,
        "url": "https://media.gettyimages.com/id/2194803192/photo/beverly-hills-california-bryson-robinson-attends-the-pre-grammy-kickoff-and-fundraiser-for.jpg?s=612x612&w=gi&k=20&c=pAJ1m4K2yWjxihi-zwm7M2gZBIMKjBMYyBr6_ylMdxo=",
        "description": "The  Bryson Fire was a wildfire that took place in Monterey County in the year 2024. This fire was located near 76904 Bryson Hesperia Rd, Bradley, CA 93426, USA and burned an estimated 11.0 acres. With coordinates at (35.81148, -121.084104), the fire posed a significant threat to nearby communities, natural habitats, and local infrastructure. Emergency response teams worked diligently to contain the spread and mitigate potential damage. Local authorities issued alerts to residents, urging them to take necessary precautions. Efforts such as firebreaks, controlled burns, and aerial firefighting were employed to limit its impact. While the fire was eventually brought under control, its effects highlighted the ongoing challenges posed by wildfires in the region."
    },
    {
        "id": "22229c97-8035-4ba8-b1a2-1965107977ed",
        "name": "Cartago Fire",
        "year": 2024,
        "county": "Inyo",
        "latitude": 36.316401,
        "longitude": -118.026767,
        "location": "8X8F+H7 Cartago, CA, USA",
        "acres_burned": 104.0,
        "url": "https://lookaside.fbsbx.com/lookaside/crawler/threads/C6MCwlbL6nP/0/image.jpg",
        "description": "The Cartago Fire was a wildfire that took place in Inyo County in the year 2024. This fire was located near 8X8F+H7 Cartago, CA, USA and burned an estimated 104.0 acres. With coordinates at (36.316401, -118.026767), the fire posed a significant threat to nearby communities, natural habitats, and local infrastructure. Emergency response teams worked diligently to contain the spread and mitigate potential damage. Local authorities issued alerts to residents, urging them to take necessary precautions. Efforts such as firebreaks, controlled burns, and aerial firefighting were employed to limit its impact. While the fire was eventually brought under control, its effects highlighted the ongoing challenges posed by wildfires in the region."
    },
    {
        "id": "f7e0845c-7209-4a79-8368-7c8862383221",
        "name": "Marsh Fire",
        "year": 2024,
        "county": "Sacramento",
        "latitude": 38.05686,
        "longitude": -121.83332,
        "location": "3548+PM Pittsburg, CA, USA",
        "acres_burned": null,
        "url": "https://media.nbcbayarea.com/2020/08/MarshFire-SCC.jpg?quality=85&strip=all&resize=1200%2C675",
        "description": "The Marsh Fire was a wildfire that took place in Sacramento County in the year 2024. This fire was located near 3548+PM Pittsburg, CA, USA and burned an estimated None acres. With coordinates at (38.05686, -121.83332), the fire posed a significant threat to nearby communities, natural habitats, and local infrastructure. Emergency response teams worked diligently to contain the spread and mitigate potential damage. Local authorities issued alerts to residents, urging them to take necessary precautions. Efforts such as firebreaks, controlled burns, and aerial firefighting were employed to limit its impact. While the fire was eventually brought under control, its effects highlighted the ongoing challenges posed by wildfires in the region."
    },
    {
        "id": "0563714f-e479-41f8-a2b0-59cfacdeffe1",
        "name": "Gardner Fire",
        "year": 2024,
        "county": "Kern",
        "latitude": 35.153062,
        "longitude": -119.39529,
        "location": "5J33+6V Taft, CA, USA",
        "acres_burned": 241.0,
        "url": "https://people.com/thmb/NmOIxUwAJkFsTtugvZw0ZckmaE4=/1500x0/filters:no_upscale():max_bytes(150000):strip_icc():focal(715x381:717x383)/jennifer-gardner-california-fires-011025-3-1be5d35d8b3543879def663b654f79d0.jpg",
        "description": "The Gardner Fire was a wildfire that took place in Kern County in the year 2024. This fire was located near 5J33+6V Taft, CA, USA and burned an estimated 241.0 acres. With coordinates at (35.153062, -119.39529), the fire posed a significant threat to nearby communities, natural habitats, and local infrastructure. Emergency response teams worked diligently to contain the spread and mitigate potential damage. Local authorities issued alerts to residents, urging them to take necessary precautions. Efforts such as firebreaks, controlled burns, and aerial firefighting were employed to limit its impact. While the fire was eventually brought under control, its effects highlighted the ongoing challenges posed by wildfires in the region."
    },
    {
        "id": "df1a7e0d-7fc9-49af-be53-4e2d5b818411",
        "name": "Pendola Fire",
        "year": 2024,
        "county": "Yuba",
        "latitude": 39.494086,
        "longitude": -121.070752,
        "location": "FWVH+JM Weeds Point, CA, USA",
        "acres_burned": 18.0,
        "url": "https://i0.wp.com/wildfiretoday.com/wp-content/uploads/2021/03/Zogg-Fire-Sept.-27-2020.-CAL-FIRE-photo.jpg?resize=350%2C200&ssl=1",
        "description": "The Pendola Fire was a wildfire that took place in Yuba County in the year 2024. This fire was located near FWVH+JM Weeds Point, CA, USA and burned an estimated 18.0 acres. With coordinates at (39.494086, -121.070752), the fire posed a significant threat to nearby communities, natural habitats, and local infrastructure. Emergency response teams worked diligently to contain the spread and mitigate potential damage. Local authorities issued alerts to residents, urging them to take necessary precautions. Efforts such as firebreaks, controlled burns, and aerial firefighting were employed to limit its impact. While the fire was eventually brought under control, its effects highlighted the ongoing challenges posed by wildfires in the region."
    },
    {
        "id": "3ea940e2-abab-41a3-b073-6aa3ce6f8f72",
        "name": "York Fire",
        "year": 2024,
        "county": "Kings",
        "latitude": 35.817759,
        "longitude": -120.097738,
        "location": "RW92+4W Acebedo, CA, USA",
        "acres_burned": 181.4,
        "url": "https://media.cnn.com/api/v1/images/stellar/prod/230731231938-03-fire-whirls-california-nevada.jpg?q=w_1110,c_fill",
        "description": "The York Fire was a wildfire that took place in Kings County in the year 2024. This fire was located near RW92+4W Acebedo, CA, USA and burned an estimated 181.4 acres. With coordinates at (35.817759, -120.097738), the fire posed a significant threat to nearby communities, natural habitats, and local infrastructure. Emergency response teams worked diligently to contain the spread and mitigate potential damage. Local authorities issued alerts to residents, urging them to take necessary precautions. Efforts such as firebreaks, controlled burns, and aerial firefighting were employed to limit its impact. While the fire was eventually brought under control, its effects highlighted the ongoing challenges posed by wildfires in the region."
    },
    {
        "id": "ce64ef4a-565d-46db-b94c-b0436644cf7f",
        "name": "Refuge Fire",
        "year": 2024,
        "county": "Fresno",
        "latitude": 36.730979,
        "longitude": -120.360998,
        "location": "1900 W Panoche Rd, Mendota, CA 93640, USA",
        "acres_burned": 475.0,
        "url": "https://media-cldnry.s-nbcnews.com/image/upload/t_fit-760w,f_auto,q_auto:best/rockcms/2025-01/250109-california-wildfires-westwood-shelter-mn-1630-a96391.jpg",
        "description": "The Refuge Fire was a wildfire that took place in Fresno County in the year 2024. This fire was located near 1900 W Panoche Rd, Mendota, CA 93640, USA and burned an estimated 475.0 acres. With coordinates at (36.730979, -120.360998), the fire posed a significant threat to nearby communities, natural habitats, and local infrastructure. Emergency response teams worked diligently to contain the spread and mitigate potential damage. Local authorities issued alerts to residents, urging them to take necessary precautions. Efforts such as firebreaks, controlled burns, and aerial firefighting were employed to limit its impact. While the fire was eventually brought under control, its effects highlighted the ongoing challenges posed by wildfires in the region."
    },
    {
        "id": "deffd3c6-f488-48d9-8ec0-43cf23d26e44",
        "name": "Billy Fire",
        "year": 2024,
        "county": "Merced",
        "latitude": 37.020145,
        "longitude": -120.99063,
        "location": "17294 Billy Wright Rd, Los Banos, CA 93635, USA",
        "acres_burned": 12.0,
        "url": "https://i.guim.co.uk/img/media/78a44f2ffc10adfeb9e7283b7d31e4b397aba81a/0_0_4834_3179/master/4834.jpg?width=465&dpr=1&s=none&crop=none",
        "description": "The Billy Fire was a wildfire that took place in Merced County in the year 2024. This fire was located near 17294 Billy Wright Rd, Los Banos, CA 93635, USA and burned an estimated 12.0 acres. With coordinates at (37.020145, -120.99063), the fire posed a significant threat to nearby communities, natural habitats, and local infrastructure. Emergency response teams worked diligently to contain the spread and mitigate potential damage. Local authorities issued alerts to residents, urging them to take necessary precautions. Efforts such as firebreaks, controlled burns, and aerial firefighting were employed to limit its impact. While the fire was eventually brought under control, its effects highlighted the ongoing challenges posed by wildfires in the region."
    },
    {
        "id": "9aeb7f9d-3672-400d-ba4e-2b490220f78d",
        "name": "School Fire",
        "year": 2024,
        "county": "Kern",
        "latitude": 35.04847,
        "longitude": -119.33179,
        "location": "2MX9+97 Pentland, CA, USA",
        "acres_burned": 1479.0,
        "url": "https://i.abcnewsfe.com/a/d5475bad-f32d-4c72-af38-e5ef858afd9d/calif-fire4-gty-ml-250109_1736428331309_hpMain_16x9.jpg?w=992",
        "description": "The School Fire was a wildfire that took place in Kern County in the year 2024. This fire was located near 2MX9+97 Pentland, CA, USA and burned an estimated 1479.0 acres. With coordinates at (35.04847, -119.33179), the fire posed a significant threat to nearby communities, natural habitats, and local infrastructure. Emergency response teams worked diligently to contain the spread and mitigate potential damage. Local authorities issued alerts to residents, urging them to take necessary precautions. Efforts such as firebreaks, controlled burns, and aerial firefighting were employed to limit its impact. While the fire was eventually brought under control, its effects highlighted the ongoing challenges posed by wildfires in the region."
    },
    {
        "id": "b24e4e25-08ed-410b-87bc-4222a507158b",
        "name": "Dawn Fire",
        "year": 2024,
        "county": "Kern",
        "latitude": 34.9117,
        "longitude": -118.23,
        "location": "WQ69+MX Rosamond, CA, USA",
        "acres_burned": 12.8,
        "url": "https://media.fishreports.com/reports/img-20230628-e9351e98.jpg",
        "description": "The Dawn Fire was a wildfire that took place in Kern County in the year 2024. This fire was located near WQ69+MX Rosamond, CA, USA and burned an estimated 12.8 acres. With coordinates at (34.9117, -118.23), the fire posed a significant threat to nearby communities, natural habitats, and local infrastructure. Emergency response teams worked diligently to contain the spread and mitigate potential damage. Local authorities issued alerts to residents, urging them to take necessary precautions. Efforts such as firebreaks, controlled burns, and aerial firefighting were employed to limit its impact. While the fire was eventually brought under control, its effects highlighted the ongoing challenges posed by wildfires in the region."
    },
    {
        "id": "4aad6061-4f7d-4a62-b441-255a9c53b43e",
        "name": "Tram Fire",
        "year": 2024,
        "county": "Riverside",
        "latitude": 33.858369,
        "longitude": -116.55819,
        "location": "2901 N Palm Canyon Dr, Palm Springs, CA 92262, USA",
        "acres_burned": 13.8,
        "url": "https://cdn.abcotvs.com/dip/images/14712992_042224-wpvi-universal-tram-crash-4a-vo-video-vid.jpg",
        "description": "The Tram Fire was a wildfire that took place in Riverside County in the year 2024. This fire was located near 2901 N Palm Canyon Dr, Palm Springs, CA 92262, USA and burned an estimated 13.8 acres. With coordinates at (33.858369, -116.55819), the fire posed a significant threat to nearby communities, natural habitats, and local infrastructure. Emergency response teams worked diligently to contain the spread and mitigate potential damage. Local authorities issued alerts to residents, urging them to take necessary precautions. Efforts such as firebreaks, controlled burns, and aerial firefighting were employed to limit its impact. While the fire was eventually brought under control, its effects highlighted the ongoing challenges posed by wildfires in the region."
    },
    {
        "id": "af6e0e0e-af49-4dbf-98c9-c36b1028eed7",
        "name": "Virginiatown Fire",
        "year": 2024,
        "county": "Placer",
        "latitude": 38.902253,
        "longitude": -121.201005,
        "location": "5540 Virginiatown Rd, Newcastle, CA 95658, USA",
        "acres_burned": 95.0,
        "url": "https://upload.wikimedia.org/wikipedia/commons/c/c2/Virginiatown-new-plaque.jpg",
        "description": "The Virginiatown Fire was a wildfire that took place in Placer County in the year 2024. This fire was located near 5540 Virginiatown Rd, Newcastle, CA 95658, USA and burned an estimated 95.0 acres. With coordinates at (38.902253, -121.201005), the fire posed a significant threat to nearby communities, natural habitats, and local infrastructure. Emergency response teams worked diligently to contain the spread and mitigate potential damage. Local authorities issued alerts to residents, urging them to take necessary precautions. Efforts such as firebreaks, controlled burns, and aerial firefighting were employed to limit its impact. While the fire was eventually brought under control, its effects highlighted the ongoing challenges posed by wildfires in the region."
    },
    {
        "id": "d9d67720-8b28-47d1-a05d-3033c70b73a3",
        "name": "Magnolia Fire",
        "year": 2024,
        "county": "Riverside",
        "latitude": 33.9208,
        "longitude": -116.807061,
        "location": "W5CV+85 Cabazon, CA, USA",
        "acres_burned": 36.6,
        "url": "https://cdn.abcotvs.com/dip/images/13855412_100223-ktrk-magnolia-house-fire-arrest-desi-img2.jpg",
        "description": "The Magnolia Fire was a wildfire that took place in Riverside County in the year 2024. This fire was located near W5CV+85 Cabazon, CA, USA and burned an estimated 36.6 acres. With coordinates at (33.9208, -116.807061), the fire posed a significant threat to nearby communities, natural habitats, and local infrastructure. Emergency response teams worked diligently to contain the spread and mitigate potential damage. Local authorities issued alerts to residents, urging them to take necessary precautions. Efforts such as firebreaks, controlled burns, and aerial firefighting were employed to limit its impact. While the fire was eventually brought under control, its effects highlighted the ongoing challenges posed by wildfires in the region."
    },
    {
        "id": "48e43173-82a0-4573-b842-06bec1d05ee5",
        "name": "Almond Fire",
        "year": 2024,
        "county": "Riverside",
        "latitude": 33.903392,
        "longitude": -116.774124,
        "location": "50496 Esperanza Ave, Cabazon, CA 92230, USA",
        "acres_burned": 40.0,
        "url": "https://lookaside.fbsbx.com/lookaside/crawler/threads/DEo6Yw5M8l8/0/image.jpg",
        "description": "The Almond Fire was a wildfire that took place in Riverside County in the year 2024. This fire was located near 50496 Esperanza Ave, Cabazon, CA 92230, USA and burned an estimated 40.0 acres. With coordinates at (33.903392, -116.774124), the fire posed a significant threat to nearby communities, natural habitats, and local infrastructure. Emergency response teams worked diligently to contain the spread and mitigate potential damage. Local authorities issued alerts to residents, urging them to take necessary precautions. Efforts such as firebreaks, controlled burns, and aerial firefighting were employed to limit its impact. While the fire was eventually brought under control, its effects highlighted the ongoing challenges posed by wildfires in the region."
    },
    {
        "id": "c4439647-cf64-4a5f-bec1-3a228d5249f2",
        "name": "Sherwood Fire",
        "year": 2024,
        "county": "Kern",
        "latitude": 35.7193,
        "longitude": -118.9429,
        "location": "P394+PR Woody, CA, USA",
        "acres_burned": 353.0,
        "url": "https://cdn.abcotvs.com/dip/images/1426087_071316-kabc-sherwood-fire1.jpg",
        "description": "The Sherwood Fire was a wildfire that took place in Kern County in the year 2024. This fire was located near P394+PR Woody, CA, USA and burned an estimated 353.0 acres. With coordinates at (35.7193, -118.9429), the fire posed a significant threat to nearby communities, natural habitats, and local infrastructure. Emergency response teams worked diligently to contain the spread and mitigate potential damage. Local authorities issued alerts to residents, urging them to take necessary precautions. Efforts such as firebreaks, controlled burns, and aerial firefighting were employed to limit its impact. While the fire was eventually brought under control, its effects highlighted the ongoing challenges posed by wildfires in the region."
    },
    {
        "id": "7f75a7b7-f2dc-4817-b321-bb570f6b4991",
        "name": "Dom Fire",
        "year": 2024,
        "county": "Fresno",
        "latitude": 36.362559,
        "longitude": -120.340061,
        "location": "9M75+2X Giffen Cantua Ranch, CA, USA",
        "acres_burned": 23.8,
        "url": "https://www.usatoday.com/gcdn/authoring/authoring-images/2024/11/06/PVCS/76097771007-moutain-fire-dom-1.jpg?crop=5148,2897,x0,y181&width=660&height=371&format=pjpg&auto=webp",
        "description": "The Dom Fire was a wildfire that took place in Fresno County in the year 2024. This fire was located near 9M75+2X Giffen Cantua Ranch, CA, USA and burned an estimated 23.8 acres. With coordinates at (36.362559, -120.340061), the fire posed a significant threat to nearby communities, natural habitats, and local infrastructure. Emergency response teams worked diligently to contain the spread and mitigate potential damage. Local authorities issued alerts to residents, urging them to take necessary precautions. Efforts such as firebreaks, controlled burns, and aerial firefighting were employed to limit its impact. While the fire was eventually brought under control, its effects highlighted the ongoing challenges posed by wildfires in the region."
    },
    {
        "id": "6605381c-d5d9-4dde-866b-ac56c51dccb1",
        "name": "Jayne Fire",
        "year": 2024,
        "county": "Fresno",
        "latitude": 36.137571,
        "longitude": -120.192362,
        "location": "21485 I-5BL, Coalinga, CA 93210, USA",
        "acres_burned": 40.0,
        "url": "https://katu.com/resources/media2/16x9/full/1015/center/80/d7b13408-fbe4-4a49-9e94-31c336562fa7-071023_calif_wildfire_2.jpg",
        "description": "The Jayne Fire was a wildfire that took place in Fresno County in the year 2024. This fire was located near 21485 I-5BL, Coalinga, CA 93210, USA and burned an estimated 40.0 acres. With coordinates at (36.137571, -120.192362), the fire posed a significant threat to nearby communities, natural habitats, and local infrastructure. Emergency response teams worked diligently to contain the spread and mitigate potential damage. Local authorities issued alerts to residents, urging them to take necessary precautions. Efforts such as firebreaks, controlled burns, and aerial firefighting were employed to limit its impact. While the fire was eventually brought under control, its effects highlighted the ongoing challenges posed by wildfires in the region."
    },
    {
        "id": "89242de3-daa9-449d-a350-36832b8579d7",
        "name": "Border 44 Fire",
        "year": 2024,
        "county": "San Diego",
        "latitude": 32.571374,
        "longitude": -116.711161,
        "location": "H7CQ+GG Barrett Junction, CA, USA",
        "acres_burned": 15.0,
        "url": "https://i0.wp.com/wildfiretoday.com/wp-content/uploads/2019/08/BorderFireOtayCam_544pmPDT_8-14.jpg?ssl=1",
        "description": "The Border 44 Fire was a wildfire that took place in San Diego County in the year 2024. This fire was located near H7CQ+GG Barrett Junction, CA, USA and burned an estimated 15.0 acres. With coordinates at (32.571374, -116.711161), the fire posed a significant threat to nearby communities, natural habitats, and local infrastructure. Emergency response teams worked diligently to contain the spread and mitigate potential damage. Local authorities issued alerts to residents, urging them to take necessary precautions. Efforts such as firebreaks, controlled burns, and aerial firefighting were employed to limit its impact. While the fire was eventually brought under control, its effects highlighted the ongoing challenges posed by wildfires in the region."
    },
    {
        "id": "c137330e-e0b9-4d93-b22b-835a1fb547e7",
        "name": "Red Fire",
        "year": 2024,
        "county": "San Bernardino",
        "latitude": 35.388107,
        "longitude": -117.601135,
        "location": "62505 Trona Rd, Johannesburg, CA 93528, USA",
        "acres_burned": 148.0,
        "url": "https://www.dailynews.com/wp-content/uploads/2025/01/AP25008142636991-2.jpg?w=525",
        "description": "The Red Fire was a wildfire that took place in San Bernardino County in the year 2024. This fire was located near 62505 Trona Rd, Johannesburg, CA 93528, USA and burned an estimated 148.0 acres. With coordinates at (35.388107, -117.601135), the fire posed a significant threat to nearby communities, natural habitats, and local infrastructure. Emergency response teams worked diligently to contain the spread and mitigate potential damage. Local authorities issued alerts to residents, urging them to take necessary precautions. Efforts such as firebreaks, controlled burns, and aerial firefighting were employed to limit its impact. While the fire was eventually brought under control, its effects highlighted the ongoing challenges posed by wildfires in the region."
    },
    {
        "id": "3ee4788b-f658-415c-879a-a11f00d10d77",
        "name": "National Fire",
        "year": 2024,
        "county": "San Bernardino",
        "latitude": 34.602884,
        "longitude": -117.339379,
        "location": "19499 1st St, Oro Grande, CA 92368, USA",
        "acres_burned": 80.0,
        "url": "https://media.defense.gov/2021/Aug/19/2002835124/1920/1080/0/210816-Z-A3568-1001.JPG",
        "description": "The National Fire was a wildfire that took place in San Bernardino County in the year 2024. This fire was located near 19499 1st St, Oro Grande, CA 92368, USA and burned an estimated 80.0 acres. With coordinates at (34.602884, -117.339379), the fire posed a significant threat to nearby communities, natural habitats, and local infrastructure. Emergency response teams worked diligently to contain the spread and mitigate potential damage. Local authorities issued alerts to residents, urging them to take necessary precautions. Efforts such as firebreaks, controlled burns, and aerial firefighting were employed to limit its impact. While the fire was eventually brought under control, its effects highlighted the ongoing challenges posed by wildfires in the region."
    },
    {
        "id": "dcf00ad9-98e6-44c8-b5f3-9693133814c5",
        "name": "Love 2 Fire",
        "year": 2024,
        "county": "San Diego",
        "latitude": 32.7754088,
        "longitude": -116.8004,
        "location": "Q5GX+5R Alpine, CA, USA",
        "acres_burned": 18.0,
        "url": "https://i.ytimg.com/vi/JV8Nw8TzACc/maxresdefault.jpg",
        "description": "The Love 2 Fire was a wildfire that took place in San Diego County in the year 2024. This fire was located near Q5GX+5R Alpine, CA, USA and burned an estimated 18.0 acres. With coordinates at (32.7754088, -116.8004), the fire posed a significant threat to nearby communities, natural habitats, and local infrastructure. Emergency response teams worked diligently to contain the spread and mitigate potential damage. Local authorities issued alerts to residents, urging them to take necessary precautions. Efforts such as firebreaks, controlled burns, and aerial firefighting were employed to limit its impact. While the fire was eventually brought under control, its effects highlighted the ongoing challenges posed by wildfires in the region."
    },
    {
        "id": "0e7ec8f8-87e5-4a70-9369-08b96059d3eb",
        "name": "Janell Fire",
        "year": 2024,
        "county": "Riverside",
        "latitude": 33.471139,
        "longitude": -116.8539685,
        "location": "46437 Cahuilla Rd, Aguanga, CA 92536, USA",
        "acres_burned": 13.6,
        "url": "https://l450v.alamy.com/450v/2yjwxr7/us-marine-corps-recruits-with-kilo-company-3rd-recruit-training-battalion-conduct-the-table-one-course-of-fire-at-marine-corps-base-camp-pendleton-california-nov-6-2024-table-one-covers-the-basic-fundamentals-of-marksmanship-and-rifle-safety-in-all-shooting-positions-sitting-kneeling-and-the-prone-us-marine-corps-photo-by-lance-cpl-janell-b-alvarez-2yjwxr7.jpg",
        "description": "The Janell Fire was a wildfire that took place in Riverside County in the year 2024. This fire was located near 46437 Cahuilla Rd, Aguanga, CA 92536, USA and burned an estimated 13.6 acres. With coordinates at (33.471139, -116.8539685), the fire posed a significant threat to nearby communities, natural habitats, and local infrastructure. Emergency response teams worked diligently to contain the spread and mitigate potential damage. Local authorities issued alerts to residents, urging them to take necessary precautions. Efforts such as firebreaks, controlled burns, and aerial firefighting were employed to limit its impact. While the fire was eventually brought under control, its effects highlighted the ongoing challenges posed by wildfires in the region."
    },
    {
        "id": "94509745-c6c6-412e-8767-2b511381fe84",
        "name": "John Fire",
        "year": 2024,
        "county": "Merced",
        "latitude": 37.244144,
        "longitude": -120.652034,
        "location": "9009 S Bert Crane Rd, Atwater, CA 95301, USA",
        "acres_burned": 12.0,
        "url": "https://www.cafirefoundation.org/what-we-do/for-firefighters-and-families/california-firefighters-memorial/search-fallen/r/bio-photo/Ruedy,%20John.JPG",
        "description": "The John Fire was a wildfire that took place in Merced County in the year 2024. This fire was located near 9009 S Bert Crane Rd, Atwater, CA 95301, USA and burned an estimated 12.0 acres. With coordinates at (37.244144, -120.652034), the fire posed a significant threat to nearby communities, natural habitats, and local infrastructure. Emergency response teams worked diligently to contain the spread and mitigate potential damage. Local authorities issued alerts to residents, urging them to take necessary precautions. Efforts such as firebreaks, controlled burns, and aerial firefighting were employed to limit its impact. While the fire was eventually brought under control, its effects highlighted the ongoing challenges posed by wildfires in the region."
    },
    {
        "id": "190200af-43ff-4874-8cd0-ea681b1582ae",
        "name": "Cow Fire",
        "year": 2024,
        "county": "Kern",
        "latitude": 35.4759526,
        "longitude": -118.7503007,
        "location": "F6GX+9V Bakersfield, CA, USA",
        "acres_burned": 132.0,
        "url": "http://media.wired.com/photos/62df2bf658719fe5c578eb77/master/pass/Wildfires-Yosemite-Livestock-Science-1242088846.jpg",
        "description": "The Cow Fire was a wildfire that took place in Kern County in the year 2024. This fire was located near F6GX+9V Bakersfield, CA, USA and burned an estimated 132.0 acres. With coordinates at (35.4759526, -118.7503007), the fire posed a significant threat to nearby communities, natural habitats, and local infrastructure. Emergency response teams worked diligently to contain the spread and mitigate potential damage. Local authorities issued alerts to residents, urging them to take necessary precautions. Efforts such as firebreaks, controlled burns, and aerial firefighting were employed to limit its impact. While the fire was eventually brought under control, its effects highlighted the ongoing challenges posed by wildfires in the region."
    },
    {
        "id": "9c4b2458-d757-41c0-86cb-9cec1e9b4f83",
        "name": "Ranch Fire",
        "year": 2024,
        "county": "Butte",
        "latitude": 39.693268,
        "longitude": -121.449913,
        "location": "5353 Newsome Ranch Rd, Oroville, CA 95965, USA",
        "acres_burned": 10.0,
        "url": "https://i0.wp.com/wildfiretoday.com/wp-content/uploads/2018/08/Mendo_231amPDT_8-27.jpg?ssl=1",
        "description": "The Ranch Fire was a wildfire that took place in Butte County in the year 2024. This fire was located near 5353 Newsome Ranch Rd, Oroville, CA 95965, USA and burned an estimated 10.0 acres. With coordinates at (39.693268, -121.449913), the fire posed a significant threat to nearby communities, natural habitats, and local infrastructure. Emergency response teams worked diligently to contain the spread and mitigate potential damage. Local authorities issued alerts to residents, urging them to take necessary precautions. Efforts such as firebreaks, controlled burns, and aerial firefighting were employed to limit its impact. While the fire was eventually brought under control, its effects highlighted the ongoing challenges posed by wildfires in the region."
    },
    {
        "id": "75070ec5-7169-459d-a57e-cb39f1768062",
        "name": "Idria Fire",
        "year": 2024,
        "county": "San Benito",
        "latitude": 36.490486,
        "longitude": -120.801731,
        "location": "2511 New Idria Rd, Paicines, CA 95043, USA",
        "acres_burned": 29.0,
        "url": "https://sanbenito.com/wp-content/uploads/sites/23/2010/08/bed937b06f7c7f986c8e57bc76c70abd.jpg",
        "description": "The Idria Fire was a wildfire that took place in San Benito County in the year 2024. This fire was located near 2511 New Idria Rd, Paicines, CA 95043, USA and burned an estimated 29.0 acres. With coordinates at (36.490486, -120.801731), the fire posed a significant threat to nearby communities, natural habitats, and local infrastructure. Emergency response teams worked diligently to contain the spread and mitigate potential damage. Local authorities issued alerts to residents, urging them to take necessary precautions. Efforts such as firebreaks, controlled burns, and aerial firefighting were employed to limit its impact. While the fire was eventually brought under control, its effects highlighted the ongoing challenges posed by wildfires in the region."
    },
    {
        "id": "37e3db45-6b25-4f7b-a92b-84f10d197437",
        "name": "Petrol Fire",
        "year": 2024,
        "county": "Fresno",
        "latitude": 36.2748148,
        "longitude": -120.33456,
        "location": "7MF8+W5 Coalinga, CA, USA",
        "acres_burned": 186.0,
        "url": "https://news.virginia.edu/sites/default/files/Header-SF-CAFires-CAGOVERNOR.jpg",
        "description": "The Petrol Fire was a wildfire that took place in Fresno County in the year 2024. This fire was located near 7MF8+W5 Coalinga, CA, USA and burned an estimated 186.0 acres. With coordinates at (36.2748148, -120.33456), the fire posed a significant threat to nearby communities, natural habitats, and local infrastructure. Emergency response teams worked diligently to contain the spread and mitigate potential damage. Local authorities issued alerts to residents, urging them to take necessary precautions. Efforts such as firebreaks, controlled burns, and aerial firefighting were employed to limit its impact. While the fire was eventually brought under control, its effects highlighted the ongoing challenges posed by wildfires in the region."
    },
    {
        "id": "842042fa-04d9-49b2-af6e-92143b21ebb1",
        "name": "Roberts Fire",
        "year": 2024,
        "county": "Monterey",
        "latitude": 35.829559,
        "longitude": -120.811491,
        "location": "R5HQ+RC Bradley, CA, USA",
        "acres_burned": null,
        "url": "https://api.army.mil/e2/c/images/2022/05/24/1ce18dcb/original.jpg",
        "description": "The Roberts Fire was a wildfire that took place in Monterey County in the year 2024. This fire was located near R5HQ+RC Bradley, CA, USA and burned an estimated None acres. With coordinates at (35.829559, -120.811491), the fire posed a significant threat to nearby communities, natural habitats, and local infrastructure. Emergency response teams worked diligently to contain the spread and mitigate potential damage. Local authorities issued alerts to residents, urging them to take necessary precautions. Efforts such as firebreaks, controlled burns, and aerial firefighting were employed to limit its impact. While the fire was eventually brought under control, its effects highlighted the ongoing challenges posed by wildfires in the region."
    },
    {
        "id": "49095c12-ea76-4ac6-8034-ff1da7b6c03f",
        "name": "Mission Fire",
        "year": 2024,
        "county": "Riverside",
        "latitude": 33.984278,
        "longitude": -116.583317,
        "location": "60500 Mission Creek Rd, Whitewater, CA 92282, USA",
        "acres_burned": 27.0,
        "url": "https://californiamissionsfoundation.org/wp-content/uploads/2020/07/Mission-Santa-Clara-on-Fire-1926.jpg",
        "description": "The Mission Fire was a wildfire that took place in Riverside County in the year 2024. This fire was located near 60500 Mission Creek Rd, Whitewater, CA 92282, USA and burned an estimated 27.0 acres. With coordinates at (33.984278, -116.583317), the fire posed a significant threat to nearby communities, natural habitats, and local infrastructure. Emergency response teams worked diligently to contain the spread and mitigate potential damage. Local authorities issued alerts to residents, urging them to take necessary precautions. Efforts such as firebreaks, controlled burns, and aerial firefighting were employed to limit its impact. While the fire was eventually brought under control, its effects highlighted the ongoing challenges posed by wildfires in the region."
    },
    {
        "id": "b7ca9cee-f5e3-4d5c-afd0-19ade7b24ba9",
        "name": "Wind Fire",
        "year": 2024,
        "county": "Kern",
        "latitude": 34.96545,
        "longitude": -118.99692,
        "location": "X283+56 Wheeler Ridge, CA, USA",
        "acres_burned": 121.0,
        "url": "https://i.guim.co.uk/img/media/6adc5b690c93ecae5f52e1e83120f63c8fdc8312/0_282_7427_4459/master/7427.jpg?width=465&dpr=1&s=none&crop=none",
        "description": "The Wind Fire was a wildfire that took place in Kern County in the year 2024. This fire was located near X283+56 Wheeler Ridge, CA, USA and burned an estimated 121.0 acres. With coordinates at (34.96545, -118.99692), the fire posed a significant threat to nearby communities, natural habitats, and local infrastructure. Emergency response teams worked diligently to contain the spread and mitigate potential damage. Local authorities issued alerts to residents, urging them to take necessary precautions. Efforts such as firebreaks, controlled burns, and aerial firefighting were employed to limit its impact. While the fire was eventually brought under control, its effects highlighted the ongoing challenges posed by wildfires in the region."
    },
    {
        "id": "d52efcc5-01bb-4f2e-b838-7599a1f17c14",
        "name": "Hall Fire",
        "year": 2024,
        "county": "Tehama",
        "latitude": 40.014819,
        "longitude": -122.129559,
        "location": "7599 Hall Rd, Corning, CA 96021, USA",
        "acres_burned": 12.0,
        "url": "https://www.gov.ca.gov/wp-content/uploads/2024/12/Inductees-Post-1.jpg",
        "description": "The Hall Fire was a wildfire that took place in Tehama County in the year 2024. This fire was located near 7599 Hall Rd, Corning, CA 96021, USA and burned an estimated 12.0 acres. With coordinates at (40.014819, -122.129559), the fire posed a significant threat to nearby communities, natural habitats, and local infrastructure. Emergency response teams worked diligently to contain the spread and mitigate potential damage. Local authorities issued alerts to residents, urging them to take necessary precautions. Efforts such as firebreaks, controlled burns, and aerial firefighting were employed to limit its impact. While the fire was eventually brought under control, its effects highlighted the ongoing challenges posed by wildfires in the region."
    },
    {
        "id": "2578f6da-a787-4269-818d-c1616b35de18",
        "name": "Elk Fire",
        "year": 2024,
        "county": "Glenn",
        "latitude": 39.598771,
        "longitude": -122.476758,
        "location": "3940 CA-162, Willows, CA 95988, USA",
        "acres_burned": 19.0,
        "url": "https://www.sacbee.com/latest-news/665epg/picture264435576/alternates/LANDSCAPE_1140/cdWsjFbBgO0mrqvw.jpg",
        "description": "The Elk Fire was a wildfire that took place in Glenn County in the year 2024. This fire was located near 3940 CA-162, Willows, CA 95988, USA and burned an estimated 19.0 acres. With coordinates at (39.598771, -122.476758), the fire posed a significant threat to nearby communities, natural habitats, and local infrastructure. Emergency response teams worked diligently to contain the spread and mitigate potential damage. Local authorities issued alerts to residents, urging them to take necessary precautions. Efforts such as firebreaks, controlled burns, and aerial firefighting were employed to limit its impact. While the fire was eventually brought under control, its effects highlighted the ongoing challenges posed by wildfires in the region."
    },
    {
        "id": "9967523f-061a-477c-9142-9660e9920a6b",
        "name": "Valley Fire",
        "year": 2024,
        "county": "Modoc",
        "latitude": 41.2449,
        "longitude": -120.31,
        "location": "6MVQ+XX Flourney, CA, USA",
        "acres_burned": 536.0,
        "url": "https://upload.wikimedia.org/wikipedia/commons/a/a0/Valley_Fire_California_CALFIRE.jpg",
        "description": "The Valley Fire was a wildfire that took place in Modoc County in the year 2024. This fire was located near 6MVQ+XX Flourney, CA, USA and burned an estimated 536.0 acres. With coordinates at (41.2449, -120.31), the fire posed a significant threat to nearby communities, natural habitats, and local infrastructure. Emergency response teams worked diligently to contain the spread and mitigate potential damage. Local authorities issued alerts to residents, urging them to take necessary precautions. Efforts such as firebreaks, controlled burns, and aerial firefighting were employed to limit its impact. While the fire was eventually brought under control, its effects highlighted the ongoing challenges posed by wildfires in the region."
    },
    {
        "id": "9fdbe919-5581-44a9-aaf6-307037193995",
        "name": "Knolls Fire",
        "year": 2024,
        "county": "San Diego",
        "latitude": 33.02113,
        "longitude": -117.170895,
        "location": "16790 Santa Fe Knolls Ln, San Diego, CA 92127, USA",
        "acres_burned": 17.0,
        "url": "https://www.simivalleyacorn.com/wp-content/uploads/images/2014-10-17/1p1.jpg",
        "description": "The Knolls Fire was a wildfire that took place in San Diego County in the year 2024. This fire was located near 16790 Santa Fe Knolls Ln, San Diego, CA 92127, USA and burned an estimated 17.0 acres. With coordinates at (33.02113, -117.170895), the fire posed a significant threat to nearby communities, natural habitats, and local infrastructure. Emergency response teams worked diligently to contain the spread and mitigate potential damage. Local authorities issued alerts to residents, urging them to take necessary precautions. Efforts such as firebreaks, controlled burns, and aerial firefighting were employed to limit its impact. While the fire was eventually brought under control, its effects highlighted the ongoing challenges posed by wildfires in the region."
    },
    {
        "id": "198dd536-7be9-44ca-b300-763e8927737c",
        "name": "Seven Fire",
        "year": 2024,
        "county": "Butte",
        "latitude": 39.539678,
        "longitude": -121.908346,
        "location": "7 Mile Rd, Chico, CA 95928, USA",
        "acres_burned": 11.0,
        "url": "https://eoimages.gsfc.nasa.gov/images/imagerecords/153000/153300/linefirezm_oli_20240909.jpg",
        "description": "The Seven Fire was a wildfire that took place in Butte County in the year 2024. This fire was located near 7 Mile Rd, Chico, CA 95928, USA and burned an estimated 11.0 acres. With coordinates at (39.539678, -121.908346), the fire posed a significant threat to nearby communities, natural habitats, and local infrastructure. Emergency response teams worked diligently to contain the spread and mitigate potential damage. Local authorities issued alerts to residents, urging them to take necessary precautions. Efforts such as firebreaks, controlled burns, and aerial firefighting were employed to limit its impact. While the fire was eventually brought under control, its effects highlighted the ongoing challenges posed by wildfires in the region."
    },
    {
        "id": "72e46bd8-232b-45c0-a715-46fec070b9e1",
        "name": "Panoche Fire",
        "year": 2024,
        "county": "San Benito",
        "latitude": 36.5097274,
        "longitude": -120.8471351,
        "location": "G553+V4 Panoche, CA, USA",
        "acres_burned": 191.0,
        "url": "https://sanbenito.com/wp-content/uploads/sites/23/2018/06/WILDFIRE-SAN-BENITO.jpg",
        "description": "The Panoche Fire was a wildfire that took place in San Benito County in the year 2024. This fire was located near G553+V4 Panoche, CA, USA and burned an estimated 191.0 acres. With coordinates at (36.5097274, -120.8471351), the fire posed a significant threat to nearby communities, natural habitats, and local infrastructure. Emergency response teams worked diligently to contain the spread and mitigate potential damage. Local authorities issued alerts to residents, urging them to take necessary precautions. Efforts such as firebreaks, controlled burns, and aerial firefighting were employed to limit its impact. While the fire was eventually brought under control, its effects highlighted the ongoing challenges posed by wildfires in the region."
    },
    {
        "id": "f4fa469d-e2bd-41e7-bc84-86372acdcd44",
        "name": "Harford Fire",
        "year": 2024,
        "county": "Riverside",
        "latitude": 33.812223,
        "longitude": -117.340976,
        "location": "21201 Harford Pk Ln, Perris, CA 92570, USA",
        "acres_burned": 18.0,
        "url": "https://tlblog.org/wp-content/uploads/2023/06/Hartford.jpg",
        "description": "The Harford Fire was a wildfire that took place in Riverside County in the year 2024. This fire was located near 21201 Harford Pk Ln, Perris, CA 92570, USA and burned an estimated 18.0 acres. With coordinates at (33.812223, -117.340976), the fire posed a significant threat to nearby communities, natural habitats, and local infrastructure. Emergency response teams worked diligently to contain the spread and mitigate potential damage. Local authorities issued alerts to residents, urging them to take necessary precautions. Efforts such as firebreaks, controlled burns, and aerial firefighting were employed to limit its impact. While the fire was eventually brought under control, its effects highlighted the ongoing challenges posed by wildfires in the region."
    },
    {
        "id": "dd8e4500-bd34-4dea-acde-fd1b4ff00ca3",
        "name": "Shirleon Fire",
        "year": 2024,
        "county": "Riverside",
        "latitude": 33.895775,
        "longitude": -116.901498,
        "location": "Old Idyllwild Rd, Banning, CA 92220, USA",
        "acres_burned": 34.0,
        "url": "https://patch.com/img/cdn20/users/23735283/20240530/012648/styles/patch_image/public/patch-stock-california-wildfire-fire-ca-schiavone-2020-2___30012525386.jpg",
        "description": "The Shirleon Fire was a wildfire that took place in Riverside County in the year 2024. This fire was located near Old Idyllwild Rd, Banning, CA 92220, USA and burned an estimated 34.0 acres. With coordinates at (33.895775, -116.901498), the fire posed a significant threat to nearby communities, natural habitats, and local infrastructure. Emergency response teams worked diligently to contain the spread and mitigate potential damage. Local authorities issued alerts to residents, urging them to take necessary precautions. Efforts such as firebreaks, controlled burns, and aerial firefighting were employed to limit its impact. While the fire was eventually brought under control, its effects highlighted the ongoing challenges posed by wildfires in the region."
    },
    {
        "id": "159367fb-6bee-4914-8815-84f629994473",
        "name": "Holiday Fire",
        "year": 2024,
        "county": "Kern",
        "latitude": 34.8492868,
        "longitude": -118.2554355,
        "location": "6798 Holiday Ave, Rosamond, CA 93560, USA",
        "acres_burned": 397.5,
        "url": "https://wildrivers.lostcoastoutpost.com/media/cache/1f/e9/1fe94c8f3e39f0726b761017a8252378.jpg",
        "description": "The Holiday Fire was a wildfire that took place in Kern County in the year 2024. This fire was located near 6798 Holiday Ave, Rosamond, CA 93560, USA and burned an estimated 397.5 acres. With coordinates at (34.8492868, -118.2554355), the fire posed a significant threat to nearby communities, natural habitats, and local infrastructure. Emergency response teams worked diligently to contain the spread and mitigate potential damage. Local authorities issued alerts to residents, urging them to take necessary precautions. Efforts such as firebreaks, controlled burns, and aerial firefighting were employed to limit its impact. While the fire was eventually brought under control, its effects highlighted the ongoing challenges posed by wildfires in the region."
    },
    {
        "id": "3dce248e-b14c-4816-aab1-3ceefc59b26a",
        "name": "Nees Fire",
        "year": 2024,
        "county": "Fresno",
        "latitude": 36.850279,
        "longitude": -120.771299,
        "location": "53890 W Nees Ave, Firebaugh, CA 93622, USA",
        "acres_burned": 47.0,
        "url": "https://www.aljazeera.com/wp-content/uploads/2024/07/AP24209184177599-1-1722096505.jpg?resize=770%2C513&quality=80",
        "description": "The Nees Fire was a wildfire that took place in Fresno County in the year 2024. This fire was located near 53890 W Nees Ave, Firebaugh, CA 93622, USA and burned an estimated 47.0 acres. With coordinates at (36.850279, -120.771299), the fire posed a significant threat to nearby communities, natural habitats, and local infrastructure. Emergency response teams worked diligently to contain the spread and mitigate potential damage. Local authorities issued alerts to residents, urging them to take necessary precautions. Efforts such as firebreaks, controlled burns, and aerial firefighting were employed to limit its impact. While the fire was eventually brought under control, its effects highlighted the ongoing challenges posed by wildfires in the region."
    },
    {
        "id": "e9e95a19-489b-4a24-b0d8-2744f72dc605",
        "name": "Central Fire",
        "year": 2024,
        "county": "Fresno",
        "latitude": 36.67799,
        "longitude": -119.7858,
        "location": "289 E Central Ave, Fresno, CA 93706, USA",
        "acres_burned": 12.6,
        "url": "https://streamline.imgix.net/7fb12135-a219-4750-bddf-e45f67dd38dc/ed2c3bae-de47-4fa1-a6de-2d1716f7857a/DJI_0777.JPG?ixlib=rb-1.1.0&w=2000&h=2000&fit=max&or=0&s=8dc2fd778625ca8b24714d41c3d44119",
        "description": "The Central Fire was a wildfire that took place in Fresno County in the year 2024. This fire was located near 289 E Central Ave, Fresno, CA 93706, USA and burned an estimated 12.6 acres. With coordinates at (36.67799, -119.7858), the fire posed a significant threat to nearby communities, natural habitats, and local infrastructure. Emergency response teams worked diligently to contain the spread and mitigate potential damage. Local authorities issued alerts to residents, urging them to take necessary precautions. Efforts such as firebreaks, controlled burns, and aerial firefighting were employed to limit its impact. While the fire was eventually brought under control, its effects highlighted the ongoing challenges posed by wildfires in the region."
    },
    {
        "id": "3f03a89c-3bdd-4ef8-a89f-c68161ee84e4",
        "name": "Border 51 Fire",
        "year": 2024,
        "county": "San Diego",
        "latitude": 32.57583,
        "longitude": -116.76972,
        "location": "H6GJ+84 Barrett Junction, CA, USA",
        "acres_burned": 12.0,
        "url": "https://i0.wp.com/wildfiretoday.com/wp-content/uploads/2022/08/Border-32-Fire-as-seen-looking-southeast-from-Lyons-Peak-at-452-p.m.-Aug.-31-2022.jpg?resize=840%2C476&ssl=1",
        "description": "The Border 51 Fire was a wildfire that took place in San Diego County in the year 2024. This fire was located near H6GJ+84 Barrett Junction, CA, USA and burned an estimated 12.0 acres. With coordinates at (32.57583, -116.76972), the fire posed a significant threat to nearby communities, natural habitats, and local infrastructure. Emergency response teams worked diligently to contain the spread and mitigate potential damage. Local authorities issued alerts to residents, urging them to take necessary precautions. Efforts such as firebreaks, controlled burns, and aerial firefighting were employed to limit its impact. While the fire was eventually brought under control, its effects highlighted the ongoing challenges posed by wildfires in the region."
    },
    {
        "id": "4ee5e062-f374-4790-819f-21a9c6aca2d9",
        "name": "Flood Fire",
        "year": 2024,
        "county": "San Joaquin",
        "latitude": 38.017376,
        "longitude": -120.944834,
        "location": "29999 Flood Rd, Linden, CA 95236, USA",
        "acres_burned": 57.7,
        "url": "https://media.cnn.com/api/v1/images/stellar/prod/20250109-cali-fire.jpg?c=original",
        "description": "The Flood Fire was a wildfire that took place in San Joaquin County in the year 2024. This fire was located near 29999 Flood Rd, Linden, CA 95236, USA and burned an estimated 57.7 acres. With coordinates at (38.017376, -120.944834), the fire posed a significant threat to nearby communities, natural habitats, and local infrastructure. Emergency response teams worked diligently to contain the spread and mitigate potential damage. Local authorities issued alerts to residents, urging them to take necessary precautions. Efforts such as firebreaks, controlled burns, and aerial firefighting were employed to limit its impact. While the fire was eventually brought under control, its effects highlighted the ongoing challenges posed by wildfires in the region."
    },
    {
        "id": "661cf1f8-a032-4812-96cc-ce45f8a0db31",
        "name": "Millerton Fire",
        "year": 2024,
        "county": "Madera",
        "latitude": 37.01741,
        "longitude": -119.689804,
        "location": "47037 Rd 145, Friant, CA 93626, USA",
        "acres_burned": 47.0,
        "url": "https://cdn.abcotvs.com/dip/images/11988697_062222-kfsn-4p-millerton-fire-vid.jpg",
        "description": "The Millerton Fire was a wildfire that took place in Madera County in the year 2024. This fire was located near 47037 Rd 145, Friant, CA 93626, USA and burned an estimated 47.0 acres. With coordinates at (37.01741, -119.689804), the fire posed a significant threat to nearby communities, natural habitats, and local infrastructure. Emergency response teams worked diligently to contain the spread and mitigate potential damage. Local authorities issued alerts to residents, urging them to take necessary precautions. Efforts such as firebreaks, controlled burns, and aerial firefighting were employed to limit its impact. While the fire was eventually brought under control, its effects highlighted the ongoing challenges posed by wildfires in the region."
    },
    {
        "id": "85074131-29f7-435f-8f43-8c9cf067bbd2",
        "name": "Vince Fire",
        "year": 2024,
        "county": "Los Angeles",
        "latitude": 34.50941,
        "longitude": -118.05215,
        "location": "4317 E Ave V 5, Palmdale, CA 93552, USA",
        "acres_burned": 22.4,
        "url": "https://news.lockheedmartin.com/image/Fire-Chiefs-Event-1.jpg",
        "description": "The Vince Fire was a wildfire that took place in Los Angeles County in the year 2024. This fire was located near 4317 E Ave V 5, Palmdale, CA 93552, USA and burned an estimated 22.4 acres. With coordinates at (34.50941, -118.05215), the fire posed a significant threat to nearby communities, natural habitats, and local infrastructure. Emergency response teams worked diligently to contain the spread and mitigate potential damage. Local authorities issued alerts to residents, urging them to take necessary precautions. Efforts such as firebreaks, controlled burns, and aerial firefighting were employed to limit its impact. While the fire was eventually brought under control, its effects highlighted the ongoing challenges posed by wildfires in the region."
    },
    {
        "id": "caaf80b4-1467-48b5-8517-5b55e75f5389",
        "name": "Five Fire",
        "year": 2024,
        "county": "Fresno",
        "latitude": 36.43706,
        "longitude": -120.393699,
        "location": "17998 S Derrick Ave, Cantua Creek, CA 93608, USA",
        "acres_burned": 150.0,
        "url": "https://www.ioes.ucla.edu/wp-content/uploads/2017/12/socal-nasa-1024x682.jpg",
        "description": "The Five Fire was a wildfire that took place in Fresno County in the year 2024. This fire was located near 17998 S Derrick Ave, Cantua Creek, CA 93608, USA and burned an estimated 150.0 acres. With coordinates at (36.43706, -120.393699), the fire posed a significant threat to nearby communities, natural habitats, and local infrastructure. Emergency response teams worked diligently to contain the spread and mitigate potential damage. Local authorities issued alerts to residents, urging them to take necessary precautions. Efforts such as firebreaks, controlled burns, and aerial firefighting were employed to limit its impact. While the fire was eventually brought under control, its effects highlighted the ongoing challenges posed by wildfires in the region."
    },
    {
        "id": "a8dbeeba-fe5a-4cc2-b1f5-c0f62d9c13a7",
        "name": "Hill Fire",
        "year": 2024,
        "county": "Santa Barbara",
        "latitude": 34.8936966,
        "longitude": -119.5572279,
        "location": "VCVV+F4 Cuyama, CA, USA",
        "acres_burned": 1383.0,
        "url": "https://s.abcnews.com/images/US/wildfires-road2-ap-ps-191024_hpMain_sl_3x2_1600.jpg?w=1600",
        "description": "The Hill Fire was a wildfire that took place in Santa Barbara County in the year 2024. This fire was located near VCVV+F4 Cuyama, CA, USA and burned an estimated 1383.0 acres. With coordinates at (34.8936966, -119.5572279), the fire posed a significant threat to nearby communities, natural habitats, and local infrastructure. Emergency response teams worked diligently to contain the spread and mitigate potential damage. Local authorities issued alerts to residents, urging them to take necessary precautions. Efforts such as firebreaks, controlled burns, and aerial firefighting were employed to limit its impact. While the fire was eventually brought under control, its effects highlighted the ongoing challenges posed by wildfires in the region."
    },
    {
        "id": "a4f1290c-c300-4ddf-a9c0-dcee4938e4eb",
        "name": "Pepper Fire",
        "year": 2024,
        "county": "Fresno",
        "latitude": 36.68768,
        "longitude": -119.158199,
        "location": "41521 Partridge Ln, Yokuts Valley, CA 93675, USA",
        "acres_burned": 29.0,
        "url": "https://www.billboard.com/wp-content/uploads/2025/01/red-hot-chili-peppers-fireaid-2024-billboard-1548.jpg?w=942&h=623&crop=1",
        "description": "The Pepper Fire was a wildfire that took place in Fresno County in the year 2024. This fire was located near 41521 Partridge Ln, Yokuts Valley, CA 93675, USA and burned an estimated 29.0 acres. With coordinates at (36.68768, -119.158199), the fire posed a significant threat to nearby communities, natural habitats, and local infrastructure. Emergency response teams worked diligently to contain the spread and mitigate potential damage. Local authorities issued alerts to residents, urging them to take necessary precautions. Efforts such as firebreaks, controlled burns, and aerial firefighting were employed to limit its impact. While the fire was eventually brought under control, its effects highlighted the ongoing challenges posed by wildfires in the region."
    },
    {
        "id": "367bb551-c370-4dac-9ce5-7ee4999878a5",
        "name": "Dillon Fire",
        "year": 2024,
        "county": "Riverside",
        "latitude": 33.925778,
        "longitude": -116.600203,
        "location": "60740 Seely Rd, Whitewater, CA 92282, USA",
        "acres_burned": 34.0,
        "url": "https://www.rollingstone.com/wp-content/uploads/2025/01/nancy-altadena-dispatch.jpg?w=1581&h=1054&crop=1",
        "description": "The Dillon Fire was a wildfire that took place in Riverside County in the year 2024. This fire was located near 60740 Seely Rd, Whitewater, CA 92282, USA and burned an estimated 34.0 acres. With coordinates at (33.925778, -116.600203), the fire posed a significant threat to nearby communities, natural habitats, and local infrastructure. Emergency response teams worked diligently to contain the spread and mitigate potential damage. Local authorities issued alerts to residents, urging them to take necessary precautions. Efforts such as firebreaks, controlled burns, and aerial firefighting were employed to limit its impact. While the fire was eventually brought under control, its effects highlighted the ongoing challenges posed by wildfires in the region."
    },
    {
        "id": "f1d428ec-c2be-4b9a-bd76-86bfd6193cdc",
        "name": "Clark Fire",
        "year": 2024,
        "county": "Fresno",
        "latitude": 36.501499,
        "longitude": -120.389098,
        "location": "15936 Juarez Ave, Cantua Creek, CA 93608, USA",
        "acres_burned": 35.0,
        "url": "https://www.reviewjournal.com/wp-content/uploads/2025/01/20040018_web1_CCFD-DEPART-FOR-CA-JAN0925_010825kc_018e.jpg?w=1200",
        "description": "The Clark Fire was a wildfire that took place in Fresno County in the year 2024. This fire was located near 15936 Juarez Ave, Cantua Creek, CA 93608, USA and burned an estimated 35.0 acres. With coordinates at (36.501499, -120.389098), the fire posed a significant threat to nearby communities, natural habitats, and local infrastructure. Emergency response teams worked diligently to contain the spread and mitigate potential damage. Local authorities issued alerts to residents, urging them to take necessary precautions. Efforts such as firebreaks, controlled burns, and aerial firefighting were employed to limit its impact. While the fire was eventually brought under control, its effects highlighted the ongoing challenges posed by wildfires in the region."
    },
    {
        "id": "dd4afe59-3fa5-4505-b519-ae21aaf822a0",
        "name": "Mocal Fire",
        "year": 2024,
        "county": "Kern",
        "latitude": 35.180776,
        "longitude": -119.558308,
        "location": "5CJR+8M Fellows, CA, USA",
        "acres_burned": 116.0,
        "url": "https://media.defense.gov/2017/Oct/13/2001827086/2000/2000/0/171012-F-XXXXX-002.JPG",
        "description": "The Mocal Fire was a wildfire that took place in Kern County in the year 2024. This fire was located near 5CJR+8M Fellows, CA, USA and burned an estimated 116.0 acres. With coordinates at (35.180776, -119.558308), the fire posed a significant threat to nearby communities, natural habitats, and local infrastructure. Emergency response teams worked diligently to contain the spread and mitigate potential damage. Local authorities issued alerts to residents, urging them to take necessary precautions. Efforts such as firebreaks, controlled burns, and aerial firefighting were employed to limit its impact. While the fire was eventually brought under control, its effects highlighted the ongoing challenges posed by wildfires in the region."
    },
    {
        "id": "82b3117e-68c8-4994-99e2-c863fe19f38e",
        "name": "Shirleon Fire",
        "year": 2024,
        "county": "Riverside",
        "latitude": 33.896179,
        "longitude": -116.917099,
        "location": "42695 Shirleon Dr, Banning, CA 92220, USA",
        "acres_burned": 15.0,
        "url": "https://patch.com/img/cdn20/users/23735283/20240530/012648/styles/patch_image/public/patch-stock-california-wildfire-fire-ca-schiavone-2020-2___30012525386.jpg",
        "description": "The Shirleon Fire was a wildfire that took place in Riverside County in the year 2024. This fire was located near 42695 Shirleon Dr, Banning, CA 92220, USA and burned an estimated 15.0 acres. With coordinates at (33.896179, -116.917099), the fire posed a significant threat to nearby communities, natural habitats, and local infrastructure. Emergency response teams worked diligently to contain the spread and mitigate potential damage. Local authorities issued alerts to residents, urging them to take necessary precautions. Efforts such as firebreaks, controlled burns, and aerial firefighting were employed to limit its impact. While the fire was eventually brought under control, its effects highlighted the ongoing challenges posed by wildfires in the region."
    },
    {
        "id": "9090538e-dcd6-451a-9641-fd08a8606707",
        "name": "Watt Fire",
        "year": 2024,
        "county": "Placer",
        "latitude": 38.728881,
        "longitude": -121.392475,
        "location": "5720 PFE Rd, Roseville, CA 95747, USA",
        "acres_burned": 19.5,
        "url": "https://static.life.com/wp-content/uploads/migrated/2014/12/watts-1966-21-1024x661.jpg",
        "description": "The Watt Fire was a wildfire that took place in Placer County in the year 2024. This fire was located near 5720 PFE Rd, Roseville, CA 95747, USA and burned an estimated 19.5 acres. With coordinates at (38.728881, -121.392475), the fire posed a significant threat to nearby communities, natural habitats, and local infrastructure. Emergency response teams worked diligently to contain the spread and mitigate potential damage. Local authorities issued alerts to residents, urging them to take necessary precautions. Efforts such as firebreaks, controlled burns, and aerial firefighting were employed to limit its impact. While the fire was eventually brought under control, its effects highlighted the ongoing challenges posed by wildfires in the region."
    },
    {
        "id": "a2d5f248-e4a3-4b3a-8327-83f2ba9b5be4",
        "name": "Mateo Fire",
        "year": 2024,
        "county": "Fresno",
        "latitude": 36.734329,
        "longitude": -120.314598,
        "location": "29015 W Whitesbridge Ave, Mendota, CA 93640, USA",
        "acres_burned": 762.0,
        "url": "https://www.fireapparatusmagazine.com/wp-content/uploads/2020/10/FA101220-Petrillo2.jpg",
        "description": "The Mateo Fire was a wildfire that took place in Fresno County in the year 2024. This fire was located near 29015 W Whitesbridge Ave, Mendota, CA 93640, USA and burned an estimated 762.0 acres. With coordinates at (36.734329, -120.314598), the fire posed a significant threat to nearby communities, natural habitats, and local infrastructure. Emergency response teams worked diligently to contain the spread and mitigate potential damage. Local authorities issued alerts to residents, urging them to take necessary precautions. Efforts such as firebreaks, controlled burns, and aerial firefighting were employed to limit its impact. While the fire was eventually brought under control, its effects highlighted the ongoing challenges posed by wildfires in the region."
    },
    {
        "id": "83e1720b-4a7e-4402-891c-13a834b15d6e",
        "name": "Zediker Fire",
        "year": 2024,
        "county": "Fresno",
        "latitude": 36.617148,
        "longitude": -119.520906,
        "location": "8140 S Zediker Ave, Parlier, CA 93648, USA",
        "acres_burned": 35.0,
        "url": "https://ucanr.edu/blogs/Green/blogfiles/101944_original.jpg",
        "description": "The Zediker Fire was a wildfire that took place in Fresno County in the year 2024. This fire was located near 8140 S Zediker Ave, Parlier, CA 93648, USA and burned an estimated 35.0 acres. With coordinates at (36.617148, -119.520906), the fire posed a significant threat to nearby communities, natural habitats, and local infrastructure. Emergency response teams worked diligently to contain the spread and mitigate potential damage. Local authorities issued alerts to residents, urging them to take necessary precautions. Efforts such as firebreaks, controlled burns, and aerial firefighting were employed to limit its impact. While the fire was eventually brought under control, its effects highlighted the ongoing challenges posed by wildfires in the region."
    },
    {
        "id": "8b16b848-b0c4-4a65-87d7-7222b774a7fe",
        "name": "County Fire",
        "year": 2024,
        "county": "Tuolumne",
        "latitude": 37.828925,
        "longitude": -120.634375,
        "location": "11032 CA-108, Jamestown, CA 95327, USA",
        "acres_burned": 13.0,
        "url": "https://media.cnn.com/api/v1/images/stellar/prod/img-7563.jpg?c=16x9&q=h_833,w_1480,c_fill",
        "description": "The County Fire was a wildfire that took place in Tuolumne County in the year 2024. This fire was located near 11032 CA-108, Jamestown, CA 95327, USA and burned an estimated 13.0 acres. With coordinates at (37.828925, -120.634375), the fire posed a significant threat to nearby communities, natural habitats, and local infrastructure. Emergency response teams worked diligently to contain the spread and mitigate potential damage. Local authorities issued alerts to residents, urging them to take necessary precautions. Efforts such as firebreaks, controlled burns, and aerial firefighting were employed to limit its impact. While the fire was eventually brought under control, its effects highlighted the ongoing challenges posed by wildfires in the region."
    },
    {
        "id": "7f2a842e-30da-4f04-9c47-7abf1847355c",
        "name": "Devil Fire",
        "year": 2024,
        "county": "Kings",
        "latitude": 35.85008,
        "longitude": -119.915199,
        "location": "37289 Devils Den Rd, Avenal, CA 93204, USA",
        "acres_burned": 188.0,
        "url": "https://media2.s-nbcnews.com/i/MSNBC/Components/Video/201710/f_mo_lon_firedvil_171009.jpg",
        "description": "The Devil Fire was a wildfire that took place in Kings County in the year 2024. This fire was located near 37289 Devils Den Rd, Avenal, CA 93204, USA and burned an estimated 188.0 acres. With coordinates at (35.85008, -119.915199), the fire posed a significant threat to nearby communities, natural habitats, and local infrastructure. Emergency response teams worked diligently to contain the spread and mitigate potential damage. Local authorities issued alerts to residents, urging them to take necessary precautions. Efforts such as firebreaks, controlled burns, and aerial firefighting were employed to limit its impact. While the fire was eventually brought under control, its effects highlighted the ongoing challenges posed by wildfires in the region."
    },
    {
        "id": "b5746d62-f66c-4bc2-a8a9-4b91bce936b2",
        "name": "Bank Fire",
        "year": 2024,
        "county": "Tehama",
        "latitude": 40.089713,
        "longitude": -122.398582,
        "location": "17214 Red Bank Rd, Red Bluff, CA 96080, USA",
        "acres_burned": 12.0,
        "url": "https://cdn.abcotvs.com/dip/images/15778799_010825-cc-ap-california-wildfire-bank-of-america-img.jpg",
        "description": "The Bank Fire was a wildfire that took place in Tehama County in the year 2024. This fire was located near 17214 Red Bank Rd, Red Bluff, CA 96080, USA and burned an estimated 12.0 acres. With coordinates at (40.089713, -122.398582), the fire posed a significant threat to nearby communities, natural habitats, and local infrastructure. Emergency response teams worked diligently to contain the spread and mitigate potential damage. Local authorities issued alerts to residents, urging them to take necessary precautions. Efforts such as firebreaks, controlled burns, and aerial firefighting were employed to limit its impact. While the fire was eventually brought under control, its effects highlighted the ongoing challenges posed by wildfires in the region."
    },
    {
        "id": "24ea1259-3db7-44bb-9d52-ec12666d7c14",
        "name": "Howard Fire",
        "year": 2024,
        "county": "Riverside",
        "latitude": 33.56557,
        "longitude": -116.718429,
        "location": "38386 Howard Rd, Anza, CA 92539, USA",
        "acres_burned": 32.0,
        "url": "https://images.foxtv.com/static.foxla.com/www.foxla.com/content/uploads/2022/10/764/432/ca3c5d64-GENERIC-WEB-MAIN2.jpg?ve=1&tl=1",
        "description": "The Howard Fire was a wildfire that took place in Riverside County in the year 2024. This fire was located near 38386 Howard Rd, Anza, CA 92539, USA and burned an estimated 32.0 acres. With coordinates at (33.56557, -116.718429), the fire posed a significant threat to nearby communities, natural habitats, and local infrastructure. Emergency response teams worked diligently to contain the spread and mitigate potential damage. Local authorities issued alerts to residents, urging them to take necessary precautions. Efforts such as firebreaks, controlled burns, and aerial firefighting were employed to limit its impact. While the fire was eventually brought under control, its effects highlighted the ongoing challenges posed by wildfires in the region."
    },
    {
        "id": "e7d90ab8-6031-4178-826e-69bbba7e8866",
        "name": "Great 3 Fire",
        "year": 2024,
        "county": "San Diego",
        "latitude": 32.99611,
        "longitude": -116.44756,
        "location": "12874 Great Southern Overland Stage Route, Julian, CA 92036, USA",
        "acres_burned": 187.0,
        "url": "https://i.ytimg.com/vi/E8FDjF6qw_Y/hq720.jpg?sqp=-oaymwEhCK4FEIIDSFryq4qpAxMIARUAAAAAGAElAADIQj0AgKJD&rs=AOn4CLAChI1_IG8yjh1Lm0bqPYr_RWhP1g",
        "description": "The Great 3 Fire was a wildfire that took place in San Diego County in the year 2024. This fire was located near 12874 Great Southern Overland Stage Route, Julian, CA 92036, USA and burned an estimated 187.0 acres. With coordinates at (32.99611, -116.44756), the fire posed a significant threat to nearby communities, natural habitats, and local infrastructure. Emergency response teams worked diligently to contain the spread and mitigate potential damage. Local authorities issued alerts to residents, urging them to take necessary precautions. Efforts such as firebreaks, controlled burns, and aerial firefighting were employed to limit its impact. While the fire was eventually brought under control, its effects highlighted the ongoing challenges posed by wildfires in the region."
    },
    {
        "id": "20df953f-6209-4537-943d-be4061a6cdef",
        "name": "Canal Fire",
        "year": 2024,
        "county": "Madera",
        "latitude": 37.081421,
        "longitude": -119.962104,
        "location": "32JQ+H5 Raymond, CA, USA",
        "acres_burned": 827.0,
        "url": "https://i0.wp.com/calmatters.org/wp-content/uploads/2025/01/071521-Friant-Kern-Canal-GETTY-CM-01.jpg?fit=1200%2C800&ssl=1",
        "description": "The Canal Fire was a wildfire that took place in Madera County in the year 2024. This fire was located near 32JQ+H5 Raymond, CA, USA and burned an estimated 827.0 acres. With coordinates at (37.081421, -119.962104), the fire posed a significant threat to nearby communities, natural habitats, and local infrastructure. Emergency response teams worked diligently to contain the spread and mitigate potential damage. Local authorities issued alerts to residents, urging them to take necessary precautions. Efforts such as firebreaks, controlled burns, and aerial firefighting were employed to limit its impact. While the fire was eventually brought under control, its effects highlighted the ongoing challenges posed by wildfires in the region."
    },
    {
        "id": "28552125-1000-40d7-b0bd-f1433fe82de4",
        "name": "Hawk Fire",
        "year": 2024,
        "county": "Fresno",
        "latitude": 36.842961,
        "longitude": -119.601701,
        "location": "10464 Herndon Ave, Clovis, CA 93619, USA",
        "acres_burned": 10.0,
        "url": "https://assets.verticalmag.com/wp-content/uploads/2021/03/DSC7234-1.jpg",
        "description": "The Hawk Fire was a wildfire that took place in Fresno County in the year 2024. This fire was located near 10464 Herndon Ave, Clovis, CA 93619, USA and burned an estimated 10.0 acres. With coordinates at (36.842961, -119.601701), the fire posed a significant threat to nearby communities, natural habitats, and local infrastructure. Emergency response teams worked diligently to contain the spread and mitigate potential damage. Local authorities issued alerts to residents, urging them to take necessary precautions. Efforts such as firebreaks, controlled burns, and aerial firefighting were employed to limit its impact. While the fire was eventually brought under control, its effects highlighted the ongoing challenges posed by wildfires in the region."
    },
    {
        "id": "0262b8b8-a4cd-4dcf-a1e4-ad13c7569a0a",
        "name": "Firebaugh Fire",
        "year": 2024,
        "county": "Madera",
        "latitude": 36.87565,
        "longitude": -120.25511,
        "location": "VPGV+7X Madera, CA, USA",
        "acres_burned": 1300.0,
        "url": "https://firebaugh.org/wp-content/uploads/2015/10/firebuaghbk2.jpg",
        "description": "The Firebaugh Fire was a wildfire that took place in Madera County in the year 2024. This fire was located near VPGV+7X Madera, CA, USA and burned an estimated 1300.0 acres. With coordinates at (36.87565, -120.25511), the fire posed a significant threat to nearby communities, natural habitats, and local infrastructure. Emergency response teams worked diligently to contain the spread and mitigate potential damage. Local authorities issued alerts to residents, urging them to take necessary precautions. Efforts such as firebreaks, controlled burns, and aerial firefighting were employed to limit its impact. While the fire was eventually brought under control, its effects highlighted the ongoing challenges posed by wildfires in the region."
    },
    {
        "id": "74f2dc61-32ff-4e11-86e5-d19112203bc0",
        "name": "Valley Center Fire",
        "year": 2024,
        "county": "San Bernardino",
        "latitude": 34.879647,
        "longitude": -116.792378,
        "location": "34440 Hidden Springs Rd, Newberry Springs, CA 92365, USA",
        "acres_burned": 10.0,
        "url": "https://www.valleycenter.com/wp-content/uploads/2019/01/NEWS_WORST_FIRE_ZONE-web.jpg",
        "description": "The Valley Center Fire was a wildfire that took place in San Bernardino County in the year 2024. This fire was located near 34440 Hidden Springs Rd, Newberry Springs, CA 92365, USA and burned an estimated 10.0 acres. With coordinates at (34.879647, -116.792378), the fire posed a significant threat to nearby communities, natural habitats, and local infrastructure. Emergency response teams worked diligently to contain the spread and mitigate potential damage. Local authorities issued alerts to residents, urging them to take necessary precautions. Efforts such as firebreaks, controlled burns, and aerial firefighting were employed to limit its impact. While the fire was eventually brought under control, its effects highlighted the ongoing challenges posed by wildfires in the region."
    },
    {
        "id": "2cedf02a-5a4b-4a3f-b8e6-bb5f9157c546",
        "name": "Yer1 Fire",
        "year": 2024,
        "county": "San Bernardino",
        "latitude": 34.88011,
        "longitude": -116.815632,
        "location": "V5JM+2P Daggett, CA, USA",
        "acres_burned": 10.0,
        "url": "https://media.news.climate.columbia.edu/wp-content/uploads/2022/01/wildfire-637x489.jpg",
        "description": "The Yer1 Fire was a wildfire that took place in San Bernardino County in the year 2024. This fire was located near V5JM+2P Daggett, CA, USA and burned an estimated 10.0 acres. With coordinates at (34.88011, -116.815632), the fire posed a significant threat to nearby communities, natural habitats, and local infrastructure. Emergency response teams worked diligently to contain the spread and mitigate potential damage. Local authorities issued alerts to residents, urging them to take necessary precautions. Efforts such as firebreaks, controlled burns, and aerial firefighting were employed to limit its impact. While the fire was eventually brought under control, its effects highlighted the ongoing challenges posed by wildfires in the region."
    },
    {
        "id": "6db79b13-4fbf-4f00-ae3c-f7da5e388a7a",
        "name": "Nby1 Fire",
        "year": 2024,
        "county": "San Bernardino",
        "latitude": 34.812972,
        "longitude": -116.663042,
        "location": "30721 Earll Rd, Newberry Springs, CA 92365, USA",
        "acres_burned": 10.0,
        "url": "https://s3.amazonaws.com/sunvalleysupplyfiles/product/MD-LG_Certainteed_OPwhiteNubby.jpg",
        "description": "The Nby1 Fire was a wildfire that took place in San Bernardino County in the year 2024. This fire was located near 30721 Earll Rd, Newberry Springs, CA 92365, USA and burned an estimated 10.0 acres. With coordinates at (34.812972, -116.663042), the fire posed a significant threat to nearby communities, natural habitats, and local infrastructure. Emergency response teams worked diligently to contain the spread and mitigate potential damage. Local authorities issued alerts to residents, urging them to take necessary precautions. Efforts such as firebreaks, controlled burns, and aerial firefighting were employed to limit its impact. While the fire was eventually brought under control, its effects highlighted the ongoing challenges posed by wildfires in the region."
    },
    {
        "id": "de3e7a5d-9f8d-4c72-b60a-d40b94ac83c2",
        "name": "Rosamond Fire",
        "year": 2024,
        "county": "Los Angeles",
        "latitude": 34.72107,
        "longitude": -118.25483,
        "location": "46138 70th St W, Lancaster, CA 93536, USA",
        "acres_burned": 124.5,
        "url": "https://bakersfieldnow.com/resources/media/60be1882-4ce1-45a6-b17c-f41461834038-full36x25_RD.jpg",
        "description": "The Rosamond Fire was a wildfire that took place in Los Angeles County in the year 2024. This fire was located near 46138 70th St W, Lancaster, CA 93536, USA and burned an estimated 124.5 acres. With coordinates at (34.72107, -118.25483), the fire posed a significant threat to nearby communities, natural habitats, and local infrastructure. Emergency response teams worked diligently to contain the spread and mitigate potential damage. Local authorities issued alerts to residents, urging them to take necessary precautions. Efforts such as firebreaks, controlled burns, and aerial firefighting were employed to limit its impact. While the fire was eventually brought under control, its effects highlighted the ongoing challenges posed by wildfires in the region."
    },
    {
        "id": "82165e58-8aeb-41a6-9416-8e08ccc11efe",
        "name": "Tesoro Fire",
        "year": 2024,
        "county": "Madera",
        "latitude": 37.01047,
        "longitude": -119.7939,
        "location": "Hwy. 41/Rd. 145 - Park & Ride, California 93636, USA",
        "acres_burned": 109.0,
        "url": "https://i0.wp.com/fourcsmetal.com/wp-content/uploads/2020/11/1-Tesoro-Viejo-Fire-Station-6-scaled.jpg?fit=2560%2C1708&ssl=1",
        "description": "The Tesoro Fire was a wildfire that took place in Madera County in the year 2024. This fire was located near Hwy. 41/Rd. 145 - Park & Ride, California 93636, USA and burned an estimated 109.0 acres. With coordinates at (37.01047, -119.7939), the fire posed a significant threat to nearby communities, natural habitats, and local infrastructure. Emergency response teams worked diligently to contain the spread and mitigate potential damage. Local authorities issued alerts to residents, urging them to take necessary precautions. Efforts such as firebreaks, controlled burns, and aerial firefighting were employed to limit its impact. While the fire was eventually brought under control, its effects highlighted the ongoing challenges posed by wildfires in the region."
    },
    {
        "id": "8f5c5e63-78a9-42d1-a3d9-57ddb6c6a0af",
        "name": "Limonite Fire",
        "year": 2024,
        "county": "Riverside",
        "latitude": 33.975351,
        "longitude": -117.505873,
        "location": "10200 Limonite Ave, Jurupa Valley, CA 91752, USA",
        "acres_burned": 18.0,
        "url": "https://cdn.abcotvs.com/dip/images/11996019_062522-kabc-11pm-ie-union-fire-vid.jpg",
        "description": "The Limonite Fire was a wildfire that took place in Riverside County in the year 2024. This fire was located near 10200 Limonite Ave, Jurupa Valley, CA 91752, USA and burned an estimated 18.0 acres. With coordinates at (33.975351, -117.505873), the fire posed a significant threat to nearby communities, natural habitats, and local infrastructure. Emergency response teams worked diligently to contain the spread and mitigate potential damage. Local authorities issued alerts to residents, urging them to take necessary precautions. Efforts such as firebreaks, controlled burns, and aerial firefighting were employed to limit its impact. While the fire was eventually brought under control, its effects highlighted the ongoing challenges posed by wildfires in the region."
    },
    {
        "id": "29be5ab1-03bc-46ca-b01b-5de2f4916c29",
        "name": "Red Fire",
        "year": 2024,
        "county": "Kern",
        "latitude": 35.601284,
        "longitude": -118.4733,
        "location": "115 Schick Rd, Lake Isabella, CA 93240, USA",
        "acres_burned": 98.0,
        "url": "https://www.dailynews.com/wp-content/uploads/2025/01/AP25008142636991-2.jpg?w=525",
        "description": "The Red Fire was a wildfire that took place in Kern County in the year 2024. This fire was located near 115 Schick Rd, Lake Isabella, CA 93240, USA and burned an estimated 98.0 acres. With coordinates at (35.601284, -118.4733), the fire posed a significant threat to nearby communities, natural habitats, and local infrastructure. Emergency response teams worked diligently to contain the spread and mitigate potential damage. Local authorities issued alerts to residents, urging them to take necessary precautions. Efforts such as firebreaks, controlled burns, and aerial firefighting were employed to limit its impact. While the fire was eventually brought under control, its effects highlighted the ongoing challenges posed by wildfires in the region."
    },
    {
        "id": "46d80e55-328e-4dd7-9563-41c794e34337",
        "name": "Field Fire",
        "year": 2024,
        "county": "Santa Barbara",
        "latitude": 34.9592,
        "longitude": -119.698014,
        "location": "X852+MQ New Cuyama, CA, USA",
        "acres_burned": 201.0,
        "url": "https://www.heydaybooks.com/wp-content/uploads/2022/07/SFIRcover_web800px.jpg",
        "description": "The Field Fire was a wildfire that took place in Santa Barbara County in the year 2024. This fire was located near X852+MQ New Cuyama, CA, USA and burned an estimated 201.0 acres. With coordinates at (34.9592, -119.698014), the fire posed a significant threat to nearby communities, natural habitats, and local infrastructure. Emergency response teams worked diligently to contain the spread and mitigate potential damage. Local authorities issued alerts to residents, urging them to take necessary precautions. Efforts such as firebreaks, controlled burns, and aerial firefighting were employed to limit its impact. While the fire was eventually brought under control, its effects highlighted the ongoing challenges posed by wildfires in the region."
    },
    {
        "id": "aeaaa127-7246-4a93-b7af-1a705002ada2",
        "name": "Fields Fire",
        "year": 2024,
        "county": "Merced",
        "latitude": 37.565014,
        "longitude": -120.425878,
        "location": "18999 Co Rd J59, Snelling, CA 95369, USA",
        "acres_burned": 22.0,
        "url": "https://cdn.abcotvs.com/dip/images/15223178_082324-wls-n1-baseball-fire-raw-vid.jpg",
        "description": "The Fields Fire was a wildfire that took place in Merced County in the year 2024. This fire was located near 18999 Co Rd J59, Snelling, CA 95369, USA and burned an estimated 22.0 acres. With coordinates at (37.565014, -120.425878), the fire posed a significant threat to nearby communities, natural habitats, and local infrastructure. Emergency response teams worked diligently to contain the spread and mitigate potential damage. Local authorities issued alerts to residents, urging them to take necessary precautions. Efforts such as firebreaks, controlled burns, and aerial firefighting were employed to limit its impact. While the fire was eventually brought under control, its effects highlighted the ongoing challenges posed by wildfires in the region."
    },
    {
        "id": "aa660305-cefc-41ce-8d06-f77dec63a8e3",
        "name": "Ranch Fire",
        "year": 2024,
        "county": "Kern",
        "latitude": 35.442336,
        "longitude": -118.82214,
        "location": "C5RH+W4 Bakersfield, CA, USA",
        "acres_burned": 616.0,
        "url": "https://i0.wp.com/wildfiretoday.com/wp-content/uploads/2018/08/Mendo_231amPDT_8-27.jpg?ssl=1",
        "description": "The Ranch Fire was a wildfire that took place in Kern County in the year 2024. This fire was located near C5RH+W4 Bakersfield, CA, USA and burned an estimated 616.0 acres. With coordinates at (35.442336, -118.82214), the fire posed a significant threat to nearby communities, natural habitats, and local infrastructure. Emergency response teams worked diligently to contain the spread and mitigate potential damage. Local authorities issued alerts to residents, urging them to take necessary precautions. Efforts such as firebreaks, controlled burns, and aerial firefighting were employed to limit its impact. While the fire was eventually brought under control, its effects highlighted the ongoing challenges posed by wildfires in the region."
    },
    {
        "id": "78c444a4-62f6-4a10-a6c5-82060428386c",
        "name": "Boyd Fire",
        "year": 2024,
        "county": "Tulare",
        "latitude": 36.573169,
        "longitude": -119.238103,
        "location": "14960 Johnson Dr, Orosi, CA 93647, USA",
        "acres_burned": 36.0,
        "url": "https://www.cafirefoundation.org/memorial-wall/desktop-image/wall-tile.jpg",
        "description": "The Boyd Fire was a wildfire that took place in Tulare County in the year 2024. This fire was located near 14960 Johnson Dr, Orosi, CA 93647, USA and burned an estimated 36.0 acres. With coordinates at (36.573169, -119.238103), the fire posed a significant threat to nearby communities, natural habitats, and local infrastructure. Emergency response teams worked diligently to contain the spread and mitigate potential damage. Local authorities issued alerts to residents, urging them to take necessary precautions. Efforts such as firebreaks, controlled burns, and aerial firefighting were employed to limit its impact. While the fire was eventually brought under control, its effects highlighted the ongoing challenges posed by wildfires in the region."
    },
    {
        "id": "6a5bdbfa-a78f-45dc-a3b2-e417abfd9f50",
        "name": "Corral Fire",
        "year": 2024,
        "county": "San Joaquin",
        "latitude": 37.633908,
        "longitude": -121.50259,
        "location": "JFMW+HX Tracy, CA, USA",
        "acres_burned": 14168.0,
        "url": "https://media.cnn.com/api/v1/images/stellar/prod/corral-fire-2.JPG?c=16x9&q=w_1280,c_fill",
        "description": "The Corral Fire was a wildfire that took place in San Joaquin County in the year 2024. This fire was located near JFMW+HX Tracy, CA, USA and burned an estimated 14168.0 acres. With coordinates at (37.633908, -121.50259), the fire posed a significant threat to nearby communities, natural habitats, and local infrastructure. Emergency response teams worked diligently to contain the spread and mitigate potential damage. Local authorities issued alerts to residents, urging them to take necessary precautions. Efforts such as firebreaks, controlled burns, and aerial firefighting were employed to limit its impact. While the fire was eventually brought under control, its effects highlighted the ongoing challenges posed by wildfires in the region."
    },
    {
        "id": "6d453d50-3d81-4ec5-a2b5-9b207a809fe3",
        "name": "Border 53 Fire",
        "year": 2024,
        "county": "San Diego",
        "latitude": 32.577083,
        "longitude": -116.806666,
        "location": "H5GV+R8 Chula Vista, CA, USA",
        "acres_burned": 250.0,
        "url": "https://i.ytimg.com/vi/Tvw7JcjlHYM/hq720.jpg?sqp=-oaymwEhCK4FEIIDSFryq4qpAxMIARUAAAAAGAElAADIQj0AgKJD&rs=AOn4CLB_X055XSpJx1mbeOqbi1CdEx5SqA",
        "description": "The Border 53 Fire was a wildfire that took place in San Diego County in the year 2024. This fire was located near H5GV+R8 Chula Vista, CA, USA and burned an estimated 250.0 acres. With coordinates at (32.577083, -116.806666), the fire posed a significant threat to nearby communities, natural habitats, and local infrastructure. Emergency response teams worked diligently to contain the spread and mitigate potential damage. Local authorities issued alerts to residents, urging them to take necessary precautions. Efforts such as firebreaks, controlled burns, and aerial firefighting were employed to limit its impact. While the fire was eventually brought under control, its effects highlighted the ongoing challenges posed by wildfires in the region."
    },
    {
        "id": "8272c94a-4757-4ee4-9395-69cf62f0d857",
        "name": "Raymond Fire",
        "year": 2024,
        "county": "Madera",
        "latitude": 36.974519,
        "longitude": -120.044449,
        "location": "11079 E Cleveland Ave, Madera, CA 93638, USA",
        "acres_burned": 27.2,
        "url": "https://southpasadenan.com/wp-content/uploads/south-pasadena-news-04-18-2019-throwback-thursdays-raymond-hotel-historical-fire-rick-thomas-01.jpg",
        "description": "The Raymond Fire was a wildfire that took place in Madera County in the year 2024. This fire was located near 11079 E Cleveland Ave, Madera, CA 93638, USA and burned an estimated 27.2 acres. With coordinates at (36.974519, -120.044449), the fire posed a significant threat to nearby communities, natural habitats, and local infrastructure. Emergency response teams worked diligently to contain the spread and mitigate potential damage. Local authorities issued alerts to residents, urging them to take necessary precautions. Efforts such as firebreaks, controlled burns, and aerial firefighting were employed to limit its impact. While the fire was eventually brought under control, its effects highlighted the ongoing challenges posed by wildfires in the region."
    },
    {
        "id": "a952074a-0d98-4b47-a18e-f3265d778236",
        "name": "Park Fire",
        "year": 2024,
        "county": "Riverside",
        "latitude": 33.790804,
        "longitude": -116.927045,
        "location": "22770 Soboba Rd, San Jacinto, CA 92583, USA",
        "acres_burned": 13.0,
        "url": "https://cloudfront-us-east-1.images.arcpublishing.com/opb/YUHZIJO23JEJO3MRYAWO2XYGQY.jpg",
        "description": "The Park Fire was a wildfire that took place in Riverside County in the year 2024. This fire was located near 22770 Soboba Rd, San Jacinto, CA 92583, USA and burned an estimated 13.0 acres. With coordinates at (33.790804, -116.927045), the fire posed a significant threat to nearby communities, natural habitats, and local infrastructure. Emergency response teams worked diligently to contain the spread and mitigate potential damage. Local authorities issued alerts to residents, urging them to take necessary precautions. Efforts such as firebreaks, controlled burns, and aerial firefighting were employed to limit its impact. While the fire was eventually brought under control, its effects highlighted the ongoing challenges posed by wildfires in the region."
    },
    {
        "id": "c1f2703e-94b1-4008-8f24-848ce731cf73",
        "name": "West Fire",
        "year": 2024,
        "county": "Kern",
        "latitude": 34.91,
        "longitude": -118.254,
        "location": "WP5W+XC Rosamond, CA, USA",
        "acres_burned": 1575.0,
        "url": "https://media.cnn.com/api/v1/images/stellar/prod/ap24255353740807.jpg?c=16x9&q=h_833,w_1480,c_fill",
        "description": "The West Fire was a wildfire that took place in Kern County in the year 2024. This fire was located near WP5W+XC Rosamond, CA, USA and burned an estimated 1575.0 acres. With coordinates at (34.91, -118.254), the fire posed a significant threat to nearby communities, natural habitats, and local infrastructure. Emergency response teams worked diligently to contain the spread and mitigate potential damage. Local authorities issued alerts to residents, urging them to take necessary precautions. Efforts such as firebreaks, controlled burns, and aerial firefighting were employed to limit its impact. While the fire was eventually brought under control, its effects highlighted the ongoing challenges posed by wildfires in the region."
    },
    {
        "id": "ef29e2fa-0e3b-4d2b-8a4d-710b4ba0c4b9",
        "name": "Shadow Fire",
        "year": 2024,
        "county": "Kern",
        "latitude": 35.619008,
        "longitude": -118.401334,
        "location": "3198 Denise Dr, Lake Isabella, CA 93240, USA",
        "acres_burned": 86.0,
        "url": "https://images.fastcompany.com/image/upload/f_webp,q_auto,c_fit/wp-cms-2/2025/01/p-1-91266351-ca-battery-fire.jpg",
        "description": "The Shadow Fire was a wildfire that took place in Kern County in the year 2024. This fire was located near 3198 Denise Dr, Lake Isabella, CA 93240, USA and burned an estimated 86.0 acres. With coordinates at (35.619008, -118.401334), the fire posed a significant threat to nearby communities, natural habitats, and local infrastructure. Emergency response teams worked diligently to contain the spread and mitigate potential damage. Local authorities issued alerts to residents, urging them to take necessary precautions. Efforts such as firebreaks, controlled burns, and aerial firefighting were employed to limit its impact. While the fire was eventually brought under control, its effects highlighted the ongoing challenges posed by wildfires in the region."
    },
    {
        "id": "6fd967b4-ccbd-46c2-a039-e9d5ab8bf0b2",
        "name": "Patterson Fire",
        "year": 2024,
        "county": "Alameda",
        "latitude": 37.714616,
        "longitude": -121.568029,
        "location": "17259 Co Rd 2063, Tracy, CA 95391, USA",
        "acres_burned": 95.0,
        "url": "https://koffassociates.com/wp-content/uploads/2023/10/patterson-fc.jpg",
        "description": "The Patterson Fire was a wildfire that took place in Alameda County in the year 2024. This fire was located near 17259 Co Rd 2063, Tracy, CA 95391, USA and burned an estimated 95.0 acres. With coordinates at (37.714616, -121.568029), the fire posed a significant threat to nearby communities, natural habitats, and local infrastructure. Emergency response teams worked diligently to contain the spread and mitigate potential damage. Local authorities issued alerts to residents, urging them to take necessary precautions. Efforts such as firebreaks, controlled burns, and aerial firefighting were employed to limit its impact. While the fire was eventually brought under control, its effects highlighted the ongoing challenges posed by wildfires in the region."
    },
    {
        "id": "f9fafd72-6c1a-4a06-864f-dcd4ff15b5b7",
        "name": "Sorrel Fire",
        "year": 2024,
        "county": "San Bernardino",
        "latitude": 34.68341,
        "longitude": -117.118935,
        "location": "MVMJ+9C Apple Valley, CA, USA",
        "acres_burned": 40.0,
        "url": "https://www.fs.usda.gov/wildflowers/plant-of-the-week/images/redwoodsorrel/Oxalis_oregana1_Dr_Gerry_Carr_lg.jpg",
        "description": "The Sorrel Fire was a wildfire that took place in San Bernardino County in the year 2024. This fire was located near MVMJ+9C Apple Valley, CA, USA and burned an estimated 40.0 acres. With coordinates at (34.68341, -117.118935), the fire posed a significant threat to nearby communities, natural habitats, and local infrastructure. Emergency response teams worked diligently to contain the spread and mitigate potential damage. Local authorities issued alerts to residents, urging them to take necessary precautions. Efforts such as firebreaks, controlled burns, and aerial firefighting were employed to limit its impact. While the fire was eventually brought under control, its effects highlighted the ongoing challenges posed by wildfires in the region."
    },
    {
        "id": "d88897da-5b31-475a-981f-6d8367809aef",
        "name": "Springs Fire",
        "year": 2024,
        "county": "Tuolumne",
        "latitude": 37.842308,
        "longitude": -120.524741,
        "location": "5645 Green Springs Rd, Jamestown, CA 95327, USA",
        "acres_burned": 17.0,
        "url": "https://upload.wikimedia.org/wikipedia/commons/3/3f/Map_of_the_Springs_Fire.jpg",
        "description": "The Springs Fire was a wildfire that took place in Tuolumne County in the year 2024. This fire was located near 5645 Green Springs Rd, Jamestown, CA 95327, USA and burned an estimated 17.0 acres. With coordinates at (37.842308, -120.524741), the fire posed a significant threat to nearby communities, natural habitats, and local infrastructure. Emergency response teams worked diligently to contain the spread and mitigate potential damage. Local authorities issued alerts to residents, urging them to take necessary precautions. Efforts such as firebreaks, controlled burns, and aerial firefighting were employed to limit its impact. While the fire was eventually brought under control, its effects highlighted the ongoing challenges posed by wildfires in the region."
    },
    {
        "id": "b56fbb47-fef4-4027-b4dc-fb908dd86088",
        "name": "Russell Fire",
        "year": 2024,
        "county": "Fresno",
        "latitude": 36.916374,
        "longitude": -120.657895,
        "location": "12423 N Russell Ave, Firebaugh, CA 93622, USA",
        "acres_burned": 25.0,
        "url": "https://www.ucdavis.edu/sites/default/files/styles/sf_landscape_16x9/public/images/article/barn-925.jpg?h=6ea7b79d&itok=QJk-GxqP",
        "description": "The Russell Fire was a wildfire that took place in Fresno County in the year 2024. This fire was located near 12423 N Russell Ave, Firebaugh, CA 93622, USA and burned an estimated 25.0 acres. With coordinates at (36.916374, -120.657895), the fire posed a significant threat to nearby communities, natural habitats, and local infrastructure. Emergency response teams worked diligently to contain the spread and mitigate potential damage. Local authorities issued alerts to residents, urging them to take necessary precautions. Efforts such as firebreaks, controlled burns, and aerial firefighting were employed to limit its impact. While the fire was eventually brought under control, its effects highlighted the ongoing challenges posed by wildfires in the region."
    },
    {
        "id": "9c71fa25-b34c-44b2-82a9-ba8748df5822",
        "name": "Road Fire",
        "year": 2024,
        "county": "Kern",
        "latitude": 35.113531,
        "longitude": -119.48669,
        "location": "4G77+C8 Taft, CA, USA",
        "acres_burned": 1088.0,
        "url": "https://static.independent.co.uk/2022/01/22/20/PRI219618855.jpg",
        "description": "The Road Fire was a wildfire that took place in Kern County in the year 2024. This fire was located near 4G77+C8 Taft, CA, USA and burned an estimated 1088.0 acres. With coordinates at (35.113531, -119.48669), the fire posed a significant threat to nearby communities, natural habitats, and local infrastructure. Emergency response teams worked diligently to contain the spread and mitigate potential damage. Local authorities issued alerts to residents, urging them to take necessary precautions. Efforts such as firebreaks, controlled burns, and aerial firefighting were employed to limit its impact. While the fire was eventually brought under control, its effects highlighted the ongoing challenges posed by wildfires in the region."
    },
    {
        "id": "8dc8f472-8478-4acd-abcd-53cff119034a",
        "name": "Lotus Fire",
        "year": 2024,
        "county": "Riverside",
        "latitude": 34.013717,
        "longitude": -117.403656,
        "location": "2H7W+FG Jurupa Valley, CA, USA",
        "acres_burned": 30.0,
        "url": "https://www.gardenista.com/wp-content/uploads/2018/01/claire-takacs-photo-lotusland-3.jpg",
        "description": "The Lotus Fire was a wildfire that took place in Riverside County in the year 2024. This fire was located near 2H7W+FG Jurupa Valley, CA, USA and burned an estimated 30.0 acres. With coordinates at (34.013717, -117.403656), the fire posed a significant threat to nearby communities, natural habitats, and local infrastructure. Emergency response teams worked diligently to contain the spread and mitigate potential damage. Local authorities issued alerts to residents, urging them to take necessary precautions. Efforts such as firebreaks, controlled burns, and aerial firefighting were employed to limit its impact. While the fire was eventually brought under control, its effects highlighted the ongoing challenges posed by wildfires in the region."
    },
    {
        "id": "3f7e4057-f059-4878-9da0-7ee294cd77ce",
        "name": "Bitterwater ",
        "year": 2024,
        "county": "San Luis Obispo",
        "latitude": 35.37367,
        "longitude": -120.094361,
        "location": "6817 Blue Star Mem Hwy, Santa Margarita, CA 93453, USA",
        "acres_burned": 331.2,
        "url": "https://e9o754stvva.exactdn.com/wp-content/uploads/2022/11/Bitterwater-Road.jpg",
        "description": "The Bitterwater  was a wildfire that took place in San Luis Obispo County in the year 2024. This fire was located near 6817 Blue Star Mem Hwy, Santa Margarita, CA 93453, USA and burned an estimated 331.2 acres. With coordinates at (35.37367, -120.094361), the fire posed a significant threat to nearby communities, natural habitats, and local infrastructure. Emergency response teams worked diligently to contain the spread and mitigate potential damage. Local authorities issued alerts to residents, urging them to take necessary precautions. Efforts such as firebreaks, controlled burns, and aerial firefighting were employed to limit its impact. While the fire was eventually brought under control, its effects highlighted the ongoing challenges posed by wildfires in the region."
    },
    {
        "id": "ea843ab2-4115-4cab-9ef7-3a2cb3af9a15",
        "name": "Crystal Fire",
        "year": 2024,
        "county": "Napa",
        "latitude": 38.55954,
        "longitude": -122.494472,
        "location": "250 N Fork Crystal Springs Rd, Deer Park, CA 94576, USA",
        "acres_burned": 60.0,
        "url": "https://i.guim.co.uk/img/media/78a44f2ffc10adfeb9e7283b7d31e4b397aba81a/0_0_4834_3179/master/4834.jpg?width=465&dpr=1&s=none&crop=none",
        "description": "The Crystal Fire was a wildfire that took place in Napa County in the year 2024. This fire was located near 250 N Fork Crystal Springs Rd, Deer Park, CA 94576, USA and burned an estimated 60.0 acres. With coordinates at (38.55954, -122.494472), the fire posed a significant threat to nearby communities, natural habitats, and local infrastructure. Emergency response teams worked diligently to contain the spread and mitigate potential damage. Local authorities issued alerts to residents, urging them to take necessary precautions. Efforts such as firebreaks, controlled burns, and aerial firefighting were employed to limit its impact. While the fire was eventually brought under control, its effects highlighted the ongoing challenges posed by wildfires in the region."
    },
    {
        "id": "fd38093a-e9db-4603-99f0-e760d7c92e97",
        "name": "Little Fire",
        "year": 2024,
        "county": "Fresno",
        "latitude": 36.777907,
        "longitude": -120.729222,
        "location": "51959 W Shields Ave, Firebaugh, CA 93622, USA",
        "acres_burned": 34.0,
        "url": "https://entnemdept.ufl.edu/creatures/urban/ants/Fig8_little_fire_ant.jpg",
        "description": "The Little Fire was a wildfire that took place in Fresno County in the year 2024. This fire was located near 51959 W Shields Ave, Firebaugh, CA 93622, USA and burned an estimated 34.0 acres. With coordinates at (36.777907, -120.729222), the fire posed a significant threat to nearby communities, natural habitats, and local infrastructure. Emergency response teams worked diligently to contain the spread and mitigate potential damage. Local authorities issued alerts to residents, urging them to take necessary precautions. Efforts such as firebreaks, controlled burns, and aerial firefighting were employed to limit its impact. While the fire was eventually brought under control, its effects highlighted the ongoing challenges posed by wildfires in the region."
    },
    {
        "id": "db080174-df55-40f9-b969-6f7c5109ece9",
        "name": "Devil Fire",
        "year": 2024,
        "county": "Kings",
        "latitude": 35.85594,
        "longitude": -119.94084,
        "location": "V345+9M Reef Station, CA, USA",
        "acres_burned": 210.5,
        "url": "https://media2.s-nbcnews.com/i/MSNBC/Components/Video/201710/f_mo_lon_firedvil_171009.jpg",
        "description": "The Devil Fire was a wildfire that took place in Kings County in the year 2024. This fire was located near V345+9M Reef Station, CA, USA and burned an estimated 210.5 acres. With coordinates at (35.85594, -119.94084), the fire posed a significant threat to nearby communities, natural habitats, and local infrastructure. Emergency response teams worked diligently to contain the spread and mitigate potential damage. Local authorities issued alerts to residents, urging them to take necessary precautions. Efforts such as firebreaks, controlled burns, and aerial firefighting were employed to limit its impact. While the fire was eventually brought under control, its effects highlighted the ongoing challenges posed by wildfires in the region."
    },
    {
        "id": "687f0b9f-3685-46d1-953b-38540b363b8c",
        "name": "Relay Fire",
        "year": 2024,
        "county": "Riverside",
        "latitude": 33.910994,
        "longitude": -116.980503,
        "location": "14604 CA-79, Beaumont, CA 92223, USA",
        "acres_burned": 47.0,
        "url": "https://images.squarespace-cdn.com/content/v1/5fb2b76dc34986098745ecb5/1631588604031-V2XAANFJ5S92L5LD60JO/30AF3E49-29E6-4D2C-B8DB-0E8177704318.jpg",
        "description": "The Relay Fire was a wildfire that took place in Riverside County in the year 2024. This fire was located near 14604 CA-79, Beaumont, CA 92223, USA and burned an estimated 47.0 acres. With coordinates at (33.910994, -116.980503), the fire posed a significant threat to nearby communities, natural habitats, and local infrastructure. Emergency response teams worked diligently to contain the spread and mitigate potential damage. Local authorities issued alerts to residents, urging them to take necessary precautions. Efforts such as firebreaks, controlled burns, and aerial firefighting were employed to limit its impact. While the fire was eventually brought under control, its effects highlighted the ongoing challenges posed by wildfires in the region."
    },
    {
        "id": "5fbf1bfd-1767-4459-a8f7-eee8e83463e8",
        "name": "Gaskell Fire",
        "year": 2024,
        "county": "Kern",
        "latitude": 34.82333,
        "longitude": -118.30848,
        "location": "214 100th St W, Rosamond, CA 93560, USA",
        "acres_burned": 403.0,
        "url": "https://www.kget.com/wp-content/uploads/sites/2/2024/02/Cal-Fire-021022-e1707318601166.jpg?w=800",
        "description": "The Gaskell Fire was a wildfire that took place in Kern County in the year 2024. This fire was located near 214 100th St W, Rosamond, CA 93560, USA and burned an estimated 403.0 acres. With coordinates at (34.82333, -118.30848), the fire posed a significant threat to nearby communities, natural habitats, and local infrastructure. Emergency response teams worked diligently to contain the spread and mitigate potential damage. Local authorities issued alerts to residents, urging them to take necessary precautions. Efforts such as firebreaks, controlled burns, and aerial firefighting were employed to limit its impact. While the fire was eventually brought under control, its effects highlighted the ongoing challenges posed by wildfires in the region."
    },
    {
        "id": "e7293335-36b8-4f37-b809-7fc5e0d7b7da",
        "name": "155 Fire",
        "year": 2024,
        "county": "Kern",
        "latitude": 35.692183,
        "longitude": -118.46771,
        "location": "MGRJ+VW Wofford Heights, CA, USA",
        "acres_burned": 55.0,
        "url": "https://media.gettyimages.com/id/2192309138/photo/a-vehicle-burns-during-the-palisades-fire-in-the-pacific-palisades-neighborhood-of-los.jpg?s=612x612&w=gi&k=20&c=HsZpzNwLNg4zqrz6tlNV0Z4IcdzLw1jcWNCp0y8I47I=",
        "description": "The 155 Fire was a wildfire that took place in Kern County in the year 2024. This fire was located near MGRJ+VW Wofford Heights, CA, USA and burned an estimated 55.0 acres. With coordinates at (35.692183, -118.46771), the fire posed a significant threat to nearby communities, natural habitats, and local infrastructure. Emergency response teams worked diligently to contain the spread and mitigate potential damage. Local authorities issued alerts to residents, urging them to take necessary precautions. Efforts such as firebreaks, controlled burns, and aerial firefighting were employed to limit its impact. While the fire was eventually brought under control, its effects highlighted the ongoing challenges posed by wildfires in the region."
    },
    {
        "id": "2154a6a5-efaf-4c1f-a022-f9c9566a1a37",
        "name": "Lost Fire",
        "year": 2024,
        "county": "Kern",
        "latitude": 35.735279,
        "longitude": -119.69294,
        "location": "21296 Twisselman Rd, Lost Hills, CA 93249, USA",
        "acres_burned": 3600.0,
        "url": "https://www.aljazeera.com/wp-content/uploads/2025/01/2025-01-09T040945Z_1175642587_RC236CAPI9MJ_RTRMADP_3_CALIFORNIA-WILDFIRES-1736497446.jpg?resize=730%2C410&quality=80",
        "description": "The Lost Fire was a wildfire that took place in Kern County in the year 2024. This fire was located near 21296 Twisselman Rd, Lost Hills, CA 93249, USA and burned an estimated 3600.0 acres. With coordinates at (35.735279, -119.69294), the fire posed a significant threat to nearby communities, natural habitats, and local infrastructure. Emergency response teams worked diligently to contain the spread and mitigate potential damage. Local authorities issued alerts to residents, urging them to take necessary precautions. Efforts such as firebreaks, controlled burns, and aerial firefighting were employed to limit its impact. While the fire was eventually brought under control, its effects highlighted the ongoing challenges posed by wildfires in the region."
    },
    {
        "id": "198d519a-12b0-455d-bae4-42f078683a31",
        "name": "Pan Fire",
        "year": 2024,
        "county": "Fresno",
        "latitude": 36.786999,
        "longitude": -120.764998,
        "location": "52625 Little Panoche Rd, Firebaugh, CA 93622, USA",
        "acres_burned": 34.0,
        "url": "https://cdpcdn.dx1app.com/products/USA/HD/2025/MC/DUALPURP/PAN_AMERICA_1250_SPECIAL/50/ISKEY_FIRE_-_RAVEN_METALLIC_WITH_LACED_WHEELS/2000000001.jpg",
        "description": "The Pan Fire was a wildfire that took place in Fresno County in the year 2024. This fire was located near 52625 Little Panoche Rd, Firebaugh, CA 93622, USA and burned an estimated 34.0 acres. With coordinates at (36.786999, -120.764998), the fire posed a significant threat to nearby communities, natural habitats, and local infrastructure. Emergency response teams worked diligently to contain the spread and mitigate potential damage. Local authorities issued alerts to residents, urging them to take necessary precautions. Efforts such as firebreaks, controlled burns, and aerial firefighting were employed to limit its impact. While the fire was eventually brought under control, its effects highlighted the ongoing challenges posed by wildfires in the region."
    },
    {
        "id": "9ed61dc6-ca25-4cba-a9b5-f39c07a617b8",
        "name": "Albers Fire",
        "year": 2024,
        "county": "Santa Clara",
        "latitude": 37.904572,
        "longitude": -121.765839,
        "location": "9601 Deer Valley Rd, Brentwood, CA 94513, USA",
        "acres_burned": 22.8,
        "url": "https://i0.wp.com/urbanpolicy.net/wp-content/uploads/2021/10/210920_ParadiseChico_FireRisk_sm.jpg?ssl=1",
        "description": "The Albers Fire was a wildfire that took place in Santa Clara County in the year 2024. This fire was located near 9601 Deer Valley Rd, Brentwood, CA 94513, USA and burned an estimated 22.8 acres. With coordinates at (37.904572, -121.765839), the fire posed a significant threat to nearby communities, natural habitats, and local infrastructure. Emergency response teams worked diligently to contain the spread and mitigate potential damage. Local authorities issued alerts to residents, urging them to take necessary precautions. Efforts such as firebreaks, controlled burns, and aerial firefighting were employed to limit its impact. While the fire was eventually brought under control, its effects highlighted the ongoing challenges posed by wildfires in the region."
    },
    {
        "id": "8f3b0140-1a30-4433-a147-e8574581db2c",
        "name": "Garlock Fire",
        "year": 2024,
        "county": "Fresno",
        "latitude": 36.991558,
        "longitude": -119.514348,
        "location": "15750 Garlock Ln, Prather, CA 93651, USA",
        "acres_burned": 54.0,
        "url": "https://ktvo.com/resources/media2/16x9/full/1015/center/80/1a5e40ca-ba89-476e-8673-6f181f025177-large16x9_putarson1.jpg",
        "description": "The Garlock Fire was a wildfire that took place in Fresno County in the year 2024. This fire was located near 15750 Garlock Ln, Prather, CA 93651, USA and burned an estimated 54.0 acres. With coordinates at (36.991558, -119.514348), the fire posed a significant threat to nearby communities, natural habitats, and local infrastructure. Emergency response teams worked diligently to contain the spread and mitigate potential damage. Local authorities issued alerts to residents, urging them to take necessary precautions. Efforts such as firebreaks, controlled burns, and aerial firefighting were employed to limit its impact. While the fire was eventually brought under control, its effects highlighted the ongoing challenges posed by wildfires in the region."
    },
    {
        "id": "fa87ab64-243c-4b62-90b7-312c020e656c",
        "name": "Morgan Fire",
        "year": 2024,
        "county": "Riverside",
        "latitude": 33.487833,
        "longitude": -117.052745,
        "location": "CA-79, Temecula, CA 92592, USA",
        "acres_burned": 14.4,
        "url": "https://eoimages.gsfc.nasa.gov/images/imagerecords/82000/82036/California_amo_2013252.jpg",
        "description": "The Morgan Fire was a wildfire that took place in Riverside County in the year 2024. This fire was located near CA-79, Temecula, CA 92592, USA and burned an estimated 14.4 acres. With coordinates at (33.487833, -117.052745), the fire posed a significant threat to nearby communities, natural habitats, and local infrastructure. Emergency response teams worked diligently to contain the spread and mitigate potential damage. Local authorities issued alerts to residents, urging them to take necessary precautions. Efforts such as firebreaks, controlled burns, and aerial firefighting were employed to limit its impact. While the fire was eventually brought under control, its effects highlighted the ongoing challenges posed by wildfires in the region."
    },
    {
        "id": "591daf80-c234-485c-8d0e-38c9c6049980",
        "name": "Poleline Fire",
        "year": 2024,
        "county": "Merced",
        "latitude": 36.928296,
        "longitude": -120.834941,
        "location": "Poleline Rd, Los Banos, CA 93635, USA",
        "acres_burned": 30.0,
        "url": "https://cdnuploads.aa.com.tr/uploads/PhotoGallery/2024/06/09/thumbs_b2_1642ea344fc439d15d69c2ce50795b95.jpg",
        "description": "The Poleline Fire was a wildfire that took place in Merced County in the year 2024. This fire was located near Poleline Rd, Los Banos, CA 93635, USA and burned an estimated 30.0 acres. With coordinates at (36.928296, -120.834941), the fire posed a significant threat to nearby communities, natural habitats, and local infrastructure. Emergency response teams worked diligently to contain the spread and mitigate potential damage. Local authorities issued alerts to residents, urging them to take necessary precautions. Efforts such as firebreaks, controlled burns, and aerial firefighting were employed to limit its impact. While the fire was eventually brought under control, its effects highlighted the ongoing challenges posed by wildfires in the region."
    },
    {
        "id": "6b829633-220c-4833-b6a7-f3bd61c5d97d",
        "name": "Koala Fire",
        "year": 2024,
        "county": "San Bernardino",
        "latitude": 34.520882,
        "longitude": -117.451094,
        "location": "9696 Hook Blvd, Adelanto, CA 92301, USA",
        "acres_burned": 25.0,
        "url": "http://media.wired.com/photos/5f75ee461e0ff1e1a9fbbda4/master/pass/Science_climatedesk_koalas_1199309062.jpg",
        "description": "The Koala Fire was a wildfire that took place in San Bernardino County in the year 2024. This fire was located near 9696 Hook Blvd, Adelanto, CA 92301, USA and burned an estimated 25.0 acres. With coordinates at (34.520882, -117.451094), the fire posed a significant threat to nearby communities, natural habitats, and local infrastructure. Emergency response teams worked diligently to contain the spread and mitigate potential damage. Local authorities issued alerts to residents, urging them to take necessary precautions. Efforts such as firebreaks, controlled burns, and aerial firefighting were employed to limit its impact. While the fire was eventually brought under control, its effects highlighted the ongoing challenges posed by wildfires in the region."
    },
    {
        "id": "f0c2d5f8-c9d2-41c6-81b0-9bef9d78b798",
        "name": "Springs Fire",
        "year": 2024,
        "county": "Siskiyou",
        "latitude": 41.474683,
        "longitude": -122.520453,
        "location": "FFFH+VR Gazelle, CA, USA",
        "acres_burned": 11.0,
        "url": "https://upload.wikimedia.org/wikipedia/commons/3/3f/Map_of_the_Springs_Fire.jpg",
        "description": "The Springs Fire was a wildfire that took place in Siskiyou County in the year 2024. This fire was located near FFFH+VR Gazelle, CA, USA and burned an estimated 11.0 acres. With coordinates at (41.474683, -122.520453), the fire posed a significant threat to nearby communities, natural habitats, and local infrastructure. Emergency response teams worked diligently to contain the spread and mitigate potential damage. Local authorities issued alerts to residents, urging them to take necessary precautions. Efforts such as firebreaks, controlled burns, and aerial firefighting were employed to limit its impact. While the fire was eventually brought under control, its effects highlighted the ongoing challenges posed by wildfires in the region."
    },
    {
        "id": "66cf145e-229a-4100-b7be-7d6514e3d897",
        "name": "Greenville Fire",
        "year": 2024,
        "county": "Alameda",
        "latitude": 37.72154,
        "longitude": -121.702293,
        "location": "P7CX+J3 Livermore, CA, USA",
        "acres_burned": 44.0,
        "url": "https://s.abcnews.com/images/US/greenville-dixie-gty-ps-210805_1628174322006_hpMain.jpg",
        "description": "The Greenville Fire was a wildfire that took place in Alameda County in the year 2024. This fire was located near P7CX+J3 Livermore, CA, USA and burned an estimated 44.0 acres. With coordinates at (37.72154, -121.702293), the fire posed a significant threat to nearby communities, natural habitats, and local infrastructure. Emergency response teams worked diligently to contain the spread and mitigate potential damage. Local authorities issued alerts to residents, urging them to take necessary precautions. Efforts such as firebreaks, controlled burns, and aerial firefighting were employed to limit its impact. While the fire was eventually brought under control, its effects highlighted the ongoing challenges posed by wildfires in the region."
    },
    {
        "id": "4cd301ff-b6a5-4615-b67d-d458beeefd6e",
        "name": "Cody Fire",
        "year": 2024,
        "county": "Kern",
        "latitude": 35.64995,
        "longitude": -119.031458,
        "location": "8572JXX9+XC",
        "acres_burned": 903.0,
        "url": "https://www.powelltribune.com/uploads/original/20241031-103124-e62-WF-1.jpg",
        "description": "The Cody Fire was a wildfire that took place in Kern County in the year 2024. This fire was located near 8572JXX9+XC and burned an estimated 903.0 acres. With coordinates at (35.64995, -119.031458), the fire posed a significant threat to nearby communities, natural habitats, and local infrastructure. Emergency response teams worked diligently to contain the spread and mitigate potential damage. Local authorities issued alerts to residents, urging them to take necessary precautions. Efforts such as firebreaks, controlled burns, and aerial firefighting were employed to limit its impact. While the fire was eventually brought under control, its effects highlighted the ongoing challenges posed by wildfires in the region."
    },
    {
        "id": "075f245f-4c62-4ff6-b1da-5ed9273da348",
        "name": "Aquaduct 2 Fire",
        "year": 2024,
        "county": "San Diego",
        "latitude": 32.84445,
        "longitude": -117.08492,
        "location": "RWV8+Q2 San Diego, CA, USA",
        "acres_burned": 110.0,
        "url": "https://cloudfront-us-east-1.images.arcpublishing.com/opb/4FSRFGTQTBAVMP7RMIMZLWBEZQ.jpg",
        "description": "The Aquaduct 2 Fire was a wildfire that took place in San Diego County in the year 2024. This fire was located near RWV8+Q2 San Diego, CA, USA and burned an estimated 110.0 acres. With coordinates at (32.84445, -117.08492), the fire posed a significant threat to nearby communities, natural habitats, and local infrastructure. Emergency response teams worked diligently to contain the spread and mitigate potential damage. Local authorities issued alerts to residents, urging them to take necessary precautions. Efforts such as firebreaks, controlled burns, and aerial firefighting were employed to limit its impact. While the fire was eventually brought under control, its effects highlighted the ongoing challenges posed by wildfires in the region."
    },
    {
        "id": "bcf1cd5e-d4c8-49bb-9635-230e0b1057b5",
        "name": "Rock Fire",
        "year": 2024,
        "county": "San Luis Obispo",
        "latitude": 35.774138,
        "longitude": -120.772339,
        "location": "Bee Rock Rd, California, USA",
        "acres_burned": 50.0,
        "url": "https://media.abc10.com/assets/KXTV/images/85df688f-72f2-4b92-83a7-b2a786a8333e/85df688f-72f2-4b92-83a7-b2a786a8333e_1920x1080.jpg",
        "description": "The Rock Fire was a wildfire that took place in San Luis Obispo County in the year 2024. This fire was located near Bee Rock Rd, California, USA and burned an estimated 50.0 acres. With coordinates at (35.774138, -120.772339), the fire posed a significant threat to nearby communities, natural habitats, and local infrastructure. Emergency response teams worked diligently to contain the spread and mitigate potential damage. Local authorities issued alerts to residents, urging them to take necessary precautions. Efforts such as firebreaks, controlled burns, and aerial firefighting were employed to limit its impact. While the fire was eventually brought under control, its effects highlighted the ongoing challenges posed by wildfires in the region."
    },
    {
        "id": "ed47f029-1282-4d6b-b00a-1abdc40418e5",
        "name": "Creek Fire",
        "year": 2024,
        "county": "Kern",
        "latitude": 35.346667,
        "longitude": -118.386667,
        "location": "12345 Caliente Creek Rd, Caliente, CA 93518, USA",
        "acres_burned": 50.0,
        "url": "https://upload.wikimedia.org/wikipedia/commons/1/1b/Fseprd799186_tn.jpg",
        "description": "The Creek Fire was a wildfire that took place in Kern County in the year 2024. This fire was located near 12345 Caliente Creek Rd, Caliente, CA 93518, USA and burned an estimated 50.0 acres. With coordinates at (35.346667, -118.386667), the fire posed a significant threat to nearby communities, natural habitats, and local infrastructure. Emergency response teams worked diligently to contain the spread and mitigate potential damage. Local authorities issued alerts to residents, urging them to take necessary precautions. Efforts such as firebreaks, controlled burns, and aerial firefighting were employed to limit its impact. While the fire was eventually brought under control, its effects highlighted the ongoing challenges posed by wildfires in the region."
    },
    {
        "id": "32d9aad1-a755-4e28-8697-c593e45472b8",
        "name": "John Fire",
        "year": 2024,
        "county": "Contra Costa",
        "latitude": 38.00994,
        "longitude": -121.91945,
        "location": "2255 John Henry Johnson Pkwy, Pittsburg, CA 94565, USA",
        "acres_burned": 55.0,
        "url": "https://www.cafirefoundation.org/what-we-do/for-firefighters-and-families/california-firefighters-memorial/search-fallen/r/bio-photo/Ruedy,%20John.JPG",
        "description": "The John Fire was a wildfire that took place in Contra Costa County in the year 2024. This fire was located near 2255 John Henry Johnson Pkwy, Pittsburg, CA 94565, USA and burned an estimated 55.0 acres. With coordinates at (38.00994, -121.91945), the fire posed a significant threat to nearby communities, natural habitats, and local infrastructure. Emergency response teams worked diligently to contain the spread and mitigate potential damage. Local authorities issued alerts to residents, urging them to take necessary precautions. Efforts such as firebreaks, controlled burns, and aerial firefighting were employed to limit its impact. While the fire was eventually brought under control, its effects highlighted the ongoing challenges posed by wildfires in the region."
    },
    {
        "id": "0059b627-3b2c-4f13-865d-246af0e62ee9",
        "name": "Forest Fire",
        "year": 2024,
        "county": "Los Angeles",
        "latitude": 34.51346,
        "longitude": -117.785551,
        "location": "G677+9Q Llano, CA, USA",
        "acres_burned": 41.1,
        "url": "https://natureconservancy-h.assetsadobe.com/is/image/content/dam/tnc/nature/en/photos/s/h/shutterstock_710588224.jpg?crop=0%2C467%2C4000%2C2200&wid=4000&hei=2200&scl=1.0",
        "description": "The Forest Fire was a wildfire that took place in Los Angeles County in the year 2024. This fire was located near G677+9Q Llano, CA, USA and burned an estimated 41.1 acres. With coordinates at (34.51346, -117.785551), the fire posed a significant threat to nearby communities, natural habitats, and local infrastructure. Emergency response teams worked diligently to contain the spread and mitigate potential damage. Local authorities issued alerts to residents, urging them to take necessary precautions. Efforts such as firebreaks, controlled burns, and aerial firefighting were employed to limit its impact. While the fire was eventually brought under control, its effects highlighted the ongoing challenges posed by wildfires in the region."
    },
    {
        "id": "ce63986b-174f-46e1-9e29-38e7c848783f",
        "name": "Rawson Fire",
        "year": 2024,
        "county": "Tehama",
        "latitude": 40.111484,
        "longitude": -122.232365,
        "location": "10918 Rawson Rd, Red Bluff, CA 96080, USA",
        "acres_burned": 24.9,
        "url": "https://media.abc10.com/assets/KXTV/images/d16ca965-80ed-4af9-a137-3c62b213087e/d16ca965-80ed-4af9-a137-3c62b213087e_1920x1080.jpg",
        "description": "The Rawson Fire was a wildfire that took place in Tehama County in the year 2024. This fire was located near 10918 Rawson Rd, Red Bluff, CA 96080, USA and burned an estimated 24.9 acres. With coordinates at (40.111484, -122.232365), the fire posed a significant threat to nearby communities, natural habitats, and local infrastructure. Emergency response teams worked diligently to contain the spread and mitigate potential damage. Local authorities issued alerts to residents, urging them to take necessary precautions. Efforts such as firebreaks, controlled burns, and aerial firefighting were employed to limit its impact. While the fire was eventually brought under control, its effects highlighted the ongoing challenges posed by wildfires in the region."
    },
    {
        "id": "add17318-bcac-4a2a-b413-1e225d62812e",
        "name": "Spenceville Fire",
        "year": 2024,
        "county": "Yuba",
        "latitude": 39.133016,
        "longitude": -121.309465,
        "location": "4MMR+66 Beale Air Force Base, CA, USA",
        "acres_burned": 23.0,
        "url": "https://i0.wp.com/yubanet.com/wp-content/uploads/2025/01/Penn_Valley_1736723587_2671.jpg?resize=780%2C439&ssl=1",
        "description": "The Spenceville Fire was a wildfire that took place in Yuba County in the year 2024. This fire was located near 4MMR+66 Beale Air Force Base, CA, USA and burned an estimated 23.0 acres. With coordinates at (39.133016, -121.309465), the fire posed a significant threat to nearby communities, natural habitats, and local infrastructure. Emergency response teams worked diligently to contain the spread and mitigate potential damage. Local authorities issued alerts to residents, urging them to take necessary precautions. Efforts such as firebreaks, controlled burns, and aerial firefighting were employed to limit its impact. While the fire was eventually brought under control, its effects highlighted the ongoing challenges posed by wildfires in the region."
    },
    {
        "id": "24c4eb8f-5ee7-4fa9-ad87-b3c69d6580cd",
        "name": "Acorn Fire",
        "year": 2024,
        "county": "Calaveras",
        "latitude": 38.1179241,
        "longitude": -120.79181,
        "location": "4695+57 Rancho Calaveras, CA, USA",
        "acres_burned": 15.0,
        "url": "https://kymkemp.com/wp-content/uploads/2024/07/AcornFire-noresize.jpg",
        "description": "The Acorn Fire was a wildfire that took place in Calaveras County in the year 2024. This fire was located near 4695+57 Rancho Calaveras, CA, USA and burned an estimated 15.0 acres. With coordinates at (38.1179241, -120.79181), the fire posed a significant threat to nearby communities, natural habitats, and local infrastructure. Emergency response teams worked diligently to contain the spread and mitigate potential damage. Local authorities issued alerts to residents, urging them to take necessary precautions. Efforts such as firebreaks, controlled burns, and aerial firefighting were employed to limit its impact. While the fire was eventually brought under control, its effects highlighted the ongoing challenges posed by wildfires in the region."
    },
    {
        "id": "410327d5-b412-4a81-99f5-bd10c9e9c832",
        "name": "Cod Fire",
        "year": 2024,
        "county": "Siskiyou",
        "latitude": 41.900664,
        "longitude": -122.444022,
        "location": "13090 Cod Dr, Montague, CA 96064, USA",
        "acres_burned": 28.0,
        "url": "https://m.media-amazon.com/images/I/51ue+4nndiL._AC_UF1000,1000_QL80_.jpg",
        "description": "The Cod Fire was a wildfire that took place in Siskiyou County in the year 2024. This fire was located near 13090 Cod Dr, Montague, CA 96064, USA and burned an estimated 28.0 acres. With coordinates at (41.900664, -122.444022), the fire posed a significant threat to nearby communities, natural habitats, and local infrastructure. Emergency response teams worked diligently to contain the spread and mitigate potential damage. Local authorities issued alerts to residents, urging them to take necessary precautions. Efforts such as firebreaks, controlled burns, and aerial firefighting were employed to limit its impact. While the fire was eventually brought under control, its effects highlighted the ongoing challenges posed by wildfires in the region."
    },
    {
        "id": "d4696bb6-7e95-48ee-8573-477aa199a1c2",
        "name": "Flynn Fire",
        "year": 2024,
        "county": "Alameda",
        "latitude": 37.719182,
        "longitude": -121.660326,
        "location": "11701 Flynn Rd N, Livermore, CA 94550, USA",
        "acres_burned": 23.0,
        "url": "https://cdn.abcotvs.com/dip/images/15098976_072624-kgo-altamont-fire-str-img.jpg",
        "description": "The Flynn Fire was a wildfire that took place in Alameda County in the year 2024. This fire was located near 11701 Flynn Rd N, Livermore, CA 94550, USA and burned an estimated 23.0 acres. With coordinates at (37.719182, -121.660326), the fire posed a significant threat to nearby communities, natural habitats, and local infrastructure. Emergency response teams worked diligently to contain the spread and mitigate potential damage. Local authorities issued alerts to residents, urging them to take necessary precautions. Efforts such as firebreaks, controlled burns, and aerial firefighting were employed to limit its impact. While the fire was eventually brought under control, its effects highlighted the ongoing challenges posed by wildfires in the region."
    },
    {
        "id": "06a7fc2d-2bf7-4595-8449-04bb3bcc3d5e",
        "name": "Jellys Fire",
        "year": 2024,
        "county": "Tehama",
        "latitude": 40.354308,
        "longitude": -122.172379,
        "location": "Jellys Ferry Rd, Red Bluff, CA 96080, USA",
        "acres_burned": 17.0,
        "url": "https://www.hollywoodreporter.com/wp-content/uploads/2025/02/GettyImages-2196875752-H-2025.jpg?w=1296",
        "description": "The Jellys Fire was a wildfire that took place in Tehama County in the year 2024. This fire was located near Jellys Ferry Rd, Red Bluff, CA 96080, USA and burned an estimated 17.0 acres. With coordinates at (40.354308, -122.172379), the fire posed a significant threat to nearby communities, natural habitats, and local infrastructure. Emergency response teams worked diligently to contain the spread and mitigate potential damage. Local authorities issued alerts to residents, urging them to take necessary precautions. Efforts such as firebreaks, controlled burns, and aerial firefighting were employed to limit its impact. While the fire was eventually brought under control, its effects highlighted the ongoing challenges posed by wildfires in the region."
    },
    {
        "id": "ff39bc4c-ad87-412a-b9bd-542cf13e9fb5",
        "name": "Stoddard 3 Fire",
        "year": 2024,
        "county": "San Bernardino",
        "latitude": 34.72209,
        "longitude": -117.16739,
        "location": "PRCM+R2 Apple Valley, CA, USA",
        "acres_burned": 472.0,
        "url": "https://imagescdn.homes.com/m2/i5-fs9xCQC2kfry2o4J9YRCZlJ4u9wN-H98m6v5Hn-Et3Tz8NwKsDrV8zJbWaQhMM83IQcnsUpeqhj0TXpTRD9ydamQIt59UTc2_qJqLyFWMZajvnKhIWi0w4J2zIEaP/H400W500/map-5572-n-stoddard-ave-san-bernardino-ca-streetview.jpg",
        "description": "The Stoddard 3 Fire was a wildfire that took place in San Bernardino County in the year 2024. This fire was located near PRCM+R2 Apple Valley, CA, USA and burned an estimated 472.0 acres. With coordinates at (34.72209, -117.16739), the fire posed a significant threat to nearby communities, natural habitats, and local infrastructure. Emergency response teams worked diligently to contain the spread and mitigate potential damage. Local authorities issued alerts to residents, urging them to take necessary precautions. Efforts such as firebreaks, controlled burns, and aerial firefighting were employed to limit its impact. While the fire was eventually brought under control, its effects highlighted the ongoing challenges posed by wildfires in the region."
    },
    {
        "id": "2ee0c53b-1f9a-461e-918d-b8a6dedc1bf3",
        "name": "Carmen Fire",
        "year": 2024,
        "county": "Riverside",
        "latitude": 33.91768,
        "longitude": -116.75466,
        "location": "51971 Lavern Ave, Cabazon, CA 92230, USA",
        "acres_burned": 64.3,
        "url": "https://clacs.berkeley.edu/sites/default/files/brlasspring2017-conicyt-happycampfire2014-usforestservice-flickrcc.jpg",
        "description": "The Carmen Fire was a wildfire that took place in Riverside County in the year 2024. This fire was located near 51971 Lavern Ave, Cabazon, CA 92230, USA and burned an estimated 64.3 acres. With coordinates at (33.91768, -116.75466), the fire posed a significant threat to nearby communities, natural habitats, and local infrastructure. Emergency response teams worked diligently to contain the spread and mitigate potential damage. Local authorities issued alerts to residents, urging them to take necessary precautions. Efforts such as firebreaks, controlled burns, and aerial firefighting were employed to limit its impact. While the fire was eventually brought under control, its effects highlighted the ongoing challenges posed by wildfires in the region."
    },
    {
        "id": "bb8c7694-46c8-4eb0-8fa0-0c9d4b45664f",
        "name": "Travel Fire",
        "year": 2024,
        "county": "Fresno",
        "latitude": 36.074598,
        "longitude": -120.102025,
        "location": "44779 Lassen Ave, Avenal, CA, USA",
        "acres_burned": 10.0,
        "url": "https://ccc.ca.gov/wp-content/uploads/2020/09/Camarillo-Corpsmembers-Carefully-Climb-Steep-Terrain-After-Extinguishing-Hot-Spots.jpg",
        "description": "The Travel Fire was a wildfire that took place in Fresno County in the year 2024. This fire was located near 44779 Lassen Ave, Avenal, CA, USA and burned an estimated 10.0 acres. With coordinates at (36.074598, -120.102025), the fire posed a significant threat to nearby communities, natural habitats, and local infrastructure. Emergency response teams worked diligently to contain the spread and mitigate potential damage. Local authorities issued alerts to residents, urging them to take necessary precautions. Efforts such as firebreaks, controlled burns, and aerial firefighting were employed to limit its impact. While the fire was eventually brought under control, its effects highlighted the ongoing challenges posed by wildfires in the region."
    },
    {
        "id": "7860b848-c83b-4f45-9359-91836fc1d8c8",
        "name": "Lincoln Fire",
        "year": 2024,
        "county": "Los Angeles",
        "latitude": 34.65729,
        "longitude": -118.09927,
        "location": "MW42+W7 Palmdale, CA, USA",
        "acres_burned": 17.0,
        "url": "https://www.fireapparatusmagazine.com/wp-content/uploads/2015/05/FA050515-HME1.jpg",
        "description": "The Lincoln Fire was a wildfire that took place in Los Angeles County in the year 2024. This fire was located near MW42+W7 Palmdale, CA, USA and burned an estimated 17.0 acres. With coordinates at (34.65729, -118.09927), the fire posed a significant threat to nearby communities, natural habitats, and local infrastructure. Emergency response teams worked diligently to contain the spread and mitigate potential damage. Local authorities issued alerts to residents, urging them to take necessary precautions. Efforts such as firebreaks, controlled burns, and aerial firefighting were employed to limit its impact. While the fire was eventually brought under control, its effects highlighted the ongoing challenges posed by wildfires in the region."
    },
    {
        "id": "408d5919-b681-4480-8fcb-634bd50494fe",
        "name": "Hinkley Fire",
        "year": 2024,
        "county": "San Bernardino",
        "latitude": 34.89273,
        "longitude": -117.188996,
        "location": "35302 Hinkley Rd, Hinkley, CA 92347, USA",
        "acres_burned": 126.0,
        "url": "https://www.sbsun.com/wp-content/uploads/2023/01/SBS-L-HINKLEYFIRE-0625-20-PB.jpg?w=978",
        "description": "The Hinkley Fire was a wildfire that took place in San Bernardino County in the year 2024. This fire was located near 35302 Hinkley Rd, Hinkley, CA 92347, USA and burned an estimated 126.0 acres. With coordinates at (34.89273, -117.188996), the fire posed a significant threat to nearby communities, natural habitats, and local infrastructure. Emergency response teams worked diligently to contain the spread and mitigate potential damage. Local authorities issued alerts to residents, urging them to take necessary precautions. Efforts such as firebreaks, controlled burns, and aerial firefighting were employed to limit its impact. While the fire was eventually brought under control, its effects highlighted the ongoing challenges posed by wildfires in the region."
    },
    {
        "id": "c0a1383e-6793-4916-a4a9-9c338ca92638",
        "name": "Oil Fire",
        "year": 2024,
        "county": "Kern",
        "latitude": 35.506667,
        "longitude": -119.071667,
        "location": "17896 Porterville Hwy, Bakersfield, CA 93308, USA",
        "acres_burned": 214.0,
        "url": "https://truthout.org/app/uploads/2025/01/2025_0109-fire-la-1200x818.jpg",
        "description": "The Oil Fire was a wildfire that took place in Kern County in the year 2024. This fire was located near 17896 Porterville Hwy, Bakersfield, CA 93308, USA and burned an estimated 214.0 acres. With coordinates at (35.506667, -119.071667), the fire posed a significant threat to nearby communities, natural habitats, and local infrastructure. Emergency response teams worked diligently to contain the spread and mitigate potential damage. Local authorities issued alerts to residents, urging them to take necessary precautions. Efforts such as firebreaks, controlled burns, and aerial firefighting were employed to limit its impact. While the fire was eventually brought under control, its effects highlighted the ongoing challenges posed by wildfires in the region."
    },
    {
        "id": "4009f1e2-b3ff-407e-9aa1-a211930e6bff",
        "name": "Bear Fire",
        "year": 2024,
        "county": "San Luis Obispo",
        "latitude": 35.293114,
        "longitude": -119.953932,
        "location": "Arrow Bear Trail, Santa Margarita, CA 93453, USA",
        "acres_burned": 1410.0,
        "url": "https://www.3fishstudios.com/cdn/shop/products/Annie_1080x.jpg?v=1629996607",
        "description": "The Bear Fire was a wildfire that took place in San Luis Obispo County in the year 2024. This fire was located near Arrow Bear Trail, Santa Margarita, CA 93453, USA and burned an estimated 1410.0 acres. With coordinates at (35.293114, -119.953932), the fire posed a significant threat to nearby communities, natural habitats, and local infrastructure. Emergency response teams worked diligently to contain the spread and mitigate potential damage. Local authorities issued alerts to residents, urging them to take necessary precautions. Efforts such as firebreaks, controlled burns, and aerial firefighting were employed to limit its impact. While the fire was eventually brought under control, its effects highlighted the ongoing challenges posed by wildfires in the region."
    },
    {
        "id": "deb14d04-54d8-498d-8f44-7e318d1a194f",
        "name": "Grant Fire",
        "year": 2024,
        "county": "Sacramento",
        "latitude": 38.59179,
        "longitude": -121.17954,
        "location": "3410 Grant Line Rd, Rancho Cordova, CA 95742, USA",
        "acres_burned": 119.0,
        "url": "https://www.conservation.ca.gov/dlrp/grant-programs/PublishingImages/RFFC_Grantees_20240325.jpg",
        "description": "The Grant Fire was a wildfire that took place in Sacramento County in the year 2024. This fire was located near 3410 Grant Line Rd, Rancho Cordova, CA 95742, USA and burned an estimated 119.0 acres. With coordinates at (38.59179, -121.17954), the fire posed a significant threat to nearby communities, natural habitats, and local infrastructure. Emergency response teams worked diligently to contain the spread and mitigate potential damage. Local authorities issued alerts to residents, urging them to take necessary precautions. Efforts such as firebreaks, controlled burns, and aerial firefighting were employed to limit its impact. While the fire was eventually brought under control, its effects highlighted the ongoing challenges posed by wildfires in the region."
    },
    {
        "id": "1e0cde32-bc40-4d78-a9cd-052f304f1103",
        "name": "Llano Fire",
        "year": 2024,
        "county": "Los Angeles",
        "latitude": 34.498542,
        "longitude": -117.686469,
        "location": "CA-18, Llano, CA 93544, USA",
        "acres_burned": 30.0,
        "url": "https://cdn.abcotvs.com/dip/images/10624135_051221-kabc-11pm-av-llano-fire-vid-CC-vid.jpg",
        "description": "The Llano Fire was a wildfire that took place in Los Angeles County in the year 2024. This fire was located near CA-18, Llano, CA 93544, USA and burned an estimated 30.0 acres. With coordinates at (34.498542, -117.686469), the fire posed a significant threat to nearby communities, natural habitats, and local infrastructure. Emergency response teams worked diligently to contain the spread and mitigate potential damage. Local authorities issued alerts to residents, urging them to take necessary precautions. Efforts such as firebreaks, controlled burns, and aerial firefighting were employed to limit its impact. While the fire was eventually brought under control, its effects highlighted the ongoing challenges posed by wildfires in the region."
    },
    {
        "id": "578b4cc5-a0b3-4d99-b06e-69ffc53a6220",
        "name": "Johnson Fire",
        "year": 2024,
        "county": "San Joaquin",
        "latitude": 38.177683,
        "longitude": -121.033739,
        "location": "22997 E Acampo Rd, Acampo, CA 95220, USA",
        "acres_burned": 19.5,
        "url": "https://i.ytimg.com/vi/u3YPLXy3Suw/hq720.jpg?sqp=-oaymwEhCK4FEIIDSFryq4qpAxMIARUAAAAAGAElAADIQj0AgKJD&rs=AOn4CLC8xkeMZLg581y-Qs0vlVf70RG5xQ",
        "description": "The Johnson Fire was a wildfire that took place in San Joaquin County in the year 2024. This fire was located near 22997 E Acampo Rd, Acampo, CA 95220, USA and burned an estimated 19.5 acres. With coordinates at (38.177683, -121.033739), the fire posed a significant threat to nearby communities, natural habitats, and local infrastructure. Emergency response teams worked diligently to contain the spread and mitigate potential damage. Local authorities issued alerts to residents, urging them to take necessary precautions. Efforts such as firebreaks, controlled burns, and aerial firefighting were employed to limit its impact. While the fire was eventually brought under control, its effects highlighted the ongoing challenges posed by wildfires in the region."
    },
    {
        "id": "cf71f1c1-3a96-4bc9-bb51-fe036b5c17c5",
        "name": "Peterson Fire",
        "year": 2024,
        "county": "Lassen",
        "latitude": 39.879737,
        "longitude": -120.028888,
        "location": "VXHC+VC Chilcoot-Vinton, CA, USA",
        "acres_burned": 21.9,
        "url": "https://media.defense.gov/2024/Jul/19/2003506677/1920/1080/0/240715-F-QY689-102.JPG",
        "description": "The Peterson Fire was a wildfire that took place in Lassen County in the year 2024. This fire was located near VXHC+VC Chilcoot-Vinton, CA, USA and burned an estimated 21.9 acres. With coordinates at (39.879737, -120.028888), the fire posed a significant threat to nearby communities, natural habitats, and local infrastructure. Emergency response teams worked diligently to contain the spread and mitigate potential damage. Local authorities issued alerts to residents, urging them to take necessary precautions. Efforts such as firebreaks, controlled burns, and aerial firefighting were employed to limit its impact. While the fire was eventually brought under control, its effects highlighted the ongoing challenges posed by wildfires in the region."
    },
    {
        "id": "e493c4b8-5848-4f01-ac3a-d577c393eb12",
        "name": "5 Fire",
        "year": 2024,
        "county": "Kern",
        "latitude": 35.50256,
        "longitude": -119.53449,
        "location": "GF38+26 Spicer City, CA, USA",
        "acres_burned": 30.0,
        "url": "https://www.ttnews.com/sites/default/files/styles/article_full_width_image/public/images/articles/california-wildfire.jpg",
        "description": "The 5 Fire was a wildfire that took place in Kern County in the year 2024. This fire was located near GF38+26 Spicer City, CA, USA and burned an estimated 30.0 acres. With coordinates at (35.50256, -119.53449), the fire posed a significant threat to nearby communities, natural habitats, and local infrastructure. Emergency response teams worked diligently to contain the spread and mitigate potential damage. Local authorities issued alerts to residents, urging them to take necessary precautions. Efforts such as firebreaks, controlled burns, and aerial firefighting were employed to limit its impact. While the fire was eventually brought under control, its effects highlighted the ongoing challenges posed by wildfires in the region."
    },
    {
        "id": "03232795-7d5f-4998-b04b-98628cdb40db",
        "name": "Felipe Fire",
        "year": 2024,
        "county": "Santa Clara",
        "latitude": 37.28197,
        "longitude": -121.73844,
        "location": "3493 Meadowlands Ln, San Jose, CA 95135, USA",
        "acres_burned": 19.1,
        "url": "https://static.abcotvs.com/kgo/images/cms/061524-kgo-san-jose-fire-department-felipe-fire-img.jpg",
        "description": "The Felipe Fire was a wildfire that took place in Santa Clara County in the year 2024. This fire was located near 3493 Meadowlands Ln, San Jose, CA 95135, USA and burned an estimated 19.1 acres. With coordinates at (37.28197, -121.73844), the fire posed a significant threat to nearby communities, natural habitats, and local infrastructure. Emergency response teams worked diligently to contain the spread and mitigate potential damage. Local authorities issued alerts to residents, urging them to take necessary precautions. Efforts such as firebreaks, controlled burns, and aerial firefighting were employed to limit its impact. While the fire was eventually brought under control, its effects highlighted the ongoing challenges posed by wildfires in the region."
    },
    {
        "id": "c93f7495-a345-4416-80b1-fb91996fa7dd",
        "name": "Post Fire",
        "year": 2024,
        "county": "Los Angeles, Ventura",
        "latitude": 34.79208,
        "longitude": -118.8521,
        "location": "49773 Gorman School Rd, Gorman, CA 93243, USA",
        "acres_burned": 15563.1,
        "url": "https://i0.wp.com/www.directrelief.org/wp-content/uploads/2024/06/post_fire.jpg?fit=1280%2C720&ssl=1",
        "description": "The Post Fire was a wildfire that took place in Los Angeles, Ventura County in the year 2024. This fire was located near 49773 Gorman School Rd, Gorman, CA 93243, USA and burned an estimated 15563.1 acres. With coordinates at (34.79208, -118.8521), the fire posed a significant threat to nearby communities, natural habitats, and local infrastructure. Emergency response teams worked diligently to contain the spread and mitigate potential damage. Local authorities issued alerts to residents, urging them to take necessary precautions. Efforts such as firebreaks, controlled burns, and aerial firefighting were employed to limit its impact. While the fire was eventually brought under control, its effects highlighted the ongoing challenges posed by wildfires in the region."
    },
    {
        "id": "2e93fb95-8e13-4724-b358-ca3824e4a6ca",
        "name": "Junes Fire",
        "year": 2024,
        "county": "Butte",
        "latitude": 39.369439,
        "longitude": -121.518592,
        "location": "435 4 Junes Way, Oroville, CA 95966, USA",
        "acres_burned": 1056.0,
        "url": "https://media.abc10.com/assets/KXTV/images/e8c9a3ba-216c-4f92-867a-6a1e7e686501/20240615T230511/e8c9a3ba-216c-4f92-867a-6a1e7e686501_1920x1080.jpg",
        "description": "The Junes Fire was a wildfire that took place in Butte County in the year 2024. This fire was located near 435 4 Junes Way, Oroville, CA 95966, USA and burned an estimated 1056.0 acres. With coordinates at (39.369439, -121.518592), the fire posed a significant threat to nearby communities, natural habitats, and local infrastructure. Emergency response teams worked diligently to contain the spread and mitigate potential damage. Local authorities issued alerts to residents, urging them to take necessary precautions. Efforts such as firebreaks, controlled burns, and aerial firefighting were employed to limit its impact. While the fire was eventually brought under control, its effects highlighted the ongoing challenges posed by wildfires in the region."
    },
    {
        "id": "99234b51-ab68-4aac-978c-af52b5a2f575",
        "name": "Hernandez Fire",
        "year": 2024,
        "county": "San Benito",
        "latitude": 36.400976,
        "longitude": -120.986676,
        "location": "2075 Coalinga Rd, King City, CA 93930, USA",
        "acres_burned": 642.0,
        "url": "https://www.desertsun.com/gcdn/authoring/authoring-images/2024/07/30/USAT/74603344007-park-fire-california-02.jpg?crop=4994,2806,x4,y184&width=660&height=371&format=pjpg&auto=webp",
        "description": "The Hernandez Fire was a wildfire that took place in San Benito County in the year 2024. This fire was located near 2075 Coalinga Rd, King City, CA 93930, USA and burned an estimated 642.0 acres. With coordinates at (36.400976, -120.986676), the fire posed a significant threat to nearby communities, natural habitats, and local infrastructure. Emergency response teams worked diligently to contain the spread and mitigate potential damage. Local authorities issued alerts to residents, urging them to take necessary precautions. Efforts such as firebreaks, controlled burns, and aerial firefighting were employed to limit its impact. While the fire was eventually brought under control, its effects highlighted the ongoing challenges posed by wildfires in the region."
    },
    {
        "id": "e25bfa39-b7c2-418a-9dd1-af0fa6677fab",
        "name": "Rocky Fire",
        "year": 2024,
        "county": "Butte",
        "latitude": 39.548761,
        "longitude": -121.355159,
        "location": "38 Carter Rd, Oroville, CA 95966, USA",
        "acres_burned": 17.7,
        "url": "https://eoimages.gsfc.nasa.gov/images/imagerecords/86000/86348/rockyfire_oli_2015215_swir.jpg",
        "description": "The Rocky Fire was a wildfire that took place in Butte County in the year 2024. This fire was located near 38 Carter Rd, Oroville, CA 95966, USA and burned an estimated 17.7 acres. With coordinates at (39.548761, -121.355159), the fire posed a significant threat to nearby communities, natural habitats, and local infrastructure. Emergency response teams worked diligently to contain the spread and mitigate potential damage. Local authorities issued alerts to residents, urging them to take necessary precautions. Efforts such as firebreaks, controlled burns, and aerial firefighting were employed to limit its impact. While the fire was eventually brought under control, its effects highlighted the ongoing challenges posed by wildfires in the region."
    },
    {
        "id": "b82bba9f-0d5e-44a4-9547-190c7b147ebc",
        "name": "Sioux Fire",
        "year": 2024,
        "county": "Madera",
        "latitude": 37.207647,
        "longitude": -119.673538,
        "location": "31562 Sioux Rd, Coarsegold, CA 93614, USA",
        "acres_burned": 15.0,
        "url": "https://www.americanindianmagazine.org/sites/default/files/styles/max_1300x1300/public/2021-06/ignitingFire_02.jpg?itok=iMLnpqK2",
        "description": "The Sioux Fire was a wildfire that took place in Madera County in the year 2024. This fire was located near 31562 Sioux Rd, Coarsegold, CA 93614, USA and burned an estimated 15.0 acres. With coordinates at (37.207647, -119.673538), the fire posed a significant threat to nearby communities, natural habitats, and local infrastructure. Emergency response teams worked diligently to contain the spread and mitigate potential damage. Local authorities issued alerts to residents, urging them to take necessary precautions. Efforts such as firebreaks, controlled burns, and aerial firefighting were employed to limit its impact. While the fire was eventually brought under control, its effects highlighted the ongoing challenges posed by wildfires in the region."
    },
    {
        "id": "520a9130-6e98-4f88-b654-0e77e33edb04",
        "name": "West Fire",
        "year": 2024,
        "county": "Los Angeles",
        "latitude": 34.73279,
        "longitude": -118.29017,
        "location": "46797 90th St W, Lancaster, CA 93536, USA",
        "acres_burned": 300.0,
        "url": "https://media.cnn.com/api/v1/images/stellar/prod/ap24255353740807.jpg?c=16x9&q=h_833,w_1480,c_fill",
        "description": "The West Fire was a wildfire that took place in Los Angeles County in the year 2024. This fire was located near 46797 90th St W, Lancaster, CA 93536, USA and burned an estimated 300.0 acres. With coordinates at (34.73279, -118.29017), the fire posed a significant threat to nearby communities, natural habitats, and local infrastructure. Emergency response teams worked diligently to contain the spread and mitigate potential damage. Local authorities issued alerts to residents, urging them to take necessary precautions. Efforts such as firebreaks, controlled burns, and aerial firefighting were employed to limit its impact. While the fire was eventually brought under control, its effects highlighted the ongoing challenges posed by wildfires in the region."
    },
    {
        "id": "d110b1b2-327e-43e9-9c26-d49a1fbcbf15",
        "name": "Hesperia Fire",
        "year": 2024,
        "county": "San Bernardino",
        "latitude": 34.30769,
        "longitude": -117.28811,
        "location": "17183 CA-173, Hesperia, CA 92345, USA",
        "acres_burned": 1078.0,
        "url": "https://www.vvdailypress.com/gcdn/authoring/authoring-images/2024/06/16/NVIC/74116340007-hesperia-fire-jose-gonzalez.jpg",
        "description": "The Hesperia Fire was a wildfire that took place in San Bernardino County in the year 2024. This fire was located near 17183 CA-173, Hesperia, CA 92345, USA and burned an estimated 1078.0 acres. With coordinates at (34.30769, -117.28811), the fire posed a significant threat to nearby communities, natural habitats, and local infrastructure. Emergency response teams worked diligently to contain the spread and mitigate potential damage. Local authorities issued alerts to residents, urging them to take necessary precautions. Efforts such as firebreaks, controlled burns, and aerial firefighting were employed to limit its impact. While the fire was eventually brought under control, its effects highlighted the ongoing challenges posed by wildfires in the region."
    },
    {
        "id": "2aad2b91-45f7-42b9-8299-1cdf3aacf1c2",
        "name": "Excelsior Fire",
        "year": 2024,
        "county": "Sacramento",
        "latitude": 38.52658,
        "longitude": -121.28408,
        "location": "GPG8+J9 Mather, CA, USA",
        "acres_burned": 876.5,
        "url": "https://media.abc10.com/assets/KXTV/images/ebca7b21-9e22-4852-9b65-dbbb3d05d2fe/20240616T222039/ebca7b21-9e22-4852-9b65-dbbb3d05d2fe_1920x1080.jpg",
        "description": "The Excelsior Fire was a wildfire that took place in Sacramento County in the year 2024. This fire was located near GPG8+J9 Mather, CA, USA and burned an estimated 876.5 acres. With coordinates at (38.52658, -121.28408), the fire posed a significant threat to nearby communities, natural habitats, and local infrastructure. Emergency response teams worked diligently to contain the spread and mitigate potential damage. Local authorities issued alerts to residents, urging them to take necessary precautions. Efforts such as firebreaks, controlled burns, and aerial firefighting were employed to limit its impact. While the fire was eventually brought under control, its effects highlighted the ongoing challenges posed by wildfires in the region."
    },
    {
        "id": "38faf6b6-365c-45f8-9e45-a6d121a4178b",
        "name": "Lisa Fire",
        "year": 2024,
        "county": "Riverside",
        "latitude": 33.943389,
        "longitude": -117.06443,
        "location": "WWVP+96 Beaumont, CA, USA",
        "acres_burned": 890.0,
        "url": "https://healthier.stanfordchildrens.org/wp-content/uploads/2021/08/iStock-1282911581-003_fire_plum_urban--scaled.jpg",
        "description": "The Lisa Fire was a wildfire that took place in Riverside County in the year 2024. This fire was located near WWVP+96 Beaumont, CA, USA and burned an estimated 890.0 acres. With coordinates at (33.943389, -117.06443), the fire posed a significant threat to nearby communities, natural habitats, and local infrastructure. Emergency response teams worked diligently to contain the spread and mitigate potential damage. Local authorities issued alerts to residents, urging them to take necessary precautions. Efforts such as firebreaks, controlled burns, and aerial firefighting were employed to limit its impact. While the fire was eventually brought under control, its effects highlighted the ongoing challenges posed by wildfires in the region."
    },
    {
        "id": "8cc1df77-db00-4f1e-a167-66941973a5b9",
        "name": "Point Fire",
        "year": 2024,
        "county": "Sonoma",
        "latitude": 38.705475,
        "longitude": -123.012253,
        "location": "100 Marina Rd, Healdsburg, CA 95448, USA",
        "acres_burned": 1207.0,
        "url": "https://www.kron4.com/wp-content/uploads/sites/11/2024/06/Point-Fire-AP2.jpg?w=900",
        "description": "The Point Fire was a wildfire that took place in Sonoma County in the year 2024. This fire was located near 100 Marina Rd, Healdsburg, CA 95448, USA and burned an estimated 1207.0 acres. With coordinates at (38.705475, -123.012253), the fire posed a significant threat to nearby communities, natural habitats, and local infrastructure. Emergency response teams worked diligently to contain the spread and mitigate potential damage. Local authorities issued alerts to residents, urging them to take necessary precautions. Efforts such as firebreaks, controlled burns, and aerial firefighting were employed to limit its impact. While the fire was eventually brought under control, its effects highlighted the ongoing challenges posed by wildfires in the region."
    },
    {
        "id": "b1c20387-c024-40d6-bb7d-ed46655c4222",
        "name": "Inkopah 5 Fire",
        "year": 2024,
        "county": "Imperial",
        "latitude": 32.655183,
        "longitude": -116.099983,
        "location": "5 In-Ko-Pah Park Rd, Ocotillo, CA 92259, USA",
        "acres_burned": 30.0,
        "url": "https://ssl.cdn-redfin.com/photo/48/mbphotov2/249/genMid.230002249_0.jpg",
        "description": "The Inkopah 5 Fire was a wildfire that took place in Imperial County in the year 2024. This fire was located near 5 In-Ko-Pah Park Rd, Ocotillo, CA 92259, USA and burned an estimated 30.0 acres. With coordinates at (32.655183, -116.099983), the fire posed a significant threat to nearby communities, natural habitats, and local infrastructure. Emergency response teams worked diligently to contain the spread and mitigate potential damage. Local authorities issued alerts to residents, urging them to take necessary precautions. Efforts such as firebreaks, controlled burns, and aerial firefighting were employed to limit its impact. While the fire was eventually brought under control, its effects highlighted the ongoing challenges posed by wildfires in the region."
    },
    {
        "id": "e4775796-95cc-45ef-b47a-f07c84169590",
        "name": "Summit Fire",
        "year": 2024,
        "county": "San Bernardino",
        "latitude": 34.369667,
        "longitude": -117.335667,
        "location": "9M97+VP Hesperia, CA, USA",
        "acres_burned": 12.5,
        "url": "https://eoimages.gsfc.nasa.gov/images/imagerecords/19000/19996/Fresno_AMO_2008143.jpg",
        "description": "The Summit Fire was a wildfire that took place in San Bernardino County in the year 2024. This fire was located near 9M97+VP Hesperia, CA, USA and burned an estimated 12.5 acres. With coordinates at (34.369667, -117.335667), the fire posed a significant threat to nearby communities, natural habitats, and local infrastructure. Emergency response teams worked diligently to contain the spread and mitigate potential damage. Local authorities issued alerts to residents, urging them to take necessary precautions. Efforts such as firebreaks, controlled burns, and aerial firefighting were employed to limit its impact. While the fire was eventually brought under control, its effects highlighted the ongoing challenges posed by wildfires in the region."
    },
    {
        "id": "df73d9d0-1193-462a-836b-baca046bd399",
        "name": "Elgin Fire",
        "year": 2024,
        "county": "Merced",
        "latitude": 37.097775,
        "longitude": -120.635371,
        "location": "12999 Elgin Ave, Dos Palos, CA 93620, USA",
        "acres_burned": 86.0,
        "url": "https://i.ytimg.com/vi/B5u0Ni05LH8/hq720.jpg?sqp=-oaymwEhCK4FEIIDSFryq4qpAxMIARUAAAAAGAElAADIQj0AgKJD&rs=AOn4CLDd8OquQs-ylgNkCKObr4kJZ7GwFQ",
        "description": "The Elgin Fire was a wildfire that took place in Merced County in the year 2024. This fire was located near 12999 Elgin Ave, Dos Palos, CA 93620, USA and burned an estimated 86.0 acres. With coordinates at (37.097775, -120.635371), the fire posed a significant threat to nearby communities, natural habitats, and local infrastructure. Emergency response teams worked diligently to contain the spread and mitigate potential damage. Local authorities issued alerts to residents, urging them to take necessary precautions. Efforts such as firebreaks, controlled burns, and aerial firefighting were employed to limit its impact. While the fire was eventually brought under control, its effects highlighted the ongoing challenges posed by wildfires in the region."
    },
    {
        "id": "b20598f6-8122-4d4f-bb49-1d9657b48916",
        "name": "Max Fire",
        "year": 2024,
        "county": "Los Angeles",
        "latitude": 34.67529,
        "longitude": -118.27108,
        "location": "43644 80th St W, Lancaster, CA 93536, USA",
        "acres_burned": 337.6,
        "url": "https://cafirefoundation-prod.bytrilogy.com/news/announcements/lodd/Max-full-1.jpg",
        "description": "The Max Fire was a wildfire that took place in Los Angeles County in the year 2024. This fire was located near 43644 80th St W, Lancaster, CA 93536, USA and burned an estimated 337.6 acres. With coordinates at (34.67529, -118.27108), the fire posed a significant threat to nearby communities, natural habitats, and local infrastructure. Emergency response teams worked diligently to contain the spread and mitigate potential damage. Local authorities issued alerts to residents, urging them to take necessary precautions. Efforts such as firebreaks, controlled burns, and aerial firefighting were employed to limit its impact. While the fire was eventually brought under control, its effects highlighted the ongoing challenges posed by wildfires in the region."
    },
    {
        "id": "cba02f77-7fd1-4870-b4b4-e25a1d30cfe8",
        "name": "Hidden Fire",
        "year": 2024,
        "county": "Shasta",
        "latitude": 40.72052,
        "longitude": -122.23967,
        "location": "14911 Bear Mountain Rd, Redding, CA 96003, USA",
        "acres_burned": 45.0,
        "url": "https://krcrtv.com/resources/media/b80c9ace-991c-418b-bd14-fcf8aaddd2e5-medium16x9_thumbnail_Resized_20240616_172910.jpg",
        "description": "The Hidden Fire was a wildfire that took place in Shasta County in the year 2024. This fire was located near 14911 Bear Mountain Rd, Redding, CA 96003, USA and burned an estimated 45.0 acres. With coordinates at (40.72052, -122.23967), the fire posed a significant threat to nearby communities, natural habitats, and local infrastructure. Emergency response teams worked diligently to contain the spread and mitigate potential damage. Local authorities issued alerts to residents, urging them to take necessary precautions. Efforts such as firebreaks, controlled burns, and aerial firefighting were employed to limit its impact. While the fire was eventually brought under control, its effects highlighted the ongoing challenges posed by wildfires in the region."
    },
    {
        "id": "b1345511-654e-48c2-a117-7c5c3322567e",
        "name": "62 Fire",
        "year": 2024,
        "county": "Riverside",
        "latitude": 33.984079,
        "longitude": -116.583039,
        "location": "60500 Mission Creek Rd, Whitewater, CA 92282, USA",
        "acres_burned": 12.8,
        "url": "https://www.desertsun.com/gcdn/presto/2022/06/06/PPAS/1c01aab5-e0e9-45c9-a000-70fd73c29ef7-thermal_fire_1.jpg?crop=3999,2250,x0,y203&width=660&height=372&format=pjpg&auto=webp",
        "description": "The 62 Fire was a wildfire that took place in Riverside County in the year 2024. This fire was located near 60500 Mission Creek Rd, Whitewater, CA 92282, USA and burned an estimated 12.8 acres. With coordinates at (33.984079, -116.583039), the fire posed a significant threat to nearby communities, natural habitats, and local infrastructure. Emergency response teams worked diligently to contain the spread and mitigate potential damage. Local authorities issued alerts to residents, urging them to take necessary precautions. Efforts such as firebreaks, controlled burns, and aerial firefighting were employed to limit its impact. While the fire was eventually brought under control, its effects highlighted the ongoing challenges posed by wildfires in the region."
    },
    {
        "id": "2a44c40f-2777-488e-8830-bdb0c668b0b8",
        "name": "Tuscany Fire",
        "year": 2024,
        "county": "Riverside",
        "latitude": 33.847642,
        "longitude": -116.569117,
        "location": "2579 City View Dr, Palm Springs, CA 92262, USA",
        "acres_burned": 126.0,
        "url": "https://www.desertsun.com/gcdn/authoring/authoring-images/2024/06/17/PPAS/74130805007-tuscany-fire-16.jpg?crop=5471,3079,x0,y284&width=660&height=371&format=pjpg&auto=webp",
        "description": "The Tuscany Fire was a wildfire that took place in Riverside County in the year 2024. This fire was located near 2579 City View Dr, Palm Springs, CA 92262, USA and burned an estimated 126.0 acres. With coordinates at (33.847642, -116.569117), the fire posed a significant threat to nearby communities, natural habitats, and local infrastructure. Emergency response teams worked diligently to contain the spread and mitigate potential damage. Local authorities issued alerts to residents, urging them to take necessary precautions. Efforts such as firebreaks, controlled burns, and aerial firefighting were employed to limit its impact. While the fire was eventually brought under control, its effects highlighted the ongoing challenges posed by wildfires in the region."
    },
    {
        "id": "4cc240db-5c8a-4833-a4c6-8757772a858f",
        "name": "Slough Fire",
        "year": 2024,
        "county": "Riverside",
        "latitude": 36.996139,
        "longitude": -120.383187,
        "location": "Rd 9, Chowchilla, CA 93610, USA",
        "acres_burned": 33.0,
        "url": "https://cdn.abcotvs.com/dip/images/13400060_061823-kfsn-6p-fresno-co-wildfire-vid.jpg",
        "description": "The Slough Fire was a wildfire that took place in Riverside County in the year 2024. This fire was located near Rd 9, Chowchilla, CA 93610, USA and burned an estimated 33.0 acres. With coordinates at (36.996139, -120.383187), the fire posed a significant threat to nearby communities, natural habitats, and local infrastructure. Emergency response teams worked diligently to contain the spread and mitigate potential damage. Local authorities issued alerts to residents, urging them to take necessary precautions. Efforts such as firebreaks, controlled burns, and aerial firefighting were employed to limit its impact. While the fire was eventually brought under control, its effects highlighted the ongoing challenges posed by wildfires in the region."
    },
    {
        "id": "a172c94e-6352-456e-b2fd-424844667ec2",
        "name": "Railroad Fire",
        "year": 2024,
        "county": "Madera",
        "latitude": 37.010829,
        "longitude": -120.056215,
        "location": "26971 Ave 18, Madera, CA 93638, USA",
        "acres_burned": 13.0,
        "url": "https://www.up.com/cs/groups/public/@uprr/@corprel/documents/digitalmedia/img_up_instrk-ca-fire-pm_mr.jpg",
        "description": "The Railroad Fire was a wildfire that took place in Madera County in the year 2024. This fire was located near 26971 Ave 18, Madera, CA 93638, USA and burned an estimated 13.0 acres. With coordinates at (37.010829, -120.056215), the fire posed a significant threat to nearby communities, natural habitats, and local infrastructure. Emergency response teams worked diligently to contain the spread and mitigate potential damage. Local authorities issued alerts to residents, urging them to take necessary precautions. Efforts such as firebreaks, controlled burns, and aerial firefighting were employed to limit its impact. While the fire was eventually brought under control, its effects highlighted the ongoing challenges posed by wildfires in the region."
    },
    {
        "id": "311ac02a-61aa-4a29-980a-998ce071f438",
        "name": "Sites Fire",
        "year": 2024,
        "county": "Colusa",
        "latitude": 39.31646,
        "longitude": -122.46934,
        "location": "4482 Sites Lodoga Rd, Williams, CA 95987, USA",
        "acres_burned": 19195.0,
        "url": "https://www.reuters.com/resizer/v2/GRPGG4B3WRMDJPARW2ISLFWPCY.jpg?auth=45eb2ad85778355549da3affe562a90c96497a933daf966acd93b591e4f38672&width=1920&quality=80",
        "description": "The Sites Fire was a wildfire that took place in Colusa County in the year 2024. This fire was located near 4482 Sites Lodoga Rd, Williams, CA 95987, USA and burned an estimated 19195.0 acres. With coordinates at (39.31646, -122.46934), the fire posed a significant threat to nearby communities, natural habitats, and local infrastructure. Emergency response teams worked diligently to contain the spread and mitigate potential damage. Local authorities issued alerts to residents, urging them to take necessary precautions. Efforts such as firebreaks, controlled burns, and aerial firefighting were employed to limit its impact. While the fire was eventually brought under control, its effects highlighted the ongoing challenges posed by wildfires in the region."
    },
    {
        "id": "9f426988-5213-4e2c-931f-52517cb4d3e1",
        "name": "Stage Fire",
        "year": 2024,
        "county": "Tulare",
        "latitude": 35.942249,
        "longitude": -118.946399,
        "location": "7714 Old Stage Coach Rd, Porterville, CA 93257, USA",
        "acres_burned": 81.2,
        "url": "https://media.cnn.com/api/v1/images/stellar/prod/230126114954-laguna-niguel-fire-2022-restricted.jpg?c=16x9&q=h_833,w_1480,c_fill",
        "description": "The Stage Fire was a wildfire that took place in Tulare County in the year 2024. This fire was located near 7714 Old Stage Coach Rd, Porterville, CA 93257, USA and burned an estimated 81.2 acres. With coordinates at (35.942249, -118.946399), the fire posed a significant threat to nearby communities, natural habitats, and local infrastructure. Emergency response teams worked diligently to contain the spread and mitigate potential damage. Local authorities issued alerts to residents, urging them to take necessary precautions. Efforts such as firebreaks, controlled burns, and aerial firefighting were employed to limit its impact. While the fire was eventually brought under control, its effects highlighted the ongoing challenges posed by wildfires in the region."
    },
    {
        "id": "84856109-00eb-410f-b86e-908b8788fbfb",
        "name": "Coast Fire",
        "year": 2024,
        "county": "Monterey",
        "latitude": 36.311477,
        "longitude": -121.855352,
        "location": "Coast Rd, Big Sur, CA 93920, USA",
        "acres_burned": 15.0,
        "url": "https://cdn.coastalscience.noaa.gov/csmedia/2022/09/fire-smoke-plume-rises-above-California-coast-near-Malibu-Nov-2018-USDA-scaled.jpg",
        "description": "The Coast Fire was a wildfire that took place in Monterey County in the year 2024. This fire was located near Coast Rd, Big Sur, CA 93920, USA and burned an estimated 15.0 acres. With coordinates at (36.311477, -121.855352), the fire posed a significant threat to nearby communities, natural habitats, and local infrastructure. Emergency response teams worked diligently to contain the spread and mitigate potential damage. Local authorities issued alerts to residents, urging them to take necessary precautions. Efforts such as firebreaks, controlled burns, and aerial firefighting were employed to limit its impact. While the fire was eventually brought under control, its effects highlighted the ongoing challenges posed by wildfires in the region."
    },
    {
        "id": "4c10216b-5a51-4a3d-ae55-700d44bd2bee",
        "name": "Douglas Fire",
        "year": 2024,
        "county": "Sacramento",
        "latitude": 38.54166,
        "longitude": -121.24438,
        "location": "GQR4+M6 Mather, CA, USA",
        "acres_burned": 585.0,
        "url": "https://cloudfront-us-east-1.images.arcpublishing.com/opb/YUHZIJO23JEJO3MRYAWO2XYGQY.jpg",
        "description": "The Douglas Fire was a wildfire that took place in Sacramento County in the year 2024. This fire was located near GQR4+M6 Mather, CA, USA and burned an estimated 585.0 acres. With coordinates at (38.54166, -121.24438), the fire posed a significant threat to nearby communities, natural habitats, and local infrastructure. Emergency response teams worked diligently to contain the spread and mitigate potential damage. Local authorities issued alerts to residents, urging them to take necessary precautions. Efforts such as firebreaks, controlled burns, and aerial firefighting were employed to limit its impact. While the fire was eventually brought under control, its effects highlighted the ongoing challenges posed by wildfires in the region."
    },
    {
        "id": "ea7c5069-2636-470b-bfba-5aa621fb8a98",
        "name": "Aero Fire",
        "year": 2024,
        "county": "Calaveras",
        "latitude": 38.031684,
        "longitude": -120.684174,
        "location": "28J8+M8 Carmen City, CA, USA",
        "acres_burned": 5284.8,
        "url": "https://media.abc10.com/assets/KXTV/images/a13817f6-0c1b-48bb-8a61-32f78131d54f/20240618T124257/a13817f6-0c1b-48bb-8a61-32f78131d54f_1140x641.jpg",
        "description": "The Aero Fire was a wildfire that took place in Calaveras County in the year 2024. This fire was located near 28J8+M8 Carmen City, CA, USA and burned an estimated 5284.8 acres. With coordinates at (38.031684, -120.684174), the fire posed a significant threat to nearby communities, natural habitats, and local infrastructure. Emergency response teams worked diligently to contain the spread and mitigate potential damage. Local authorities issued alerts to residents, urging them to take necessary precautions. Efforts such as firebreaks, controlled burns, and aerial firefighting were employed to limit its impact. While the fire was eventually brought under control, its effects highlighted the ongoing challenges posed by wildfires in the region."
    },
    {
        "id": "a53fc171-b27f-4475-8968-4789becbf807",
        "name": "Ingomar Fire",
        "year": 2024,
        "county": "Merced",
        "latitude": 37.15858,
        "longitude": -120.968478,
        "location": "26003 Husman Rd, Gustine, CA 95322, USA",
        "acres_burned": 12.0,
        "url": "https://c8.alamy.com/comp/2RAHEC0/historisches-feuerwehrfahrzeug-hpc-fire-truck-ingomar-2RAHEC0.jpg",
        "description": "The Ingomar Fire was a wildfire that took place in Merced County in the year 2024. This fire was located near 26003 Husman Rd, Gustine, CA 95322, USA and burned an estimated 12.0 acres. With coordinates at (37.15858, -120.968478), the fire posed a significant threat to nearby communities, natural habitats, and local infrastructure. Emergency response teams worked diligently to contain the spread and mitigate potential damage. Local authorities issued alerts to residents, urging them to take necessary precautions. Efforts such as firebreaks, controlled burns, and aerial firefighting were employed to limit its impact. While the fire was eventually brought under control, its effects highlighted the ongoing challenges posed by wildfires in the region."
    },
    {
        "id": "120b981a-e8e9-45a9-aeee-f1f0d1aa2aaf",
        "name": "Spring Fire",
        "year": 2024,
        "county": "Tuolumne",
        "latitude": 37.843349,
        "longitude": -120.50804,
        "location": "12099 La Grange Rd, Jamestown, CA 95327, USA",
        "acres_burned": 51.3,
        "url": "https://media.cbs8.com/assets/KFMB/images/079b733c-c7f0-4495-9b04-b4fb7c926575/079b733c-c7f0-4495-9b04-b4fb7c926575_1920x1080.jpg",
        "description": "The Spring Fire was a wildfire that took place in Tuolumne County in the year 2024. This fire was located near 12099 La Grange Rd, Jamestown, CA 95327, USA and burned an estimated 51.3 acres. With coordinates at (37.843349, -120.50804), the fire posed a significant threat to nearby communities, natural habitats, and local infrastructure. Emergency response teams worked diligently to contain the spread and mitigate potential damage. Local authorities issued alerts to residents, urging them to take necessary precautions. Efforts such as firebreaks, controlled burns, and aerial firefighting were employed to limit its impact. While the fire was eventually brought under control, its effects highlighted the ongoing challenges posed by wildfires in the region."
    },
    {
        "id": "cd7aebca-2b90-4953-a108-2a0cab35a196",
        "name": "Sky Fire",
        "year": 2024,
        "county": "Kern",
        "latitude": 35.32752,
        "longitude": -119.462711,
        "location": "8GHP+2W Buttonwillow, CA, USA",
        "acres_burned": 528.0,
        "url": "https://c.ndtvimg.com/2018-11/nk07d7g_california-wildfire_625x300_11_November_18.jpg",
        "description": "The Sky Fire was a wildfire that took place in Kern County in the year 2024. This fire was located near 8GHP+2W Buttonwillow, CA, USA and burned an estimated 528.0 acres. With coordinates at (35.32752, -119.462711), the fire posed a significant threat to nearby communities, natural habitats, and local infrastructure. Emergency response teams worked diligently to contain the spread and mitigate potential damage. Local authorities issued alerts to residents, urging them to take necessary precautions. Efforts such as firebreaks, controlled burns, and aerial firefighting were employed to limit its impact. While the fire was eventually brought under control, its effects highlighted the ongoing challenges posed by wildfires in the region."
    },
    {
        "id": "2d437393-53dd-43c7-93db-5822d65372b8",
        "name": "Scotts Fire",
        "year": 2024,
        "county": "Lake",
        "latitude": 39.118221,
        "longitude": -122.984408,
        "location": "6300 Scotts Valley Rd, Lakeport, CA 95453, USA",
        "acres_burned": 38.0,
        "url": "https://lakeconews.com/images/stories/2012/september/090712scottsfiretankerpa3.jpg",
        "description": "The Scotts Fire was a wildfire that took place in Lake County in the year 2024. This fire was located near 6300 Scotts Valley Rd, Lakeport, CA 95453, USA and burned an estimated 38.0 acres. With coordinates at (39.118221, -122.984408), the fire posed a significant threat to nearby communities, natural habitats, and local infrastructure. Emergency response teams worked diligently to contain the spread and mitigate potential damage. Local authorities issued alerts to residents, urging them to take necessary precautions. Efforts such as firebreaks, controlled burns, and aerial firefighting were employed to limit its impact. While the fire was eventually brought under control, its effects highlighted the ongoing challenges posed by wildfires in the region."
    },
    {
        "id": "cd369e40-e1c3-48be-8ef4-4561980bd9b1",
        "name": "Daytona Fire",
        "year": 2024,
        "county": "Kern",
        "latitude": 35.382,
        "longitude": -118.878444,
        "location": "94JC+RJ Bakersfield, CA, USA",
        "acres_burned": 123.0,
        "url": "https://www.news-journalonline.com/gcdn/presto/2021/11/29/NDNJ/c9102af7-de6e-4039-a8c4-dbef2ef45f13-thumbnail_IMG_2771_1_2.jpg?crop=1279,720,x0,y144&width=1279&height=720&format=pjpg&auto=webp",
        "description": "The Daytona Fire was a wildfire that took place in Kern County in the year 2024. This fire was located near 94JC+RJ Bakersfield, CA, USA and burned an estimated 123.0 acres. With coordinates at (35.382, -118.878444), the fire posed a significant threat to nearby communities, natural habitats, and local infrastructure. Emergency response teams worked diligently to contain the spread and mitigate potential damage. Local authorities issued alerts to residents, urging them to take necessary precautions. Efforts such as firebreaks, controlled burns, and aerial firefighting were employed to limit its impact. While the fire was eventually brought under control, its effects highlighted the ongoing challenges posed by wildfires in the region."
    },
    {
        "id": "5892dc0c-3c9e-481e-8be1-580a1f9c8bdc",
        "name": "Vista Fire",
        "year": 2024,
        "county": "Merced",
        "latitude": 36.960029,
        "longitude": -120.653749,
        "location": "22462 7th St, Dos Palos, CA 93620, USA",
        "acres_burned": 25.0,
        "url": "https://cdn.shopify.com/s/files/1/0677/4059/8571/articles/LakeFire_Desk.jpg?v=1720545625",
        "description": "The Vista Fire was a wildfire that took place in Merced County in the year 2024. This fire was located near 22462 7th St, Dos Palos, CA 93620, USA and burned an estimated 25.0 acres. With coordinates at (36.960029, -120.653749), the fire posed a significant threat to nearby communities, natural habitats, and local infrastructure. Emergency response teams worked diligently to contain the spread and mitigate potential damage. Local authorities issued alerts to residents, urging them to take necessary precautions. Efforts such as firebreaks, controlled burns, and aerial firefighting were employed to limit its impact. While the fire was eventually brought under control, its effects highlighted the ongoing challenges posed by wildfires in the region."
    },
    {
        "id": "965204c6-995d-41ef-9df8-6e1ffa3f1538",
        "name": "Side Fire",
        "year": 2024,
        "county": "Tulare",
        "latitude": 36.016118,
        "longitude": -118.828001,
        "location": "32657 Indian Reservation Dr, Springville, CA 93265, USA",
        "acres_burned": 137.0,
        "url": "https://www.aljazeera.com/wp-content/uploads/2025/01/2025-01-09T041021Z_1099010655_RC2U5CA2EFGM_RTRMADP_3_CALIFORNIA-WILDFIRES-1736423595.jpg?resize=1800%2C1800&quality=80",
        "description": "The Side Fire was a wildfire that took place in Tulare County in the year 2024. This fire was located near 32657 Indian Reservation Dr, Springville, CA 93265, USA and burned an estimated 137.0 acres. With coordinates at (36.016118, -118.828001), the fire posed a significant threat to nearby communities, natural habitats, and local infrastructure. Emergency response teams worked diligently to contain the spread and mitigate potential damage. Local authorities issued alerts to residents, urging them to take necessary precautions. Efforts such as firebreaks, controlled burns, and aerial firefighting were employed to limit its impact. While the fire was eventually brought under control, its effects highlighted the ongoing challenges posed by wildfires in the region."
    },
    {
        "id": "ccba94f4-0300-45e6-9f9c-247ad68ef603",
        "name": "Kirk Fire",
        "year": 2024,
        "county": "Solano",
        "latitude": 38.220139,
        "longitude": -122.234173,
        "location": "2555 CA-12, American Canyon, CA 94503, USA",
        "acres_burned": 20.0,
        "url": "https://www.capradio.org/media/12265055/img_6068_slide-7acae1e7bf18ae6561c2942512e3a27310fdfc40-s800-c85-p.jpg",
        "description": "The Kirk Fire was a wildfire that took place in Solano County in the year 2024. This fire was located near 2555 CA-12, American Canyon, CA 94503, USA and burned an estimated 20.0 acres. With coordinates at (38.220139, -122.234173), the fire posed a significant threat to nearby communities, natural habitats, and local infrastructure. Emergency response teams worked diligently to contain the spread and mitigate potential damage. Local authorities issued alerts to residents, urging them to take necessary precautions. Efforts such as firebreaks, controlled burns, and aerial firefighting were employed to limit its impact. While the fire was eventually brought under control, its effects highlighted the ongoing challenges posed by wildfires in the region."
    },
    {
        "id": "d379549a-4026-49d4-81f7-12eee7c3134c",
        "name": "Double Fire",
        "year": 2024,
        "county": "Yuba",
        "latitude": 39.458459,
        "longitude": -121.303342,
        "location": "FM5W+9M Challenge-Brownsville, CA, USA",
        "acres_burned": 12.5,
        "url": "https://lakeconews.com/images/stories/2013/aug/081513doublefireortega3.jpg",
        "description": "The Double Fire was a wildfire that took place in Yuba County in the year 2024. This fire was located near FM5W+9M Challenge-Brownsville, CA, USA and burned an estimated 12.5 acres. With coordinates at (39.458459, -121.303342), the fire posed a significant threat to nearby communities, natural habitats, and local infrastructure. Emergency response teams worked diligently to contain the spread and mitigate potential damage. Local authorities issued alerts to residents, urging them to take necessary precautions. Efforts such as firebreaks, controlled burns, and aerial firefighting were employed to limit its impact. While the fire was eventually brought under control, its effects highlighted the ongoing challenges posed by wildfires in the region."
    },
    {
        "id": "f7853da2-4ea7-4d3d-8dcd-a032f1e68275",
        "name": "Pfe Fire",
        "year": 2024,
        "county": "Placer",
        "latitude": 38.728881,
        "longitude": -121.392475,
        "location": "5720 PFE Rd, Roseville, CA 95747, USA",
        "acres_burned": 15.0,
        "url": "https://c8.alamy.com/comp/2PFEJRD/republican-presidential-hopeful-bob-dole-looks-on-as-san-jose-fire-battalion-chief-manuel-alarcon-passes-a-plate-of-eggs-at-a-san-jose-calif-fire-station-tuesday-morning-june-18-1996-dole-and-california-gov-pete-wilson-right-joined-the-firefighters-for-breakfast-ap-photostephan-savoia-2PFEJRD.jpg",
        "description": "The Pfe Fire was a wildfire that took place in Placer County in the year 2024. This fire was located near 5720 PFE Rd, Roseville, CA 95747, USA and burned an estimated 15.0 acres. With coordinates at (38.728881, -121.392475), the fire posed a significant threat to nearby communities, natural habitats, and local infrastructure. Emergency response teams worked diligently to contain the spread and mitigate potential damage. Local authorities issued alerts to residents, urging them to take necessary precautions. Efforts such as firebreaks, controlled burns, and aerial firefighting were employed to limit its impact. While the fire was eventually brought under control, its effects highlighted the ongoing challenges posed by wildfires in the region."
    },
    {
        "id": "61fcca17-72ce-4d55-ab63-b476f513d46b",
        "name": "Basalt Fire",
        "year": 2024,
        "county": "Merced",
        "latitude": 37.060845,
        "longitude": -121.057483,
        "location": "CA-152, Gustine, CA 95322, USA",
        "acres_burned": 58.0,
        "url": "https://www.aquascapeinc.com/upload/58103-fire-basalt-columns.jpg",
        "description": "The Basalt Fire was a wildfire that took place in Merced County in the year 2024. This fire was located near CA-152, Gustine, CA 95322, USA and burned an estimated 58.0 acres. With coordinates at (37.060845, -121.057483), the fire posed a significant threat to nearby communities, natural habitats, and local infrastructure. Emergency response teams worked diligently to contain the spread and mitigate potential damage. Local authorities issued alerts to residents, urging them to take necessary precautions. Efforts such as firebreaks, controlled burns, and aerial firefighting were employed to limit its impact. While the fire was eventually brought under control, its effects highlighted the ongoing challenges posed by wildfires in the region."
    },
    {
        "id": "c393bae6-7c2f-49e0-8d83-e1bb77d887d7",
        "name": "Gulch Fire",
        "year": 2024,
        "county": "Madera",
        "latitude": 37.313117,
        "longitude": -119.791537,
        "location": "38723 Rd 600, Raymond, CA 93653, USA",
        "acres_burned": 11.0,
        "url": "http://www.sgvcitywatch.com/uploads/3/9/2/7/39274377/gulch-fire-update-8-30-22_orig.jpg",
        "description": "The Gulch Fire was a wildfire that took place in Madera County in the year 2024. This fire was located near 38723 Rd 600, Raymond, CA 93653, USA and burned an estimated 11.0 acres. With coordinates at (37.313117, -119.791537), the fire posed a significant threat to nearby communities, natural habitats, and local infrastructure. Emergency response teams worked diligently to contain the spread and mitigate potential damage. Local authorities issued alerts to residents, urging them to take necessary precautions. Efforts such as firebreaks, controlled burns, and aerial firefighting were employed to limit its impact. While the fire was eventually brought under control, its effects highlighted the ongoing challenges posed by wildfires in the region."
    },
    {
        "id": "bc72883a-cba7-40df-9188-54c801003b3b",
        "name": "Water Fire",
        "year": 2024,
        "county": "Kern",
        "latitude": 35.60366,
        "longitude": -119.96709,
        "location": "J23M+F5 Blackwells Corner, CA, USA",
        "acres_burned": 546.0,
        "url": "https://www.rollingstone.com/wp-content/uploads/2025/01/California-water-management.jpg?w=1581&h=1054&crop=1",
        "description": "The Water Fire was a wildfire that took place in Kern County in the year 2024. This fire was located near J23M+F5 Blackwells Corner, CA, USA and burned an estimated 546.0 acres. With coordinates at (35.60366, -119.96709), the fire posed a significant threat to nearby communities, natural habitats, and local infrastructure. Emergency response teams worked diligently to contain the spread and mitigate potential damage. Local authorities issued alerts to residents, urging them to take necessary precautions. Efforts such as firebreaks, controlled burns, and aerial firefighting were employed to limit its impact. While the fire was eventually brought under control, its effects highlighted the ongoing challenges posed by wildfires in the region."
    },
    {
        "id": "dc7cec75-1f29-498e-9139-01644df3b418",
        "name": "Jolon Fire",
        "year": 2024,
        "county": "Monterey",
        "latitude": 35.87405,
        "longitude": -120.835545,
        "location": "72501 Jolon Rd, Bradley, CA 93426, USA",
        "acres_burned": 10.2,
        "url": "https://c8.alamy.com/comp/2S0XM07/us-air-force-staff-sgt-joseph-josey-an-821st-contingency-response-squadron-fire-team-leader-provides-overwatch-during-exercise-hades-sentinel-at-fort-hunter-liggett-in-jolon-california-may-2-2024-during-hades-sentintel-the-821st-crs-was-evaluated-on-how-well-it-performs-base-defense-in-a-simulated-deployment-scenario-us-air-force-photo-by-staff-sgt-scott-warner-2S0XM07.jpg",
        "description": "The Jolon Fire was a wildfire that took place in Monterey County in the year 2024. This fire was located near 72501 Jolon Rd, Bradley, CA 93426, USA and burned an estimated 10.2 acres. With coordinates at (35.87405, -120.835545), the fire posed a significant threat to nearby communities, natural habitats, and local infrastructure. Emergency response teams worked diligently to contain the spread and mitigate potential damage. Local authorities issued alerts to residents, urging them to take necessary precautions. Efforts such as firebreaks, controlled burns, and aerial firefighting were employed to limit its impact. While the fire was eventually brought under control, its effects highlighted the ongoing challenges posed by wildfires in the region."
    },
    {
        "id": "3c562f83-c547-4567-a729-9cf73cdf83c4",
        "name": "Willow Fire",
        "year": 2024,
        "county": "Madera",
        "latitude": 37.154953,
        "longitude": -119.91267,
        "location": "533P+XW Raymond, CA, USA",
        "acres_burned": 213.0,
        "url": "https://patch.com/img/cdn20/users/21854731/20240911/051900/styles/patch_image/public/concord___11171305348.jpg",
        "description": "The Willow Fire was a wildfire that took place in Madera County in the year 2024. This fire was located near 533P+XW Raymond, CA, USA and burned an estimated 213.0 acres. With coordinates at (37.154953, -119.91267), the fire posed a significant threat to nearby communities, natural habitats, and local infrastructure. Emergency response teams worked diligently to contain the spread and mitigate potential damage. Local authorities issued alerts to residents, urging them to take necessary precautions. Efforts such as firebreaks, controlled burns, and aerial firefighting were employed to limit its impact. While the fire was eventually brought under control, its effects highlighted the ongoing challenges posed by wildfires in the region."
    },
    {
        "id": "0aa93bff-3d1e-43af-9958-fa526cd40c31",
        "name": "Border 58 Fire",
        "year": 2024,
        "county": "San Diego",
        "latitude": 32.58748,
        "longitude": -116.894511,
        "location": "H4P4+X5 San Diego, CA, USA",
        "acres_burned": 137.0,
        "url": "https://i.ytimg.com/vi/OBVZ03z_7DY/maxresdefault.jpg",
        "description": "The Border 58 Fire was a wildfire that took place in San Diego County in the year 2024. This fire was located near H4P4+X5 San Diego, CA, USA and burned an estimated 137.0 acres. With coordinates at (32.58748, -116.894511), the fire posed a significant threat to nearby communities, natural habitats, and local infrastructure. Emergency response teams worked diligently to contain the spread and mitigate potential damage. Local authorities issued alerts to residents, urging them to take necessary precautions. Efforts such as firebreaks, controlled burns, and aerial firefighting were employed to limit its impact. While the fire was eventually brought under control, its effects highlighted the ongoing challenges posed by wildfires in the region."
    },
    {
        "id": "912ab9e0-9c07-47c9-8c02-c140d91722ee",
        "name": "Watts Fire",
        "year": 2024,
        "county": "Fresno",
        "latitude": 36.91237,
        "longitude": -119.419517,
        "location": "26717 Watts Valley Rd, Tollhouse, CA 93667, USA",
        "acres_burned": 90.0,
        "url": "https://static.life.com/wp-content/uploads/migrated/2014/12/watts-1966-21-1024x661.jpg",
        "description": "The Watts Fire was a wildfire that took place in Fresno County in the year 2024. This fire was located near 26717 Watts Valley Rd, Tollhouse, CA 93667, USA and burned an estimated 90.0 acres. With coordinates at (36.91237, -119.419517), the fire posed a significant threat to nearby communities, natural habitats, and local infrastructure. Emergency response teams worked diligently to contain the spread and mitigate potential damage. Local authorities issued alerts to residents, urging them to take necessary precautions. Efforts such as firebreaks, controlled burns, and aerial firefighting were employed to limit its impact. While the fire was eventually brought under control, its effects highlighted the ongoing challenges posed by wildfires in the region."
    },
    {
        "id": "ad646835-4be4-466a-967e-7c6382f04bf6",
        "name": "Needles Fire",
        "year": 2024,
        "county": "San Bernardino",
        "latitude": 34.85092,
        "longitude": -114.61131,
        "location": "867 N L St, Needles, CA 92363, USA",
        "acres_burned": 70.0,
        "url": "https://sbcfire.org/wp-content/uploads/sites/46/2022/02/20220205_Needles-Commercial-Building-Destroyed-in-Late-Night-Fire-2.jpg",
        "description": "The Needles Fire was a wildfire that took place in San Bernardino County in the year 2024. This fire was located near 867 N L St, Needles, CA 92363, USA and burned an estimated 70.0 acres. With coordinates at (34.85092, -114.61131), the fire posed a significant threat to nearby communities, natural habitats, and local infrastructure. Emergency response teams worked diligently to contain the spread and mitigate potential damage. Local authorities issued alerts to residents, urging them to take necessary precautions. Efforts such as firebreaks, controlled burns, and aerial firefighting were employed to limit its impact. While the fire was eventually brought under control, its effects highlighted the ongoing challenges posed by wildfires in the region."
    },
    {
        "id": "ba97837b-0723-465c-8782-4b5168dcbe94",
        "name": "Valley Fire",
        "year": 2024,
        "county": "Tulare",
        "latitude": 36.274399,
        "longitude": -119.090599,
        "location": "22105 E Myer Dr, Exeter, CA 93221, USA",
        "acres_burned": 2.0,
        "url": "https://upload.wikimedia.org/wikipedia/commons/a/a0/Valley_Fire_California_CALFIRE.jpg",
        "description": "The Valley Fire was a wildfire that took place in Tulare County in the year 2024. This fire was located near 22105 E Myer Dr, Exeter, CA 93221, USA and burned an estimated 2.0 acres. With coordinates at (36.274399, -119.090599), the fire posed a significant threat to nearby communities, natural habitats, and local infrastructure. Emergency response teams worked diligently to contain the spread and mitigate potential damage. Local authorities issued alerts to residents, urging them to take necessary precautions. Efforts such as firebreaks, controlled burns, and aerial firefighting were employed to limit its impact. While the fire was eventually brought under control, its effects highlighted the ongoing challenges posed by wildfires in the region."
    },
    {
        "id": "7dcfb7b4-7b93-4338-8969-ba1041ab9986",
        "name": "Oak Fire",
        "year": 2024,
        "county": "Riverside",
        "latitude": 33.653953,
        "longitude": -116.927015,
        "location": "42215 Oak Cyn Rd, Hemet, CA 92544, USA",
        "acres_burned": 13.3,
        "url": "https://wildfiretoday.com/wp-content/uploads/2022/07/Oak-Fire-3-D-map-looking-north-at-9-p.m.-July-24-2022.jpg",
        "description": "The Oak Fire was a wildfire that took place in Riverside County in the year 2024. This fire was located near 42215 Oak Cyn Rd, Hemet, CA 92544, USA and burned an estimated 13.3 acres. With coordinates at (33.653953, -116.927015), the fire posed a significant threat to nearby communities, natural habitats, and local infrastructure. Emergency response teams worked diligently to contain the spread and mitigate potential damage. Local authorities issued alerts to residents, urging them to take necessary precautions. Efforts such as firebreaks, controlled burns, and aerial firefighting were employed to limit its impact. While the fire was eventually brought under control, its effects highlighted the ongoing challenges posed by wildfires in the region."
    },
    {
        "id": "112e618e-f612-405b-8908-5df603790f77",
        "name": "10th Fire",
        "year": 2024,
        "county": "Kern",
        "latitude": 34.974609,
        "longitude": -118.137537,
        "location": "325 Balboa Ave, Mojave, CA 93501, USA",
        "acres_burned": 133.0,
        "url": "https://www.nydailynews.com/wp-content/uploads/2023/11/AP23316144283945-1.jpg?w=467",
        "description": "The 10th Fire was a wildfire that took place in Kern County in the year 2024. This fire was located near 325 Balboa Ave, Mojave, CA 93501, USA and burned an estimated 133.0 acres. With coordinates at (34.974609, -118.137537), the fire posed a significant threat to nearby communities, natural habitats, and local infrastructure. Emergency response teams worked diligently to contain the spread and mitigate potential damage. Local authorities issued alerts to residents, urging them to take necessary precautions. Efforts such as firebreaks, controlled burns, and aerial firefighting were employed to limit its impact. While the fire was eventually brought under control, its effects highlighted the ongoing challenges posed by wildfires in the region."
    },
    {
        "id": "1d36aec9-c1bd-4049-a40b-096c6b7dc0b7",
        "name": "Serrano Fire",
        "year": 2024,
        "county": "Riverside",
        "latitude": 33.89433,
        "longitude": -117.55522,
        "location": "635 Barbre Ln, Corona, CA 92879, USA",
        "acres_burned": 11.5,
        "url": "https://preview.redd.it/serrano-fire-v0-tn6z3pl14ebb1.jpg?width=1080&crop=smart&auto=webp&s=46307c22f19f6dfeb27eadcad9b66cafb52c5948",
        "description": "The Serrano Fire was a wildfire that took place in Riverside County in the year 2024. This fire was located near 635 Barbre Ln, Corona, CA 92879, USA and burned an estimated 11.5 acres. With coordinates at (33.89433, -117.55522), the fire posed a significant threat to nearby communities, natural habitats, and local infrastructure. Emergency response teams worked diligently to contain the spread and mitigate potential damage. Local authorities issued alerts to residents, urging them to take necessary precautions. Efforts such as firebreaks, controlled burns, and aerial firefighting were employed to limit its impact. While the fire was eventually brought under control, its effects highlighted the ongoing challenges posed by wildfires in the region."
    },
    {
        "id": "ef627541-e8c5-410d-80b4-d6216e4bbbcb",
        "name": "Muscat Fire",
        "year": 2024,
        "county": "Fresno",
        "latitude": 36.68179,
        "longitude": -119.35579,
        "location": "MJJV+PM Yokuts Valley, CA, USA",
        "acres_burned": 142.0,
        "url": "https://www.muscatdaily.com/wp-content/uploads/2022/08/CALIFORNIA-770x578.jpg",
        "description": "The Muscat Fire was a wildfire that took place in Fresno County in the year 2024. This fire was located near MJJV+PM Yokuts Valley, CA, USA and burned an estimated 142.0 acres. With coordinates at (36.68179, -119.35579), the fire posed a significant threat to nearby communities, natural habitats, and local infrastructure. Emergency response teams worked diligently to contain the spread and mitigate potential damage. Local authorities issued alerts to residents, urging them to take necessary precautions. Efforts such as firebreaks, controlled burns, and aerial firefighting were employed to limit its impact. While the fire was eventually brought under control, its effects highlighted the ongoing challenges posed by wildfires in the region."
    },
    {
        "id": "972ad75a-fadc-4018-945d-6f5e8b10db6b",
        "name": "White Fire",
        "year": 2024,
        "county": "Mariposa",
        "latitude": 37.42087,
        "longitude": -120.00789,
        "location": "3936 Old Hwy, Mariposa, CA 95338, USA",
        "acres_burned": 52.0,
        "url": "https://www.usnews.com/object/image/00000142-9276-d33c-abc6-ff774d530008/42231WM_Fire_130528.jpg?update-time=&size=responsive640",
        "description": "The White Fire was a wildfire that took place in Mariposa County in the year 2024. This fire was located near 3936 Old Hwy, Mariposa, CA 95338, USA and burned an estimated 52.0 acres. With coordinates at (37.42087, -120.00789), the fire posed a significant threat to nearby communities, natural habitats, and local infrastructure. Emergency response teams worked diligently to contain the spread and mitigate potential damage. Local authorities issued alerts to residents, urging them to take necessary precautions. Efforts such as firebreaks, controlled burns, and aerial firefighting were employed to limit its impact. While the fire was eventually brought under control, its effects highlighted the ongoing challenges posed by wildfires in the region."
    },
    {
        "id": "f2432688-2a7d-4030-b3be-94991c782cf5",
        "name": "Willms Fire",
        "year": 2024,
        "county": "Tuolumne",
        "latitude": 37.814796,
        "longitude": -120.656478,
        "location": "12198 Willms Rd, Oakdale, CA 95361, USA",
        "acres_burned": 12.0,
        "url": "https://eoimages.gsfc.nasa.gov/images/imagerecords/10000/10211/California.TMO2002266.jpg",
        "description": "The Willms Fire was a wildfire that took place in Tuolumne County in the year 2024. This fire was located near 12198 Willms Rd, Oakdale, CA 95361, USA and burned an estimated 12.0 acres. With coordinates at (37.814796, -120.656478), the fire posed a significant threat to nearby communities, natural habitats, and local infrastructure. Emergency response teams worked diligently to contain the spread and mitigate potential damage. Local authorities issued alerts to residents, urging them to take necessary precautions. Efforts such as firebreaks, controlled burns, and aerial firefighting were employed to limit its impact. While the fire was eventually brought under control, its effects highlighted the ongoing challenges posed by wildfires in the region."
    },
    {
        "id": "ce429295-7bae-4567-b520-77c78773ece3",
        "name": "Amoruso Fire",
        "year": 2024,
        "county": "Placer",
        "latitude": 38.82437,
        "longitude": -121.3909,
        "location": "3485 Amoruso Way, Roseville, CA 95747, USA",
        "acres_burned": 438.0,
        "url": "https://media.abc10.com/assets/KXTV/images/d38e4753-3c76-4c45-a227-dc173576cdb8/d38e4753-3c76-4c45-a227-dc173576cdb8_750x422.jpg",
        "description": "The Amoruso Fire was a wildfire that took place in Placer County in the year 2024. This fire was located near 3485 Amoruso Way, Roseville, CA 95747, USA and burned an estimated 438.0 acres. With coordinates at (38.82437, -121.3909), the fire posed a significant threat to nearby communities, natural habitats, and local infrastructure. Emergency response teams worked diligently to contain the spread and mitigate potential damage. Local authorities issued alerts to residents, urging them to take necessary precautions. Efforts such as firebreaks, controlled burns, and aerial firefighting were employed to limit its impact. While the fire was eventually brought under control, its effects highlighted the ongoing challenges posed by wildfires in the region."
    },
    {
        "id": "bda3e0c7-b52b-43ca-9459-54fc1a490bc5",
        "name": "1-2 Fire",
        "year": 2024,
        "county": "San Joaquin",
        "latitude": 38.029246,
        "longitude": -120.956888,
        "location": "22HV+M6 Linden, CA, USA",
        "acres_burned": 215.0,
        "url": "https://media.defense.gov/2021/Sep/29/2002864081/1920/1080/0/210914-A-BM014-834.JPG",
        "description": "The 1-2 Fire was a wildfire that took place in San Joaquin County in the year 2024. This fire was located near 22HV+M6 Linden, CA, USA and burned an estimated 215.0 acres. With coordinates at (38.029246, -120.956888), the fire posed a significant threat to nearby communities, natural habitats, and local infrastructure. Emergency response teams worked diligently to contain the spread and mitigate potential damage. Local authorities issued alerts to residents, urging them to take necessary precautions. Efforts such as firebreaks, controlled burns, and aerial firefighting were employed to limit its impact. While the fire was eventually brought under control, its effects highlighted the ongoing challenges posed by wildfires in the region."
    },
    {
        "id": "31a75af9-c850-423f-9a3e-2d8be2bb5f07",
        "name": "Apache Fire",
        "year": 2024,
        "county": "Butte",
        "latitude": 39.418598,
        "longitude": -121.482631,
        "location": "311 Apache Hill Rd, Oroville, CA 95966, USA",
        "acres_burned": 691.0,
        "url": "https://static01.nyt.com/images/2024/06/26/multimedia/26xp-california-fire-cjtz/26xp-california-fire-cjtz-articleLarge.jpg?quality=75&auto=webp&disable=upscale",
        "description": "The Apache Fire was a wildfire that took place in Butte County in the year 2024. This fire was located near 311 Apache Hill Rd, Oroville, CA 95966, USA and burned an estimated 691.0 acres. With coordinates at (39.418598, -121.482631), the fire posed a significant threat to nearby communities, natural habitats, and local infrastructure. Emergency response teams worked diligently to contain the spread and mitigate potential damage. Local authorities issued alerts to residents, urging them to take necessary precautions. Efforts such as firebreaks, controlled burns, and aerial firefighting were employed to limit its impact. While the fire was eventually brought under control, its effects highlighted the ongoing challenges posed by wildfires in the region."
    },
    {
        "id": "dbcdf92c-2be1-4f61-afa7-e0eae6cec5c3",
        "name": "Bear Fire",
        "year": 2024,
        "county": "Mariposa",
        "latitude": 37.557104,
        "longitude": -120.171776,
        "location": "4402 Bear Valley Rd, Catheys Valley, CA 95306, USA",
        "acres_burned": 19.0,
        "url": "https://www.3fishstudios.com/cdn/shop/products/Annie_1080x.jpg?v=1629996607",
        "description": "The Bear Fire was a wildfire that took place in Mariposa County in the year 2024. This fire was located near 4402 Bear Valley Rd, Catheys Valley, CA 95306, USA and burned an estimated 19.0 acres. With coordinates at (37.557104, -120.171776), the fire posed a significant threat to nearby communities, natural habitats, and local infrastructure. Emergency response teams worked diligently to contain the spread and mitigate potential damage. Local authorities issued alerts to residents, urging them to take necessary precautions. Efforts such as firebreaks, controlled burns, and aerial firefighting were employed to limit its impact. While the fire was eventually brought under control, its effects highlighted the ongoing challenges posed by wildfires in the region."
    },
    {
        "id": "f4e5e8d4-2398-42c4-ac64-42750dca4e7f",
        "name": "Lavender Fire",
        "year": 2024,
        "county": "Kern",
        "latitude": 35.61181,
        "longitude": -119.956633,
        "location": "J26V+P8 Blackwells Corner, CA, USA",
        "acres_burned": 110.0,
        "url": "https://www.kget.com/wp-content/uploads/sites/2/2023/05/LavenderFire.jpg?w=885",
        "description": "The Lavender Fire was a wildfire that took place in Kern County in the year 2024. This fire was located near J26V+P8 Blackwells Corner, CA, USA and burned an estimated 110.0 acres. With coordinates at (35.61181, -119.956633), the fire posed a significant threat to nearby communities, natural habitats, and local infrastructure. Emergency response teams worked diligently to contain the spread and mitigate potential damage. Local authorities issued alerts to residents, urging them to take necessary precautions. Efforts such as firebreaks, controlled burns, and aerial firefighting were employed to limit its impact. While the fire was eventually brought under control, its effects highlighted the ongoing challenges posed by wildfires in the region."
    },
    {
        "id": "26f3518d-8978-4220-b98b-42d51c89ef02",
        "name": "Preston Fire",
        "year": 2024,
        "county": "Sonoma",
        "latitude": 38.845861,
        "longitude": -123.019703,
        "location": "20 Preston Dr, Cloverdale, CA 95425, USA",
        "acres_burned": 11.0,
        "url": "https://patch.com/img/cdn20/users/22423906/20240626/022032/styles/patch_image/public/gq9k3znbwaepamy___26134948227.jpg",
        "description": "The Preston Fire was a wildfire that took place in Sonoma County in the year 2024. This fire was located near 20 Preston Dr, Cloverdale, CA 95425, USA and burned an estimated 11.0 acres. With coordinates at (38.845861, -123.019703), the fire posed a significant threat to nearby communities, natural habitats, and local infrastructure. Emergency response teams worked diligently to contain the spread and mitigate potential damage. Local authorities issued alerts to residents, urging them to take necessary precautions. Efforts such as firebreaks, controlled burns, and aerial firefighting were employed to limit its impact. While the fire was eventually brought under control, its effects highlighted the ongoing challenges posed by wildfires in the region."
    },
    {
        "id": "220ed40b-e932-487d-a206-fa99fb194849",
        "name": "Fresno June Lightning Complex",
        "year": 2024,
        "county": "Fresno",
        "latitude": 36.78113,
        "longitude": -119.345863,
        "location": "QMJ3+FM Yokuts Valley, CA, USA",
        "acres_burned": 10616.0,
        "url": "https://kmph.com/resources/media2/16x9/full/1015/center/80/0374e67e-8d19-49ee-836c-7bf1f5cd0592-large16x9_selmafire2.jpg",
        "description": "The Fresno June Lightning Complex was a wildfire that took place in Fresno County in the year 2024. This fire was located near QMJ3+FM Yokuts Valley, CA, USA and burned an estimated 10616.0 acres. With coordinates at (36.78113, -119.345863), the fire posed a significant threat to nearby communities, natural habitats, and local infrastructure. Emergency response teams worked diligently to contain the spread and mitigate potential damage. Local authorities issued alerts to residents, urging them to take necessary precautions. Efforts such as firebreaks, controlled burns, and aerial firefighting were employed to limit its impact. While the fire was eventually brought under control, its effects highlighted the ongoing challenges posed by wildfires in the region."
    },
    {
        "id": "5da0884b-54c9-453c-9e71-54faa8ec0993",
        "name": "Anchor Fire",
        "year": 2024,
        "county": "Fresno",
        "latitude": 36.631882,
        "longitude": -119.3226,
        "location": "1291 Adams Ave, Orange Cove, CA 93646, USA",
        "acres_burned": 12.0,
        "url": "https://s.abcnews.com/images/US/carr-fire2-gty-ml-180727_hpMain_16x9_992.jpg?w=384",
        "description": "The Anchor Fire was a wildfire that took place in Fresno County in the year 2024. This fire was located near 1291 Adams Ave, Orange Cove, CA 93646, USA and burned an estimated 12.0 acres. With coordinates at (36.631882, -119.3226), the fire posed a significant threat to nearby communities, natural habitats, and local infrastructure. Emergency response teams worked diligently to contain the spread and mitigate potential damage. Local authorities issued alerts to residents, urging them to take necessary precautions. Efforts such as firebreaks, controlled burns, and aerial firefighting were employed to limit its impact. While the fire was eventually brought under control, its effects highlighted the ongoing challenges posed by wildfires in the region."
    },
    {
        "id": "15fecb82-73d1-4cde-b30b-ce5e14cb8cab",
        "name": "Round Fire",
        "year": 2024,
        "county": "Kern",
        "latitude": 35.48989,
        "longitude": -118.93111,
        "location": "F3Q9+XH Bakersfield, CA, USA",
        "acres_burned": 300.0,
        "url": "https://wildfiretoday.com/wp-content/uploads/2015/02/Round-Fire-3-by-Jerry-Dodrill.jpg",
        "description": "The Round Fire was a wildfire that took place in Kern County in the year 2024. This fire was located near F3Q9+XH Bakersfield, CA, USA and burned an estimated 300.0 acres. With coordinates at (35.48989, -118.93111), the fire posed a significant threat to nearby communities, natural habitats, and local infrastructure. Emergency response teams worked diligently to contain the spread and mitigate potential damage. Local authorities issued alerts to residents, urging them to take necessary precautions. Efforts such as firebreaks, controlled burns, and aerial firefighting were employed to limit its impact. While the fire was eventually brought under control, its effects highlighted the ongoing challenges posed by wildfires in the region."
    },
    {
        "id": "3ad0f5ed-bb4e-4289-bce3-72a1a843ecb9",
        "name": "Crabtree Fire",
        "year": 2024,
        "county": "Stanislaus",
        "latitude": 37.732422,
        "longitude": -120.596351,
        "location": "6920 Crabtree Rd, Waterford, CA 95386, USA",
        "acres_burned": 53.9,
        "url": "https://www.cafirefoundation.org/memorial-wall/desktop-image/wall-tile.jpg",
        "description": "The Crabtree Fire was a wildfire that took place in Stanislaus County in the year 2024. This fire was located near 6920 Crabtree Rd, Waterford, CA 95386, USA and burned an estimated 53.9 acres. With coordinates at (37.732422, -120.596351), the fire posed a significant threat to nearby communities, natural habitats, and local infrastructure. Emergency response teams worked diligently to contain the spread and mitigate potential damage. Local authorities issued alerts to residents, urging them to take necessary precautions. Efforts such as firebreaks, controlled burns, and aerial firefighting were employed to limit its impact. While the fire was eventually brought under control, its effects highlighted the ongoing challenges posed by wildfires in the region."
    },
    {
        "id": "99c744c7-b28d-48d4-a5ce-55fc82f942d4",
        "name": "Pass Fire",
        "year": 2024,
        "county": "Alameda",
        "latitude": 37.744764,
        "longitude": -121.596245,
        "location": "15889 Altamont Pass Rd, Tracy, CA 95391, USA",
        "acres_burned": 20.0,
        "url": "https://s.abcnews.com/images/US/AP_California_Wildfires_4_er_160819_3x2_1600.jpg?w=1600",
        "description": "The Pass Fire was a wildfire that took place in Alameda County in the year 2024. This fire was located near 15889 Altamont Pass Rd, Tracy, CA 95391, USA and burned an estimated 20.0 acres. With coordinates at (37.744764, -121.596245), the fire posed a significant threat to nearby communities, natural habitats, and local infrastructure. Emergency response teams worked diligently to contain the spread and mitigate potential damage. Local authorities issued alerts to residents, urging them to take necessary precautions. Efforts such as firebreaks, controlled burns, and aerial firefighting were employed to limit its impact. While the fire was eventually brought under control, its effects highlighted the ongoing challenges posed by wildfires in the region."
    },
    {
        "id": "9226f0ee-ae1d-4ca7-8a21-9390b6215c85",
        "name": "Basin Fire",
        "year": 2024,
        "county": "Fresno",
        "latitude": 36.868064,
        "longitude": -119.110336,
        "location": "VV9Q+6V Rodgers Crossing, CA, USA",
        "acres_burned": 14023.0,
        "url": "https://inciweb-prod-media-bucket.s3.us-gov-west-1.amazonaws.com/s3fs-public/2024-07/pio_arch_c_land_Basin_CASNF000731_07-22-24.jpg?VersionId=P2LIEz7f.e1eGug7dTOg4BphlaJZJCwT",
        "description": "The Basin Fire was a wildfire that took place in Fresno County in the year 2024. This fire was located near VV9Q+6V Rodgers Crossing, CA, USA and burned an estimated 14023.0 acres. With coordinates at (36.868064, -119.110336), the fire posed a significant threat to nearby communities, natural habitats, and local infrastructure. Emergency response teams worked diligently to contain the spread and mitigate potential damage. Local authorities issued alerts to residents, urging them to take necessary precautions. Efforts such as firebreaks, controlled burns, and aerial firefighting were employed to limit its impact. While the fire was eventually brought under control, its effects highlighted the ongoing challenges posed by wildfires in the region."
    },
    {
        "id": "9013c77d-b3dc-48c2-8169-5be382acd2e5",
        "name": "Columbia Fire",
        "year": 2024,
        "county": "Los Angeles",
        "latitude": 34.72313,
        "longitude": -118.325308,
        "location": "PMFF+7V Lancaster, CA, USA",
        "acres_burned": 355.5,
        "url": "https://c8.alamy.com/comp/ENCTCM/columbia-california-usa-2nd-may-2015-columbia-fire-district-2-engine-ENCTCM.jpg",
        "description": "The Columbia Fire was a wildfire that took place in Los Angeles County in the year 2024. This fire was located near PMFF+7V Lancaster, CA, USA and burned an estimated 355.5 acres. With coordinates at (34.72313, -118.325308), the fire posed a significant threat to nearby communities, natural habitats, and local infrastructure. Emergency response teams worked diligently to contain the spread and mitigate potential damage. Local authorities issued alerts to residents, urging them to take necessary precautions. Efforts such as firebreaks, controlled burns, and aerial firefighting were employed to limit its impact. While the fire was eventually brought under control, its effects highlighted the ongoing challenges posed by wildfires in the region."
    },
    {
        "id": "fd62ec6c-4c45-4f1e-a6ca-243c424490cd",
        "name": "Clear Fire",
        "year": 2024,
        "county": "Modoc",
        "latitude": 41.884414,
        "longitude": -121.239191,
        "location": "VQM6+Q8 Newell, CA, USA",
        "acres_burned": 890.0,
        "url": "https://cdn.abcotvs.com/dip/images/15779647_010825-cc-ap-california-wildfires-cars-torched-img.jpg",
        "description": "The Clear Fire was a wildfire that took place in Modoc County in the year 2024. This fire was located near VQM6+Q8 Newell, CA, USA and burned an estimated 890.0 acres. With coordinates at (41.884414, -121.239191), the fire posed a significant threat to nearby communities, natural habitats, and local infrastructure. Emergency response teams worked diligently to contain the spread and mitigate potential damage. Local authorities issued alerts to residents, urging them to take necessary precautions. Efforts such as firebreaks, controlled burns, and aerial firefighting were employed to limit its impact. While the fire was eventually brought under control, its effects highlighted the ongoing challenges posed by wildfires in the region."
    },
    {
        "id": "57c216a3-72ab-4647-970a-163b1267b33a",
        "name": "Empire",
        "year": 2024,
        "county": "Contra Costa",
        "latitude": 37.933129,
        "longitude": -121.777999,
        "location": "6981 Deer Valley Rd, Antioch, CA 94531, USA",
        "acres_burned": 250.0,
        "url": "https://i.redd.it/california-empire-can-you-guess-where-im-from-v0-7xwz9qyecwnc1.jpg?width=2500&format=pjpg&auto=webp&s=b3be9a213b9462e6afaa14ea520db8a3834536c7",
        "description": "The Empire was a wildfire that took place in Contra Costa County in the year 2024. This fire was located near 6981 Deer Valley Rd, Antioch, CA 94531, USA and burned an estimated 250.0 acres. With coordinates at (37.933129, -121.777999), the fire posed a significant threat to nearby communities, natural habitats, and local infrastructure. Emergency response teams worked diligently to contain the spread and mitigate potential damage. Local authorities issued alerts to residents, urging them to take necessary precautions. Efforts such as firebreaks, controlled burns, and aerial firefighting were employed to limit its impact. While the fire was eventually brought under control, its effects highlighted the ongoing challenges posed by wildfires in the region."
    },
    {
        "id": "367eee05-f2fb-41ba-ac19-4a4f2a7784e2",
        "name": "Hollow Fire",
        "year": 2024,
        "county": "San Joaquin",
        "latitude": 37.672148,
        "longitude": -121.457333,
        "location": "31019 Co Hwy J2, Tracy, CA 95377, USA",
        "acres_burned": 210.0,
        "url": "http://www.burtonsgemsandopals.com/cdn/shop/files/coonhollowfireagate.jpg?v=1712532562",
        "description": "The Hollow Fire was a wildfire that took place in San Joaquin County in the year 2024. This fire was located near 31019 Co Hwy J2, Tracy, CA 95377, USA and burned an estimated 210.0 acres. With coordinates at (37.672148, -121.457333), the fire posed a significant threat to nearby communities, natural habitats, and local infrastructure. Emergency response teams worked diligently to contain the spread and mitigate potential damage. Local authorities issued alerts to residents, urging them to take necessary precautions. Efforts such as firebreaks, controlled burns, and aerial firefighting were employed to limit its impact. While the fire was eventually brought under control, its effects highlighted the ongoing challenges posed by wildfires in the region."
    },
    {
        "id": "aeec4240-3b0f-44b8-b8be-21da8e9b5acb",
        "name": "Veterans Fire",
        "year": 2024,
        "county": "Shasta",
        "latitude": 40.477613,
        "longitude": -122.544406,
        "location": "11703 Gas Point Rd, Igo, CA 96047, USA",
        "acres_burned": 85.0,
        "url": "https://www.redding.com/gcdn/authoring/authoring-images/2024/06/28/PRRS/74245348007-veterans-fire-photo.jpg",
        "description": "The Veterans Fire was a wildfire that took place in Shasta County in the year 2024. This fire was located near 11703 Gas Point Rd, Igo, CA 96047, USA and burned an estimated 85.0 acres. With coordinates at (40.477613, -122.544406), the fire posed a significant threat to nearby communities, natural habitats, and local infrastructure. Emergency response teams worked diligently to contain the spread and mitigate potential damage. Local authorities issued alerts to residents, urging them to take necessary precautions. Efforts such as firebreaks, controlled burns, and aerial firefighting were employed to limit its impact. While the fire was eventually brought under control, its effects highlighted the ongoing challenges posed by wildfires in the region."
    },
    {
        "id": "68755884-e4c5-4564-830e-94df1e45f9bf",
        "name": "Bar Fire ",
        "year": 2024,
        "county": "Butte",
        "latitude": 39.5281902,
        "longitude": -121.533535,
        "location": "239 Reicker Ave, Oroville, CA 95966, USA",
        "acres_burned": 36.0,
        "url": "https://media.mehrnews.com/d/2020/09/10/3/3550808.jpg",
        "description": "The Bar Fire  was a wildfire that took place in Butte County in the year 2024. This fire was located near 239 Reicker Ave, Oroville, CA 95966, USA and burned an estimated 36.0 acres. With coordinates at (39.5281902, -121.533535), the fire posed a significant threat to nearby communities, natural habitats, and local infrastructure. Emergency response teams worked diligently to contain the spread and mitigate potential damage. Local authorities issued alerts to residents, urging them to take necessary precautions. Efforts such as firebreaks, controlled burns, and aerial firefighting were employed to limit its impact. While the fire was eventually brought under control, its effects highlighted the ongoing challenges posed by wildfires in the region."
    },
    {
        "id": "26de0e6c-5714-427c-a66b-d82d425f3842",
        "name": "Pizona Fire",
        "year": 2024,
        "county": "Mono",
        "latitude": 38.000167,
        "longitude": -118.49,
        "location": "85C32G25+3X",
        "acres_burned": 2160.0,
        "url": "https://inciweb-prod-media-bucket.s3.us-gov-west-1.amazonaws.com/s3fs-public/2024-06/Pizona%20Fire%20PIO%20Map_2.jpg?VersionId=2W9WV3kJ6En0lNLG8snAO5krNXGXWe6E",
        "description": "The Pizona Fire was a wildfire that took place in Mono County in the year 2024. This fire was located near 85C32G25+3X and burned an estimated 2160.0 acres. With coordinates at (38.000167, -118.49), the fire posed a significant threat to nearby communities, natural habitats, and local infrastructure. Emergency response teams worked diligently to contain the spread and mitigate potential damage. Local authorities issued alerts to residents, urging them to take necessary precautions. Efforts such as firebreaks, controlled burns, and aerial firefighting were employed to limit its impact. While the fire was eventually brought under control, its effects highlighted the ongoing challenges posed by wildfires in the region."
    },
    {
        "id": "18a08d2e-68bf-46af-84eb-40cdb3e20e87",
        "name": "Spring Fire",
        "year": 2024,
        "county": "Tehama",
        "latitude": 40.402809,
        "longitude": -121.994709,
        "location": "Co Rd A6, Red Bluff, CA 96080, USA",
        "acres_burned": 99.5,
        "url": "https://media.cbs8.com/assets/KFMB/images/079b733c-c7f0-4495-9b04-b4fb7c926575/079b733c-c7f0-4495-9b04-b4fb7c926575_1920x1080.jpg",
        "description": "The Spring Fire was a wildfire that took place in Tehama County in the year 2024. This fire was located near Co Rd A6, Red Bluff, CA 96080, USA and burned an estimated 99.5 acres. With coordinates at (40.402809, -121.994709), the fire posed a significant threat to nearby communities, natural habitats, and local infrastructure. Emergency response teams worked diligently to contain the spread and mitigate potential damage. Local authorities issued alerts to residents, urging them to take necessary precautions. Efforts such as firebreaks, controlled burns, and aerial firefighting were employed to limit its impact. While the fire was eventually brought under control, its effects highlighted the ongoing challenges posed by wildfires in the region."
    },
    {
        "id": "b12d1a65-9cf4-4706-af93-bed155dedb27",
        "name": "Lime Fire",
        "year": 2024,
        "county": "Calaveras",
        "latitude": 38.197384,
        "longitude": -120.80076,
        "location": "837 Lime Creek Rd, Valley Springs, CA 95252, USA",
        "acres_burned": 27.0,
        "url": "https://www.mymotherlode.com/wp-content/uploads/2024/06/LimeFire.jpg",
        "description": "The Lime Fire was a wildfire that took place in Calaveras County in the year 2024. This fire was located near 837 Lime Creek Rd, Valley Springs, CA 95252, USA and burned an estimated 27.0 acres. With coordinates at (38.197384, -120.80076), the fire posed a significant threat to nearby communities, natural habitats, and local infrastructure. Emergency response teams worked diligently to contain the spread and mitigate potential damage. Local authorities issued alerts to residents, urging them to take necessary precautions. Efforts such as firebreaks, controlled burns, and aerial firefighting were employed to limit its impact. While the fire was eventually brought under control, its effects highlighted the ongoing challenges posed by wildfires in the region."
    },
    {
        "id": "4d1eb95c-6e27-4af4-9133-d053b8310cbd",
        "name": "Sheering Fire",
        "year": 2024,
        "county": "Tuolumne",
        "latitude": 38.163167,
        "longitude": -119.985167,
        "location": "5277+7W Pinecrest, CA, USA",
        "acres_burned": 528.0,
        "url": "https://inciweb-prod-media-bucket.s3.us-gov-west-1.amazonaws.com/s3fs-public/2024-07/53838560865_df2cfa2b2e_k.jpg?VersionId=eh4bDslPtxq612ngyrF3MEHMjamIfjcF",
        "description": "The Sheering Fire was a wildfire that took place in Tuolumne County in the year 2024. This fire was located near 5277+7W Pinecrest, CA, USA and burned an estimated 528.0 acres. With coordinates at (38.163167, -119.985167), the fire posed a significant threat to nearby communities, natural habitats, and local infrastructure. Emergency response teams worked diligently to contain the spread and mitigate potential damage. Local authorities issued alerts to residents, urging them to take necessary precautions. Efforts such as firebreaks, controlled burns, and aerial firefighting were employed to limit its impact. While the fire was eventually brought under control, its effects highlighted the ongoing challenges posed by wildfires in the region."
    },
    {
        "id": "c65eb4f5-33c6-4472-90e9-d286270fad66",
        "name": "Adobe Fire",
        "year": 2024,
        "county": "Stanislaus",
        "latitude": 37.422757,
        "longitude": -121.36663,
        "location": "CA-130, Livermore, CA 94550, USA",
        "acres_burned": 41.0,
        "url": "https://www.cafirefoundation.org/news/announcements/Kyle%20Heard%20Photo%20-%20Rancho%20Adobe.jpg",
        "description": "The Adobe Fire was a wildfire that took place in Stanislaus County in the year 2024. This fire was located near CA-130, Livermore, CA 94550, USA and burned an estimated 41.0 acres. With coordinates at (37.422757, -121.36663), the fire posed a significant threat to nearby communities, natural habitats, and local infrastructure. Emergency response teams worked diligently to contain the spread and mitigate potential damage. Local authorities issued alerts to residents, urging them to take necessary precautions. Efforts such as firebreaks, controlled burns, and aerial firefighting were employed to limit its impact. While the fire was eventually brought under control, its effects highlighted the ongoing challenges posed by wildfires in the region."
    },
    {
        "id": "0df347a3-2aa0-463d-bb06-2ecc2f5275c6",
        "name": "Cotton Fire",
        "year": 2024,
        "county": "San Luis Obispo",
        "latitude": 35.782724,
        "longitude": -120.202099,
        "location": "CA-41, Shandon, CA 93461, USA",
        "acres_burned": 202.0,
        "url": "https://i.ebayimg.com/images/g/9JsAAOSwHdxlVRk-/s-l1200.jpg",
        "description": "The Cotton Fire was a wildfire that took place in San Luis Obispo County in the year 2024. This fire was located near CA-41, Shandon, CA 93461, USA and burned an estimated 202.0 acres. With coordinates at (35.782724, -120.202099), the fire posed a significant threat to nearby communities, natural habitats, and local infrastructure. Emergency response teams worked diligently to contain the spread and mitigate potential damage. Local authorities issued alerts to residents, urging them to take necessary precautions. Efforts such as firebreaks, controlled burns, and aerial firefighting were employed to limit its impact. While the fire was eventually brought under control, its effects highlighted the ongoing challenges posed by wildfires in the region."
    },
    {
        "id": "b626b2e7-7816-4152-9515-c8db804022ff",
        "name": "Frazier Fire",
        "year": 2024,
        "county": "Fresno",
        "latitude": 37.06783,
        "longitude": -119.50857,
        "location": "33220 Frazier Rd, Auberry, CA 93602, USA",
        "acres_burned": 10.8,
        "url": "https://upload.wikimedia.org/wikipedia/commons/e/ea/Frazier_Park_California_fire_station.JPG",
        "description": "The Frazier Fire was a wildfire that took place in Fresno County in the year 2024. This fire was located near 33220 Frazier Rd, Auberry, CA 93602, USA and burned an estimated 10.8 acres. With coordinates at (37.06783, -119.50857), the fire posed a significant threat to nearby communities, natural habitats, and local infrastructure. Emergency response teams worked diligently to contain the spread and mitigate potential damage. Local authorities issued alerts to residents, urging them to take necessary precautions. Efforts such as firebreaks, controlled burns, and aerial firefighting were employed to limit its impact. While the fire was eventually brought under control, its effects highlighted the ongoing challenges posed by wildfires in the region."
    },
    {
        "id": "d6fdb527-4cdb-47c0-8c60-58bb42dd31e1",
        "name": "Lonoak Fire",
        "year": 2024,
        "county": "Monterey",
        "latitude": 36.21923,
        "longitude": -121.08223,
        "location": "88 Lonoak Rd, King City, CA 93930, USA",
        "acres_burned": 255.0,
        "url": "https://charlottegibbblog.com/wp-content/uploads/2014/10/Lone-Oak-in-Fire-Zone-2014.jpg",
        "description": "The Lonoak Fire was a wildfire that took place in Monterey County in the year 2024. This fire was located near 88 Lonoak Rd, King City, CA 93930, USA and burned an estimated 255.0 acres. With coordinates at (36.21923, -121.08223), the fire posed a significant threat to nearby communities, natural habitats, and local infrastructure. Emergency response teams worked diligently to contain the spread and mitigate potential damage. Local authorities issued alerts to residents, urging them to take necessary precautions. Efforts such as firebreaks, controlled burns, and aerial firefighting were employed to limit its impact. While the fire was eventually brought under control, its effects highlighted the ongoing challenges posed by wildfires in the region."
    },
    {
        "id": "e9b91c35-173f-4e81-a03a-cd63fac47e5e",
        "name": "Round Fire",
        "year": 2024,
        "county": "Riverside",
        "latitude": 33.94343,
        "longitude": -117.061943,
        "location": "WWVQ+96 Beaumont, CA, USA",
        "acres_burned": 344.0,
        "url": "https://wildfiretoday.com/wp-content/uploads/2015/02/Round-Fire-3-by-Jerry-Dodrill.jpg",
        "description": "The Round Fire was a wildfire that took place in Riverside County in the year 2024. This fire was located near WWVQ+96 Beaumont, CA, USA and burned an estimated 344.0 acres. With coordinates at (33.94343, -117.061943), the fire posed a significant threat to nearby communities, natural habitats, and local infrastructure. Emergency response teams worked diligently to contain the spread and mitigate potential damage. Local authorities issued alerts to residents, urging them to take necessary precautions. Efforts such as firebreaks, controlled burns, and aerial firefighting were employed to limit its impact. While the fire was eventually brought under control, its effects highlighted the ongoing challenges posed by wildfires in the region."
    },
    {
        "id": "537d9c10-45f0-4cef-b936-580e9f08775c",
        "name": "Mines Fire",
        "year": 2024,
        "county": "Alameda",
        "latitude": 37.520283,
        "longitude": -121.5458,
        "location": "21810 Mines Rd, Livermore, CA 94550, USA",
        "acres_burned": 5.0,
        "url": "https://media.cnn.com/api/v1/images/stellar/prod/07-07-xx-2024-07-25t080703z-981325829-rc2729a3v3hb-rtrmadp-3-usa-wildfires-jpg.jpg?c=16x9&q=w_1280,c_fill",
        "description": "The Mines Fire was a wildfire that took place in Alameda County in the year 2024. This fire was located near 21810 Mines Rd, Livermore, CA 94550, USA and burned an estimated 5.0 acres. With coordinates at (37.520283, -121.5458), the fire posed a significant threat to nearby communities, natural habitats, and local infrastructure. Emergency response teams worked diligently to contain the spread and mitigate potential damage. Local authorities issued alerts to residents, urging them to take necessary precautions. Efforts such as firebreaks, controlled burns, and aerial firefighting were employed to limit its impact. While the fire was eventually brought under control, its effects highlighted the ongoing challenges posed by wildfires in the region."
    },
    {
        "id": "86c8ff02-a1bd-4de9-80d6-a6cfefa224eb",
        "name": "Creek Fire",
        "year": 2024,
        "county": "El Dorado",
        "latitude": 38.895723,
        "longitude": -120.930485,
        "location": "2790 Coon Creek Rd, Greenwood, CA 95635, USA",
        "acres_burned": 16.0,
        "url": "https://upload.wikimedia.org/wikipedia/commons/1/1b/Fseprd799186_tn.jpg",
        "description": "The Creek Fire was a wildfire that took place in El Dorado County in the year 2024. This fire was located near 2790 Coon Creek Rd, Greenwood, CA 95635, USA and burned an estimated 16.0 acres. With coordinates at (38.895723, -120.930485), the fire posed a significant threat to nearby communities, natural habitats, and local infrastructure. Emergency response teams worked diligently to contain the spread and mitigate potential damage. Local authorities issued alerts to residents, urging them to take necessary precautions. Efforts such as firebreaks, controlled burns, and aerial firefighting were employed to limit its impact. While the fire was eventually brought under control, its effects highlighted the ongoing challenges posed by wildfires in the region."
    },
    {
        "id": "f64533e4-f034-4660-a6fa-31a36d5616e0",
        "name": "El Paso Fire",
        "year": 2024,
        "county": "Kern",
        "latitude": 35.486517,
        "longitude": -117.74823,
        "location": "F7P2+JP Ridgecrest, CA, USA",
        "acres_burned": 471.0,
        "url": "https://i.ytimg.com/vi/kNcE6Bp7TY4/hq720.jpg?sqp=-oaymwEhCK4FEIIDSFryq4qpAxMIARUAAAAAGAElAADIQj0AgKJD&rs=AOn4CLDq8XOPMmzHLWGfxPdtp9s0ypNEwQ",
        "description": "The El Paso Fire was a wildfire that took place in Kern County in the year 2024. This fire was located near F7P2+JP Ridgecrest, CA, USA and burned an estimated 471.0 acres. With coordinates at (35.486517, -117.74823), the fire posed a significant threat to nearby communities, natural habitats, and local infrastructure. Emergency response teams worked diligently to contain the spread and mitigate potential damage. Local authorities issued alerts to residents, urging them to take necessary precautions. Efforts such as firebreaks, controlled burns, and aerial firefighting were employed to limit its impact. While the fire was eventually brought under control, its effects highlighted the ongoing challenges posed by wildfires in the region."
    },
    {
        "id": "1a69fba3-9511-4978-b8ec-3392d6a64973",
        "name": "Indigo Fire",
        "year": 2024,
        "county": "Los Angeles",
        "latitude": 34.45733,
        "longitude": -118.64093,
        "location": "29007 Hasley Canyon Rd, Castaic, CA 91384, USA",
        "acres_burned": 21.6,
        "url": "https://signalscv.s3.us-west-1.amazonaws.com/wp-content/uploads/2024/06/30140453/IMG_7441-scaled.jpg",
        "description": "The Indigo Fire was a wildfire that took place in Los Angeles County in the year 2024. This fire was located near 29007 Hasley Canyon Rd, Castaic, CA 91384, USA and burned an estimated 21.6 acres. With coordinates at (34.45733, -118.64093), the fire posed a significant threat to nearby communities, natural habitats, and local infrastructure. Emergency response teams worked diligently to contain the spread and mitigate potential damage. Local authorities issued alerts to residents, urging them to take necessary precautions. Efforts such as firebreaks, controlled burns, and aerial firefighting were employed to limit its impact. While the fire was eventually brought under control, its effects highlighted the ongoing challenges posed by wildfires in the region."
    },
    {
        "id": "ca49af04-92e9-4e98-809a-8607939a4c2d",
        "name": "Sierra Fire ",
        "year": 2024,
        "county": "San Bernardino",
        "latitude": 34.04119,
        "longitude": -117.43441,
        "location": "11684 Sueno Ct, Fontana, CA 92337, USA",
        "acres_burned": 400.0,
        "url": "https://sierranevada.ca.gov/wp-content/uploads/sites/326/2022/01/tamarack395-FI.jpg",
        "description": "The Sierra Fire  was a wildfire that took place in San Bernardino County in the year 2024. This fire was located near 11684 Sueno Ct, Fontana, CA 92337, USA and burned an estimated 400.0 acres. With coordinates at (34.04119, -117.43441), the fire posed a significant threat to nearby communities, natural habitats, and local infrastructure. Emergency response teams worked diligently to contain the spread and mitigate potential damage. Local authorities issued alerts to residents, urging them to take necessary precautions. Efforts such as firebreaks, controlled burns, and aerial firefighting were employed to limit its impact. While the fire was eventually brought under control, its effects highlighted the ongoing challenges posed by wildfires in the region."
    },
    {
        "id": "3b60ebfe-2fd6-4f0d-9a88-22d1e0c0941a",
        "name": "Brentwood Fire",
        "year": 2024,
        "county": "San Luis Obispo",
        "latitude": 35.279739,
        "longitude": -119.95363,
        "location": "Soda Lake Rd, Santa Margarita, CA 93453, USA",
        "acres_burned": 29.8,
        "url": "https://i.ytimg.com/vi/ea7kG07MJ1E/hq720.jpg?sqp=-oaymwEhCK4FEIIDSFryq4qpAxMIARUAAAAAGAElAADIQj0AgKJD&rs=AOn4CLBXhHeJksWDOuizSGqnN34zvE8poQ",
        "description": "The Brentwood Fire was a wildfire that took place in San Luis Obispo County in the year 2024. This fire was located near Soda Lake Rd, Santa Margarita, CA 93453, USA and burned an estimated 29.8 acres. With coordinates at (35.279739, -119.95363), the fire posed a significant threat to nearby communities, natural habitats, and local infrastructure. Emergency response teams worked diligently to contain the spread and mitigate potential damage. Local authorities issued alerts to residents, urging them to take necessary precautions. Efforts such as firebreaks, controlled burns, and aerial firefighting were employed to limit its impact. While the fire was eventually brought under control, its effects highlighted the ongoing challenges posed by wildfires in the region."
    },
    {
        "id": "ca854fbb-92a1-4142-8155-4efd9c0f3906",
        "name": "Canyon Fire",
        "year": 2024,
        "county": "Stanislaus",
        "latitude": 37.438803,
        "longitude": -121.335653,
        "location": "CA-130, Patterson, CA 95363, USA",
        "acres_burned": 80.0,
        "url": "https://i0.wp.com/wildfiretoday.com/wp-content/uploads/2017/10/CanyonFire2_254amPDT_10-10-2017_edited-1.jpg?ssl=1",
        "description": "The Canyon Fire was a wildfire that took place in Stanislaus County in the year 2024. This fire was located near CA-130, Patterson, CA 95363, USA and burned an estimated 80.0 acres. With coordinates at (37.438803, -121.335653), the fire posed a significant threat to nearby communities, natural habitats, and local infrastructure. Emergency response teams worked diligently to contain the spread and mitigate potential damage. Local authorities issued alerts to residents, urging them to take necessary precautions. Efforts such as firebreaks, controlled burns, and aerial firefighting were employed to limit its impact. While the fire was eventually brought under control, its effects highlighted the ongoing challenges posed by wildfires in the region."
    },
    {
        "id": "60babd50-9806-43f4-abed-d2718bd70f7f",
        "name": "Kitchen Fire",
        "year": 2024,
        "county": "San Diego",
        "latitude": 32.717444,
        "longitude": -116.47191,
        "location": "32337 Old Hwy 80, Campo, CA 91906, USA",
        "acres_burned": 43.1,
        "url": "https://images.prismic.io/worldcentralkitchen/Z4E5lpbqstJ99UnB_Salm_WCKLADay1-9-25_0278.jpg?auto=format%2Ccompress&rect=0%2C0%2C8192%2C4608&w=1920&h=1080",
        "description": "The Kitchen Fire was a wildfire that took place in San Diego County in the year 2024. This fire was located near 32337 Old Hwy 80, Campo, CA 91906, USA and burned an estimated 43.1 acres. With coordinates at (32.717444, -116.47191), the fire posed a significant threat to nearby communities, natural habitats, and local infrastructure. Emergency response teams worked diligently to contain the spread and mitigate potential damage. Local authorities issued alerts to residents, urging them to take necessary precautions. Efforts such as firebreaks, controlled burns, and aerial firefighting were employed to limit its impact. While the fire was eventually brought under control, its effects highlighted the ongoing challenges posed by wildfires in the region."
    },
    {
        "id": "99f2e9d4-f771-40d4-8eb2-d56ab49ef211",
        "name": "Kern Fire",
        "year": 2024,
        "county": "Kern",
        "latitude": 35.434012,
        "longitude": -117.977028,
        "location": "C2MF+J5 Ricardo, CA, USA",
        "acres_burned": 15.0,
        "url": "https://static01.nyt.com/images/2024/07/15/multimedia/15xp-wildfire1/15xp-wildfire1-articleLarge.jpg?quality=75&auto=webp&disable=upscale",
        "description": "The Kern Fire was a wildfire that took place in Kern County in the year 2024. This fire was located near C2MF+J5 Ricardo, CA, USA and burned an estimated 15.0 acres. With coordinates at (35.434012, -117.977028), the fire posed a significant threat to nearby communities, natural habitats, and local infrastructure. Emergency response teams worked diligently to contain the spread and mitigate potential damage. Local authorities issued alerts to residents, urging them to take necessary precautions. Efforts such as firebreaks, controlled burns, and aerial firefighting were employed to limit its impact. While the fire was eventually brought under control, its effects highlighted the ongoing challenges posed by wildfires in the region."
    },
    {
        "id": "b0bd7da9-58b2-405b-ab35-bfd931bf4a78",
        "name": "Mccain Fire",
        "year": 2024,
        "county": "San Diego",
        "latitude": 32.660837,
        "longitude": -116.231794,
        "location": "MQ69+87 Boulevard, CA, USA",
        "acres_burned": 1595.0,
        "url": "https://fox5sandiego.com/wp-content/uploads/sites/15/2024/07/070224-mccain-fire-update-img.jpg",
        "description": "The Mccain Fire was a wildfire that took place in San Diego County in the year 2024. This fire was located near MQ69+87 Boulevard, CA, USA and burned an estimated 1595.0 acres. With coordinates at (32.660837, -116.231794), the fire posed a significant threat to nearby communities, natural habitats, and local infrastructure. Emergency response teams worked diligently to contain the spread and mitigate potential damage. Local authorities issued alerts to residents, urging them to take necessary precautions. Efforts such as firebreaks, controlled burns, and aerial firefighting were employed to limit its impact. While the fire was eventually brought under control, its effects highlighted the ongoing challenges posed by wildfires in the region."
    },
    {
        "id": "4a98e8c8-7580-4a5f-b15d-4f7190db358e",
        "name": "Sunrise Fire",
        "year": 2024,
        "county": "Los Angeles",
        "latitude": 34.432003,
        "longitude": -117.834801,
        "location": "16845 Big Pines Hwy, Llano, CA 93544, USA",
        "acres_burned": 35.3,
        "url": "https://upload.wikimedia.org/wikipedia/commons/thumb/e/e3/Fire_Raged_California_Sunrise_In_Explore_12-5-2020_-_Flickr_-_Joey_Z1.jpg/2560px-Fire_Raged_California_Sunrise_In_Explore_12-5-2020_-_Flickr_-_Joey_Z1.jpg",
        "description": "The Sunrise Fire was a wildfire that took place in Los Angeles County in the year 2024. This fire was located near 16845 Big Pines Hwy, Llano, CA 93544, USA and burned an estimated 35.3 acres. With coordinates at (34.432003, -117.834801), the fire posed a significant threat to nearby communities, natural habitats, and local infrastructure. Emergency response teams worked diligently to contain the spread and mitigate potential damage. Local authorities issued alerts to residents, urging them to take necessary precautions. Efforts such as firebreaks, controlled burns, and aerial firefighting were employed to limit its impact. While the fire was eventually brought under control, its effects highlighted the ongoing challenges posed by wildfires in the region."
    },
    {
        "id": "5bc3c8c8-d881-4455-8a7d-93811e70b0d9",
        "name": "High Desert Fire",
        "year": 2024,
        "county": "Lassen",
        "latitude": 40.408993,
        "longitude": -120.52602,
        "location": "476125 Rice Canyon Rd, Susanville, CA 96130, USA",
        "acres_burned": 10.0,
        "url": "https://www.nps.gov/moja/learn/nature/images/IMG_2477-photo_1.jpg",
        "description": "The High Desert Fire was a wildfire that took place in Lassen County in the year 2024. This fire was located near 476125 Rice Canyon Rd, Susanville, CA 96130, USA and burned an estimated 10.0 acres. With coordinates at (40.408993, -120.52602), the fire posed a significant threat to nearby communities, natural habitats, and local infrastructure. Emergency response teams worked diligently to contain the spread and mitigate potential damage. Local authorities issued alerts to residents, urging them to take necessary precautions. Efforts such as firebreaks, controlled burns, and aerial firefighting were employed to limit its impact. While the fire was eventually brought under control, its effects highlighted the ongoing challenges posed by wildfires in the region."
    },
    {
        "id": "a0512940-e935-452a-b4a1-bf8e6fbee93a",
        "name": "Toll Fire",
        "year": 2024,
        "county": "Napa",
        "latitude": 38.63744,
        "longitude": -122.585297,
        "location": "3751 Old Lawley Toll Rd, Calistoga, CA 94515, USA",
        "acres_burned": 41.0,
        "url": "https://i.abcnewsfe.com/a/41542a20-1238-4d74-8df6-7513e28e596f/cali-fire-3-rt-gmh-251011_1736642718099_hpMain_16x9.jpg?w=992",
        "description": "The Toll Fire was a wildfire that took place in Napa County in the year 2024. This fire was located near 3751 Old Lawley Toll Rd, Calistoga, CA 94515, USA and burned an estimated 41.0 acres. With coordinates at (38.63744, -122.585297), the fire posed a significant threat to nearby communities, natural habitats, and local infrastructure. Emergency response teams worked diligently to contain the spread and mitigate potential damage. Local authorities issued alerts to residents, urging them to take necessary precautions. Efforts such as firebreaks, controlled burns, and aerial firefighting were employed to limit its impact. While the fire was eventually brought under control, its effects highlighted the ongoing challenges posed by wildfires in the region."
    },
    {
        "id": "dd88859f-53c8-41f4-b697-5e7623f8eeae",
        "name": "Thompson Fire",
        "year": 2024,
        "county": "Butte",
        "latitude": 39.53793,
        "longitude": -121.5467,
        "location": "10 Big O Rd, Oroville, CA 95965, USA",
        "acres_burned": 3789.0,
        "url": "https://i.abcnewsfe.com/a/fd2402f7-3628-43da-b353-ee5c04d4f42c/thompson-fire_1719998273719_hpMain.jpg",
        "description": "The Thompson Fire was a wildfire that took place in Butte County in the year 2024. This fire was located near 10 Big O Rd, Oroville, CA 95965, USA and burned an estimated 3789.0 acres. With coordinates at (39.53793, -121.5467), the fire posed a significant threat to nearby communities, natural habitats, and local infrastructure. Emergency response teams worked diligently to contain the spread and mitigate potential damage. Local authorities issued alerts to residents, urging them to take necessary precautions. Efforts such as firebreaks, controlled burns, and aerial firefighting were employed to limit its impact. While the fire was eventually brought under control, its effects highlighted the ongoing challenges posed by wildfires in the region."
    },
    {
        "id": "2bce08e5-efea-409f-a8c6-bc8f9254432e",
        "name": "Yolla Fire",
        "year": 2024,
        "county": "Shasta",
        "latitude": 40.386141,
        "longitude": -122.760479,
        "location": "96PQ+FR Platina, CA, USA",
        "acres_burned": 19.3,
        "url": "https://www.capradio.org/cdn-cgi/image/format=auto,width=780/media/4403738/0810-fork-fire-wildfire-update-p.jpg",
        "description": "The Yolla Fire was a wildfire that took place in Shasta County in the year 2024. This fire was located near 96PQ+FR Platina, CA, USA and burned an estimated 19.3 acres. With coordinates at (40.386141, -122.760479), the fire posed a significant threat to nearby communities, natural habitats, and local infrastructure. Emergency response teams worked diligently to contain the spread and mitigate potential damage. Local authorities issued alerts to residents, urging them to take necessary precautions. Efforts such as firebreaks, controlled burns, and aerial firefighting were employed to limit its impact. While the fire was eventually brought under control, its effects highlighted the ongoing challenges posed by wildfires in the region."
    },
    {
        "id": "40dd06ef-4937-4646-8950-849397eba75f",
        "name": "Denverton Fire",
        "year": 2024,
        "county": "Solano",
        "latitude": 38.242509,
        "longitude": -121.91466,
        "location": "5950 Creed Rd, Suisun City, CA 94585, USA",
        "acres_burned": 25.0,
        "url": "https://hips.hearstapps.com/vidthumb/d00e1c39-c04d-431e-bb42-2a424ee816bd/eda78a2d-c821-4a94-835b-91be5dd3c787.jpg?crop=1xw%3A1.0xh%3Bcenter%2Ctop&resize=810%3A*&quality=70",
        "description": "The Denverton Fire was a wildfire that took place in Solano County in the year 2024. This fire was located near 5950 Creed Rd, Suisun City, CA 94585, USA and burned an estimated 25.0 acres. With coordinates at (38.242509, -121.91466), the fire posed a significant threat to nearby communities, natural habitats, and local infrastructure. Emergency response teams worked diligently to contain the spread and mitigate potential damage. Local authorities issued alerts to residents, urging them to take necessary precautions. Efforts such as firebreaks, controlled burns, and aerial firefighting were employed to limit its impact. While the fire was eventually brought under control, its effects highlighted the ongoing challenges posed by wildfires in the region."
    },
    {
        "id": "4190d31c-2571-40cc-9f84-bbc320ff9b62",
        "name": "Border 60 Fire",
        "year": 2024,
        "county": "San Diego",
        "latitude": 32.582559,
        "longitude": -116.616755,
        "location": "521 Calle De Alberto, Tecate, CA 91980, USA",
        "acres_burned": 22.5,
        "url": "https://i.ytimg.com/vi/Tvw7JcjlHYM/hq720.jpg?sqp=-oaymwEhCK4FEIIDSFryq4qpAxMIARUAAAAAGAElAADIQj0AgKJD&rs=AOn4CLB_X055XSpJx1mbeOqbi1CdEx5SqA",
        "description": "The Border 60 Fire was a wildfire that took place in San Diego County in the year 2024. This fire was located near 521 Calle De Alberto, Tecate, CA 91980, USA and burned an estimated 22.5 acres. With coordinates at (32.582559, -116.616755), the fire posed a significant threat to nearby communities, natural habitats, and local infrastructure. Emergency response teams worked diligently to contain the spread and mitigate potential damage. Local authorities issued alerts to residents, urging them to take necessary precautions. Efforts such as firebreaks, controlled burns, and aerial firefighting were employed to limit its impact. While the fire was eventually brought under control, its effects highlighted the ongoing challenges posed by wildfires in the region."
    },
    {
        "id": "ef4e05b7-9ca7-42a0-afbc-2c98accaf08c",
        "name": "Airline Fire",
        "year": 2024,
        "county": "San Benito",
        "latitude": 36.65921,
        "longitude": -121.22114,
        "location": "MQ5H+MG Paicines, CA, USA",
        "acres_burned": 1295.0,
        "url": "https://i.abcnewsfe.com/a/80fc0e21-ac73-4802-9bd8-8cd8351ea370/250108_abc_social_wildfire1_hpMain_16x9.jpg?w=992",
        "description": "The Airline Fire was a wildfire that took place in San Benito County in the year 2024. This fire was located near MQ5H+MG Paicines, CA, USA and burned an estimated 1295.0 acres. With coordinates at (36.65921, -121.22114), the fire posed a significant threat to nearby communities, natural habitats, and local infrastructure. Emergency response teams worked diligently to contain the spread and mitigate potential damage. Local authorities issued alerts to residents, urging them to take necessary precautions. Efforts such as firebreaks, controlled burns, and aerial firefighting were employed to limit its impact. While the fire was eventually brought under control, its effects highlighted the ongoing challenges posed by wildfires in the region."
    },
    {
        "id": "b5803b5d-30ac-4638-8be4-b29eb4386d6d",
        "name": "Moccasin Fire",
        "year": 2024,
        "county": "El Dorado",
        "latitude": 38.63826,
        "longitude": -120.774929,
        "location": "1519 Moccasin Trail, Placerville, CA 95667, USA",
        "acres_burned": 51.0,
        "url": "https://kubrick.htvapps.com/htv-prod-media.s3.amazonaws.com/images/moccasin-fire1-66847cd8a3465.jpg?crop=0.992xw:1.00xh;0.00489xw,0&resize=1200:*",
        "description": "The Moccasin Fire was a wildfire that took place in El Dorado County in the year 2024. This fire was located near 1519 Moccasin Trail, Placerville, CA 95667, USA and burned an estimated 51.0 acres. With coordinates at (38.63826, -120.774929), the fire posed a significant threat to nearby communities, natural habitats, and local infrastructure. Emergency response teams worked diligently to contain the spread and mitigate potential damage. Local authorities issued alerts to residents, urging them to take necessary precautions. Efforts such as firebreaks, controlled burns, and aerial firefighting were employed to limit its impact. While the fire was eventually brought under control, its effects highlighted the ongoing challenges posed by wildfires in the region."
    },
    {
        "id": "f56284c7-82cf-4384-a344-61e133842dcc",
        "name": "Bowman Fire",
        "year": 2024,
        "county": "Kern",
        "latitude": 35.608374,
        "longitude": -117.899544,
        "location": "CA-14, Inyokern, CA 93527, USA",
        "acres_burned": 13.0,
        "url": "https://resources.finalsite.net/images/f_auto,q_auto,t_image_size_2/v1689367731/husdus/acq25egntu45i8nh7cnf/Bowman-Fire-Gym.jpg",
        "description": "The Bowman Fire was a wildfire that took place in Kern County in the year 2024. This fire was located near CA-14, Inyokern, CA 93527, USA and burned an estimated 13.0 acres. With coordinates at (35.608374, -117.899544), the fire posed a significant threat to nearby communities, natural habitats, and local infrastructure. Emergency response teams worked diligently to contain the spread and mitigate potential damage. Local authorities issued alerts to residents, urging them to take necessary precautions. Efforts such as firebreaks, controlled burns, and aerial firefighting were employed to limit its impact. While the fire was eventually brought under control, its effects highlighted the ongoing challenges posed by wildfires in the region."
    },
    {
        "id": "073a621b-0e81-4a52-9332-1b32a9400d21",
        "name": "Luken Fire",
        "year": 2024,
        "county": "Riverside",
        "latitude": 33.79682,
        "longitude": -117.264072,
        "location": "QPWP+P9 Good Hope, CA, USA",
        "acres_burned": 18.0,
        "url": "https://c8.alamy.com/comp/2ETBT9B/sunrise-view-of-mt-lukens-truck-trail-fire-road-and-mt-wilson-in-the-san-gabriel-mountains-near-pasadena-and-los-angeles-california-2ETBT9B.jpg",
        "description": "The Luken Fire was a wildfire that took place in Riverside County in the year 2024. This fire was located near QPWP+P9 Good Hope, CA, USA and burned an estimated 18.0 acres. With coordinates at (33.79682, -117.264072), the fire posed a significant threat to nearby communities, natural habitats, and local infrastructure. Emergency response teams worked diligently to contain the spread and mitigate potential damage. Local authorities issued alerts to residents, urging them to take necessary precautions. Efforts such as firebreaks, controlled burns, and aerial firefighting were employed to limit its impact. While the fire was eventually brought under control, its effects highlighted the ongoing challenges posed by wildfires in the region."
    },
    {
        "id": "475bb3e7-2ff7-45dc-8a88-ad819f7c6d7e",
        "name": "Power Fire",
        "year": 2024,
        "county": "Kern",
        "latitude": 35.470889,
        "longitude": -118.750959,
        "location": "F6CX+9J Bakersfield, CA, USA",
        "acres_burned": 200.0,
        "url": "https://amu.tv/wp-content/uploads/2025/01/vlcsnap-2025-01-17-09h08m02s094.jpg",
        "description": "The Power Fire was a wildfire that took place in Kern County in the year 2024. This fire was located near F6CX+9J Bakersfield, CA, USA and burned an estimated 200.0 acres. With coordinates at (35.470889, -118.750959), the fire posed a significant threat to nearby communities, natural habitats, and local infrastructure. Emergency response teams worked diligently to contain the spread and mitigate potential damage. Local authorities issued alerts to residents, urging them to take necessary precautions. Efforts such as firebreaks, controlled burns, and aerial firefighting were employed to limit its impact. While the fire was eventually brought under control, its effects highlighted the ongoing challenges posed by wildfires in the region."
    },
    {
        "id": "6aa086da-4175-4eec-88a4-563e410f55a0",
        "name": "Sharp Fire",
        "year": 2024,
        "county": "Ventura",
        "latitude": 34.294625,
        "longitude": -118.742209,
        "location": "2801 Sharp Rd, Simi Valley, CA 93065, USA",
        "acres_burned": 133.0,
        "url": "https://ktla.com/wp-content/uploads/sites/4/2024/07/snapshot-1.jpg?strip=1",
        "description": "The Sharp Fire was a wildfire that took place in Ventura County in the year 2024. This fire was located near 2801 Sharp Rd, Simi Valley, CA 93065, USA and burned an estimated 133.0 acres. With coordinates at (34.294625, -118.742209), the fire posed a significant threat to nearby communities, natural habitats, and local infrastructure. Emergency response teams worked diligently to contain the spread and mitigate potential damage. Local authorities issued alerts to residents, urging them to take necessary precautions. Efforts such as firebreaks, controlled burns, and aerial firefighting were employed to limit its impact. While the fire was eventually brought under control, its effects highlighted the ongoing challenges posed by wildfires in the region."
    },
    {
        "id": "5a0d9121-cb79-420a-bc1b-e0a897674944",
        "name": "Olive Fire",
        "year": 2024,
        "county": "Kern",
        "latitude": 35.612809,
        "longitude": -119.9569496,
        "location": "J27V+46 Blackwells Corner, CA, USA",
        "acres_burned": 1310.0,
        "url": "https://bloximages.newyork1.vip.townnews.com/taftmidwaydriller.com/content/tncms/assets/v3/editorial/8/a4/8a4aa9d2-9a19-11ef-b3d6-e32e0ed11e03/6727ce9809006.image.jpg?resize=411%2C500",
        "description": "The Olive Fire was a wildfire that took place in Kern County in the year 2024. This fire was located near J27V+46 Blackwells Corner, CA, USA and burned an estimated 1310.0 acres. With coordinates at (35.612809, -119.9569496), the fire posed a significant threat to nearby communities, natural habitats, and local infrastructure. Emergency response teams worked diligently to contain the spread and mitigate potential damage. Local authorities issued alerts to residents, urging them to take necessary precautions. Efforts such as firebreaks, controlled burns, and aerial firefighting were employed to limit its impact. While the fire was eventually brought under control, its effects highlighted the ongoing challenges posed by wildfires in the region."
    },
    {
        "id": "2e65fe33-1053-4be1-8025-ea4116b7b60b",
        "name": "Berry Fire",
        "year": 2024,
        "county": "Kern",
        "latitude": 35.633333,
        "longitude": -118.816667,
        "location": "J5MM+88 Woody, CA, USA",
        "acres_burned": 59.8,
        "url": "https://c8.alamy.com/comp/2DFGN71/devastation-is-seen-at-berry-creek-elementary-school-on-wednesday-after-it-was-destroyed-by-the-bear-fire-overnight-the-blaze-part-of-the-larger-north-complex-burning-in-northern-california-exploded-in-size-tuesday-night-and-into-wednesday-forcing-evacuation-warnings-and-orders-for-at-least-20000-people-in-butte-county-and-reportedly-inflicting-widespread-damage-on-the-foothill-community-of-berry-creek-photo-by-jason-piercesacramento-bee-via-zuma-wiretnsabacapresscom-2DFGN71.jpg",
        "description": "The Berry Fire was a wildfire that took place in Kern County in the year 2024. This fire was located near J5MM+88 Woody, CA, USA and burned an estimated 59.8 acres. With coordinates at (35.633333, -118.816667), the fire posed a significant threat to nearby communities, natural habitats, and local infrastructure. Emergency response teams worked diligently to contain the spread and mitigate potential damage. Local authorities issued alerts to residents, urging them to take necessary precautions. Efforts such as firebreaks, controlled burns, and aerial firefighting were employed to limit its impact. While the fire was eventually brought under control, its effects highlighted the ongoing challenges posed by wildfires in the region."
    },
    {
        "id": "798bb0b3-8d70-4d9c-a0b6-094c9013a4da",
        "name": "Shelly Fire",
        "year": 2024,
        "county": "Siskiyou",
        "latitude": 41.465297,
        "longitude": -123.057551,
        "location": "FW8R+4X Etna, CA, USA",
        "acres_burned": 15520.0,
        "url": "https://bloximages.chicago2.vip.townnews.com/heraldandnews.com/content/tncms/assets/v3/editorial/e/84/e84eb240-3e38-11ef-a49d-6b6e188c8e85/668da9a126ec3.image.jpg?resize=666%2C500",
        "description": "The Shelly Fire was a wildfire that took place in Siskiyou County in the year 2024. This fire was located near FW8R+4X Etna, CA, USA and burned an estimated 15520.0 acres. With coordinates at (41.465297, -123.057551), the fire posed a significant threat to nearby communities, natural habitats, and local infrastructure. Emergency response teams worked diligently to contain the spread and mitigate potential damage. Local authorities issued alerts to residents, urging them to take necessary precautions. Efforts such as firebreaks, controlled burns, and aerial firefighting were employed to limit its impact. While the fire was eventually brought under control, its effects highlighted the ongoing challenges posed by wildfires in the region."
    },
    {
        "id": "3400d0b8-e3e2-40a1-928b-47e56e243937",
        "name": "Orchard Fire",
        "year": 2024,
        "county": "Kern",
        "latitude": 35.10995,
        "longitude": -118.3970832,
        "location": "20028 Tehachapi Willow Springs Rd, Tehachapi, CA 93561, USA",
        "acres_burned": 830.0,
        "url": "https://i0.wp.com/www.directrelief.org/wp-content/uploads/2020/10/Orange-County-fire.jpg?resize=1280%2C720&ssl=1",
        "description": "The Orchard Fire was a wildfire that took place in Kern County in the year 2024. This fire was located near 20028 Tehachapi Willow Springs Rd, Tehachapi, CA 93561, USA and burned an estimated 830.0 acres. With coordinates at (35.10995, -118.3970832), the fire posed a significant threat to nearby communities, natural habitats, and local infrastructure. Emergency response teams worked diligently to contain the spread and mitigate potential damage. Local authorities issued alerts to residents, urging them to take necessary precautions. Efforts such as firebreaks, controlled burns, and aerial firefighting were employed to limit its impact. While the fire was eventually brought under control, its effects highlighted the ongoing challenges posed by wildfires in the region."
    },
    {
        "id": "697597c5-38dd-4db4-8f1a-e9d53c56b2e5",
        "name": "Adams Fire",
        "year": 2024,
        "county": "Lake",
        "latitude": 38.91033,
        "longitude": -122.607362,
        "location": "16324 Main St, Lower Lake, CA 95457, USA",
        "acres_burned": 16.0,
        "url": "https://www.sacbee.com/latest-news/b6mnz1/picture289751614/alternates/LANDSCAPE_1140/cal%20fire%20lnu.jpg",
        "description": "The Adams Fire was a wildfire that took place in Lake County in the year 2024. This fire was located near 16324 Main St, Lower Lake, CA 95457, USA and burned an estimated 16.0 acres. With coordinates at (38.91033, -122.607362), the fire posed a significant threat to nearby communities, natural habitats, and local infrastructure. Emergency response teams worked diligently to contain the spread and mitigate potential damage. Local authorities issued alerts to residents, urging them to take necessary precautions. Efforts such as firebreaks, controlled burns, and aerial firefighting were employed to limit its impact. While the fire was eventually brought under control, its effects highlighted the ongoing challenges posed by wildfires in the region."
    },
    {
        "id": "4d60a968-e916-483c-89b8-ae7991b191a2",
        "name": "Watt Fire",
        "year": 2024,
        "county": "Placer",
        "latitude": 38.736113,
        "longitude": -121.392532,
        "location": "9001 Watt Ave, Roseville, CA 95747, USA",
        "acres_burned": 22.9,
        "url": "https://static.life.com/wp-content/uploads/migrated/2014/12/watts-1966-21-1024x661.jpg",
        "description": "The Watt Fire was a wildfire that took place in Placer County in the year 2024. This fire was located near 9001 Watt Ave, Roseville, CA 95747, USA and burned an estimated 22.9 acres. With coordinates at (38.736113, -121.392532), the fire posed a significant threat to nearby communities, natural habitats, and local infrastructure. Emergency response teams worked diligently to contain the spread and mitigate potential damage. Local authorities issued alerts to residents, urging them to take necessary precautions. Efforts such as firebreaks, controlled burns, and aerial firefighting were employed to limit its impact. While the fire was eventually brought under control, its effects highlighted the ongoing challenges posed by wildfires in the region."
    },
    {
        "id": "da951cd4-b460-4d36-a4c7-f914f12ac31f",
        "name": "Olinda Fire",
        "year": 2024,
        "county": "Shasta",
        "latitude": 40.439362,
        "longitude": -122.415486,
        "location": "17285 Olinda Rd, Anderson, CA 96007, USA",
        "acres_burned": 98.0,
        "url": "https://www.aljazeera.com/wp-content/uploads/2020/10/AP_20299834480277.jpg?resize=770%2C513&quality=80",
        "description": "The Olinda Fire was a wildfire that took place in Shasta County in the year 2024. This fire was located near 17285 Olinda Rd, Anderson, CA 96007, USA and burned an estimated 98.0 acres. With coordinates at (40.439362, -122.415486), the fire posed a significant threat to nearby communities, natural habitats, and local infrastructure. Emergency response teams worked diligently to contain the spread and mitigate potential damage. Local authorities issued alerts to residents, urging them to take necessary precautions. Efforts such as firebreaks, controlled burns, and aerial firefighting were employed to limit its impact. While the fire was eventually brought under control, its effects highlighted the ongoing challenges posed by wildfires in the region."
    },
    {
        "id": "4130ec76-340c-450d-996e-c4e2c71a2365",
        "name": "Little Fire",
        "year": 2024,
        "county": "Fresno",
        "latitude": 36.786172,
        "longitude": -120.757128,
        "location": "53537 Little Panoche Rd, Firebaugh, CA 93622, USA",
        "acres_burned": 11.0,
        "url": "https://entnemdept.ufl.edu/creatures/urban/ants/Fig8_little_fire_ant.jpg",
        "description": "The Little Fire was a wildfire that took place in Fresno County in the year 2024. This fire was located near 53537 Little Panoche Rd, Firebaugh, CA 93622, USA and burned an estimated 11.0 acres. With coordinates at (36.786172, -120.757128), the fire posed a significant threat to nearby communities, natural habitats, and local infrastructure. Emergency response teams worked diligently to contain the spread and mitigate potential damage. Local authorities issued alerts to residents, urging them to take necessary precautions. Efforts such as firebreaks, controlled burns, and aerial firefighting were employed to limit its impact. While the fire was eventually brought under control, its effects highlighted the ongoing challenges posed by wildfires in the region."
    },
    {
        "id": "cfed11d4-8e8e-4d81-b373-f96c756ee12f",
        "name": "Grubbs Fire",
        "year": 2024,
        "county": "Butte",
        "latitude": 39.43511,
        "longitude": -121.507399,
        "location": "old house storage, 3240 Grubbs Rd, Oroville, CA 95966, USA",
        "acres_burned": 10.0,
        "url": "https://images.indianexpress.com/2024/07/2024-07-04T003312Z_1888618047_RC20O8AX8R9M_RTRMADP_5_USA-WILDFIRES.jpg?w=414",
        "description": "The Grubbs Fire was a wildfire that took place in Butte County in the year 2024. This fire was located near old house storage, 3240 Grubbs Rd, Oroville, CA 95966, USA and burned an estimated 10.0 acres. With coordinates at (39.43511, -121.507399), the fire posed a significant threat to nearby communities, natural habitats, and local infrastructure. Emergency response teams worked diligently to contain the spread and mitigate potential damage. Local authorities issued alerts to residents, urging them to take necessary precautions. Efforts such as firebreaks, controlled burns, and aerial firefighting were employed to limit its impact. While the fire was eventually brought under control, its effects highlighted the ongoing challenges posed by wildfires in the region."
    },
    {
        "id": "2a21f77a-0db4-4cd9-b1a6-3af4ead89e8d",
        "name": "Slough Fire",
        "year": 2024,
        "county": "Sacramento",
        "latitude": 38.493205,
        "longitude": -121.161253,
        "location": "13501 CA-16, Sloughhouse, CA 95683, USA",
        "acres_burned": 11.0,
        "url": "https://cdn.abcotvs.com/dip/images/13400060_061823-kfsn-6p-fresno-co-wildfire-vid.jpg",
        "description": "The Slough Fire was a wildfire that took place in Sacramento County in the year 2024. This fire was located near 13501 CA-16, Sloughhouse, CA 95683, USA and burned an estimated 11.0 acres. With coordinates at (38.493205, -121.161253), the fire posed a significant threat to nearby communities, natural habitats, and local infrastructure. Emergency response teams worked diligently to contain the spread and mitigate potential damage. Local authorities issued alerts to residents, urging them to take necessary precautions. Efforts such as firebreaks, controlled burns, and aerial firefighting were employed to limit its impact. While the fire was eventually brought under control, its effects highlighted the ongoing challenges posed by wildfires in the region."
    },
    {
        "id": "4a8ced50-3e3d-412e-87cf-37ee5045ddeb",
        "name": "Adrian Fire",
        "year": 2024,
        "county": "Los Angeles",
        "latitude": 34.573279,
        "longitude": -118.1935,
        "location": "Westland Dr, Palmdale, CA 93551, USA",
        "acres_burned": 80.0,
        "url": "https://lookaside.fbsbx.com/lookaside/crawler/instagram/CvbDbkSRI1s/0/image.jpg",
        "description": "The Adrian Fire was a wildfire that took place in Los Angeles County in the year 2024. This fire was located near Westland Dr, Palmdale, CA 93551, USA and burned an estimated 80.0 acres. With coordinates at (34.573279, -118.1935), the fire posed a significant threat to nearby communities, natural habitats, and local infrastructure. Emergency response teams worked diligently to contain the spread and mitigate potential damage. Local authorities issued alerts to residents, urging them to take necessary precautions. Efforts such as firebreaks, controlled burns, and aerial firefighting were employed to limit its impact. While the fire was eventually brought under control, its effects highlighted the ongoing challenges posed by wildfires in the region."
    },
    {
        "id": "263df749-7279-4200-9c93-b36eb00526c7",
        "name": "Grande Fire",
        "year": 2024,
        "county": "Stanislaus",
        "latitude": 37.46973,
        "longitude": -121.23728,
        "location": "FQ97+V3 Patterson, CA, USA",
        "acres_burned": 323.0,
        "url": "https://www.lloydslist.com/-/media/lloyds-list/images/car-carriers/2021-and-older-car-carriers/grande-california_credit-grimaldi.jpg?rev=3227cc6d4a7a4b638f5a4a58d1d96641&w=790&hash=2F4F9104572A369984A92D47BB53928F",
        "description": "The Grande Fire was a wildfire that took place in Stanislaus County in the year 2024. This fire was located near FQ97+V3 Patterson, CA, USA and burned an estimated 323.0 acres. With coordinates at (37.46973, -121.23728), the fire posed a significant threat to nearby communities, natural habitats, and local infrastructure. Emergency response teams worked diligently to contain the spread and mitigate potential damage. Local authorities issued alerts to residents, urging them to take necessary precautions. Efforts such as firebreaks, controlled burns, and aerial firefighting were employed to limit its impact. While the fire was eventually brought under control, its effects highlighted the ongoing challenges posed by wildfires in the region."
    },
    {
        "id": "22d0590d-60a8-488c-9ca9-605e686473a5",
        "name": "Sotelo Fire",
        "year": 2024,
        "county": "Riverside",
        "latitude": 33.72325,
        "longitude": -117.23049,
        "location": "27303 Goetz Rd, Quail Valley, CA 92587, USA",
        "acres_burned": 17.0,
        "url": "https://www.longbeach.gov/globalassets/fire/media-library/images/about-us/about-our-department/org-chart/high-level-organization-chart---fire-2024.jpg",
        "description": "The Sotelo Fire was a wildfire that took place in Riverside County in the year 2024. This fire was located near 27303 Goetz Rd, Quail Valley, CA 92587, USA and burned an estimated 17.0 acres. With coordinates at (33.72325, -117.23049), the fire posed a significant threat to nearby communities, natural habitats, and local infrastructure. Emergency response teams worked diligently to contain the spread and mitigate potential damage. Local authorities issued alerts to residents, urging them to take necessary precautions. Efforts such as firebreaks, controlled burns, and aerial firefighting were employed to limit its impact. While the fire was eventually brought under control, its effects highlighted the ongoing challenges posed by wildfires in the region."
    },
    {
        "id": "b60b3089-a801-462b-a3de-3ded5f8c72ea",
        "name": "Deer Fire",
        "year": 2024,
        "county": "Tehama",
        "latitude": 40.2003,
        "longitude": -122.30328,
        "location": "19640 Deer Valley Rd, Red Bluff, CA 96080, USA",
        "acres_burned": 31.9,
        "url": "https://e3.365dm.com/25/01/1600x900/skynews-deer-wildfire-california_6794830.jpg?20250108224045",
        "description": "The Deer Fire was a wildfire that took place in Tehama County in the year 2024. This fire was located near 19640 Deer Valley Rd, Red Bluff, CA 96080, USA and burned an estimated 31.9 acres. With coordinates at (40.2003, -122.30328), the fire posed a significant threat to nearby communities, natural habitats, and local infrastructure. Emergency response teams worked diligently to contain the spread and mitigate potential damage. Local authorities issued alerts to residents, urging them to take necessary precautions. Efforts such as firebreaks, controlled burns, and aerial firefighting were employed to limit its impact. While the fire was eventually brought under control, its effects highlighted the ongoing challenges posed by wildfires in the region."
    },
    {
        "id": "289f036a-eb92-4ae2-9d1a-0356a259dfda",
        "name": "Highway Fire ",
        "year": 2024,
        "county": "Kern",
        "latitude": 35.25322,
        "longitude": -119.2071,
        "location": "7Q3V+75 Bakersfield, CA, USA",
        "acres_burned": 75.0,
        "url": "https://media.cnn.com/api/v1/images/stellar/prod/171206124100-02-ca-wildfire-405.jpg?q=w_1920,h_1080,x_0,y_0,c_fill",
        "description": "The Highway Fire  was a wildfire that took place in Kern County in the year 2024. This fire was located near 7Q3V+75 Bakersfield, CA, USA and burned an estimated 75.0 acres. With coordinates at (35.25322, -119.2071), the fire posed a significant threat to nearby communities, natural habitats, and local infrastructure. Emergency response teams worked diligently to contain the spread and mitigate potential damage. Local authorities issued alerts to residents, urging them to take necessary precautions. Efforts such as firebreaks, controlled burns, and aerial firefighting were employed to limit its impact. While the fire was eventually brought under control, its effects highlighted the ongoing challenges posed by wildfires in the region."
    },
    {
        "id": "12b846f3-b12a-477c-acb0-14a93a94412e",
        "name": "Meiss Fire",
        "year": 2024,
        "county": "Sacramento",
        "latitude": 38.483838,
        "longitude": -121.074404,
        "location": "7879 Van Vleck Rd, Sloughhouse, CA 95683, USA",
        "acres_burned": 17.8,
        "url": "https://cdn2.picryl.com/photo/2020/07/03/meiss-fire-2020-07-03-b28db4-1024.jpg",
        "description": "The Meiss Fire was a wildfire that took place in Sacramento County in the year 2024. This fire was located near 7879 Van Vleck Rd, Sloughhouse, CA 95683, USA and burned an estimated 17.8 acres. With coordinates at (38.483838, -121.074404), the fire posed a significant threat to nearby communities, natural habitats, and local infrastructure. Emergency response teams worked diligently to contain the spread and mitigate potential damage. Local authorities issued alerts to residents, urging them to take necessary precautions. Efforts such as firebreaks, controlled burns, and aerial firefighting were employed to limit its impact. While the fire was eventually brought under control, its effects highlighted the ongoing challenges posed by wildfires in the region."
    },
    {
        "id": "a96e7558-807f-481e-a8c5-ddadc9829be7",
        "name": "French Fire",
        "year": 2024,
        "county": "Mariposa",
        "latitude": 37.50959,
        "longitude": -119.9771,
        "location": "5478 Oak Meadows Rd, Mariposa, CA 95338, USA",
        "acres_burned": 908.0,
        "url": "https://wildfiretoday.com/wp-content/uploads/2021/08/French-Fire-249-a.m.-PDT-August-21-2021-1.jpg",
        "description": "The French Fire was a wildfire that took place in Mariposa County in the year 2024. This fire was located near 5478 Oak Meadows Rd, Mariposa, CA 95338, USA and burned an estimated 908.0 acres. With coordinates at (37.50959, -119.9771), the fire posed a significant threat to nearby communities, natural habitats, and local infrastructure. Emergency response teams worked diligently to contain the spread and mitigate potential damage. Local authorities issued alerts to residents, urging them to take necessary precautions. Efforts such as firebreaks, controlled burns, and aerial firefighting were employed to limit its impact. While the fire was eventually brought under control, its effects highlighted the ongoing challenges posed by wildfires in the region."
    },
    {
        "id": "bb10e33a-6f40-44f4-875b-1f87694e87a7",
        "name": "Nason Fire",
        "year": 2024,
        "county": "Riverside",
        "latitude": 33.928252,
        "longitude": -117.191529,
        "location": "13256 Nason St, Moreno Valley, CA 92555, USA",
        "acres_burned": 65.0,
        "url": "https://media.nbcbayarea.com/2020/08/AP_20233019605788.jpg?quality=85&strip=all&resize=1200%2C675",
        "description": "The Nason Fire was a wildfire that took place in Riverside County in the year 2024. This fire was located near 13256 Nason St, Moreno Valley, CA 92555, USA and burned an estimated 65.0 acres. With coordinates at (33.928252, -117.191529), the fire posed a significant threat to nearby communities, natural habitats, and local infrastructure. Emergency response teams worked diligently to contain the spread and mitigate potential damage. Local authorities issued alerts to residents, urging them to take necessary precautions. Efforts such as firebreaks, controlled burns, and aerial firefighting were employed to limit its impact. While the fire was eventually brought under control, its effects highlighted the ongoing challenges posed by wildfires in the region."
    },
    {
        "id": "86cbe59b-509f-4d16-bd7b-ac29e1145084",
        "name": "Sonora Fire ",
        "year": 2024,
        "county": "San Bernardino",
        "latitude": 34.50711,
        "longitude": -117.5124,
        "location": "6999 CA-18, Phelan, CA 92371, USA",
        "acres_burned": 5.0,
        "url": "https://s.hdnux.com/photos/01/21/51/66/21405106/4/rawImage.jpg",
        "description": "The Sonora Fire  was a wildfire that took place in San Bernardino County in the year 2024. This fire was located near 6999 CA-18, Phelan, CA 92371, USA and burned an estimated 5.0 acres. With coordinates at (34.50711, -117.5124), the fire posed a significant threat to nearby communities, natural habitats, and local infrastructure. Emergency response teams worked diligently to contain the spread and mitigate potential damage. Local authorities issued alerts to residents, urging them to take necessary precautions. Efforts such as firebreaks, controlled burns, and aerial firefighting were employed to limit its impact. While the fire was eventually brought under control, its effects highlighted the ongoing challenges posed by wildfires in the region."
    },
    {
        "id": "94cb3aa5-ae82-4b57-8b25-b59309da9f23",
        "name": "Lumpkin Fire",
        "year": 2024,
        "county": "Butte",
        "latitude": 39.54992,
        "longitude": -121.35037,
        "location": "GJXX+XV Berry Creek, CA, USA",
        "acres_burned": 7.5,
        "url": "https://bloximages.newyork1.vip.townnews.com/actionnewsnow.com/content/tncms/assets/v3/editorial/9/ee/9eeb9b52-3a84-11ef-8719-8fb4e77cf82c/6687727879dcc.image.jpg?resize=666%2C500",
        "description": "The Lumpkin Fire was a wildfire that took place in Butte County in the year 2024. This fire was located near GJXX+XV Berry Creek, CA, USA and burned an estimated 7.5 acres. With coordinates at (39.54992, -121.35037), the fire posed a significant threat to nearby communities, natural habitats, and local infrastructure. Emergency response teams worked diligently to contain the spread and mitigate potential damage. Local authorities issued alerts to residents, urging them to take necessary precautions. Efforts such as firebreaks, controlled burns, and aerial firefighting were employed to limit its impact. While the fire was eventually brought under control, its effects highlighted the ongoing challenges posed by wildfires in the region."
    },
    {
        "id": "3dddbc43-507f-4b3f-ace9-14342e2ea5af",
        "name": "Rd 18.75 / Ave 24 Fire",
        "year": 2024,
        "county": "Madera",
        "latitude": 37.09824,
        "longitude": -120.206748,
        "location": "18742 Avenue 24, Chowchilla, CA 93610, USA",
        "acres_burned": 10.0,
        "url": "https://images.thdstatic.com/productImages/46e8f160-59b5-4bb3-896f-08a950843607/svn/natural-stone-black-noble-house-gas-fire-pits-53153-64_600.jpg",
        "description": "The Rd 18.75 / Ave 24 Fire was a wildfire that took place in Madera County in the year 2024. This fire was located near 18742 Avenue 24, Chowchilla, CA 93610, USA and burned an estimated 10.0 acres. With coordinates at (37.09824, -120.206748), the fire posed a significant threat to nearby communities, natural habitats, and local infrastructure. Emergency response teams worked diligently to contain the spread and mitigate potential damage. Local authorities issued alerts to residents, urging them to take necessary precautions. Efforts such as firebreaks, controlled burns, and aerial firefighting were employed to limit its impact. While the fire was eventually brought under control, its effects highlighted the ongoing challenges posed by wildfires in the region."
    },
    {
        "id": "e829b726-f797-435e-85d5-fd2b4fa5b2cd",
        "name": "Storey Fire",
        "year": 2024,
        "county": "Madera",
        "latitude": 36.974414,
        "longitude": -120.032252,
        "location": "28365 Ave 15 1/2, Madera, CA 93638, USA",
        "acres_burned": 10.0,
        "url": "https://alabamareflector.com/wp-content/uploads/2025/01/California-fire-photo-for-Jan-11-2025-story.jpg",
        "description": "The Storey Fire was a wildfire that took place in Madera County in the year 2024. This fire was located near 28365 Ave 15 1/2, Madera, CA 93638, USA and burned an estimated 10.0 acres. With coordinates at (36.974414, -120.032252), the fire posed a significant threat to nearby communities, natural habitats, and local infrastructure. Emergency response teams worked diligently to contain the spread and mitigate potential damage. Local authorities issued alerts to residents, urging them to take necessary precautions. Efforts such as firebreaks, controlled burns, and aerial firefighting were employed to limit its impact. While the fire was eventually brought under control, its effects highlighted the ongoing challenges posed by wildfires in the region."
    },
    {
        "id": "c850a914-f9f2-4e3f-9605-45c3c871ac93",
        "name": "Paloma Fire",
        "year": 2024,
        "county": "Merced",
        "latitude": 37.396908,
        "longitude": -120.460411,
        "location": "7500 Snelling Rd, Merced, CA 95340, USA",
        "acres_burned": 14.4,
        "url": "https://www.mymotherlode.com/wp-content/uploads/2024/06/Young-Fire-burning-along-HWY-26-in-Paloma-area-of-Calav-eras-County-copy.jpg",
        "description": "The Paloma Fire was a wildfire that took place in Merced County in the year 2024. This fire was located near 7500 Snelling Rd, Merced, CA 95340, USA and burned an estimated 14.4 acres. With coordinates at (37.396908, -120.460411), the fire posed a significant threat to nearby communities, natural habitats, and local infrastructure. Emergency response teams worked diligently to contain the spread and mitigate potential damage. Local authorities issued alerts to residents, urging them to take necessary precautions. Efforts such as firebreaks, controlled burns, and aerial firefighting were employed to limit its impact. While the fire was eventually brought under control, its effects highlighted the ongoing challenges posed by wildfires in the region."
    },
    {
        "id": "81fa266f-2ad8-4826-a316-faf872deae23",
        "name": "Dersch Fire",
        "year": 2024,
        "county": "Shasta",
        "latitude": 40.494374,
        "longitude": -122.04948,
        "location": "27000 Dersch Rd, Shingletown, CA 96088, USA",
        "acres_burned": 57.0,
        "url": "https://krcrtv.com/resources/media2/16x9/full/1015/center/80/013595ec-1007-416e-b953-0fbcd2644155-large16x9_IMG_2870.jpg",
        "description": "The Dersch Fire was a wildfire that took place in Shasta County in the year 2024. This fire was located near 27000 Dersch Rd, Shingletown, CA 96088, USA and burned an estimated 57.0 acres. With coordinates at (40.494374, -122.04948), the fire posed a significant threat to nearby communities, natural habitats, and local infrastructure. Emergency response teams worked diligently to contain the spread and mitigate potential damage. Local authorities issued alerts to residents, urging them to take necessary precautions. Efforts such as firebreaks, controlled burns, and aerial firefighting were employed to limit its impact. While the fire was eventually brought under control, its effects highlighted the ongoing challenges posed by wildfires in the region."
    },
    {
        "id": "2a35910f-6546-4f86-9314-846774ae7776",
        "name": "Hills Fire",
        "year": 2024,
        "county": "Riverside",
        "latitude": 33.757944,
        "longitude": -117.113903,
        "location": "25023 Juniper Flats Rd, Homeland, CA 92548, USA",
        "acres_burned": 71.0,
        "url": "https://s.abcnews.com/images/US/wildfires-road2-ap-ps-191024_hpMain_sl_3x2_1600.jpg?w=1600",
        "description": "The Hills Fire was a wildfire that took place in Riverside County in the year 2024. This fire was located near 25023 Juniper Flats Rd, Homeland, CA 92548, USA and burned an estimated 71.0 acres. With coordinates at (33.757944, -117.113903), the fire posed a significant threat to nearby communities, natural habitats, and local infrastructure. Emergency response teams worked diligently to contain the spread and mitigate potential damage. Local authorities issued alerts to residents, urging them to take necessary precautions. Efforts such as firebreaks, controlled burns, and aerial firefighting were employed to limit its impact. While the fire was eventually brought under control, its effects highlighted the ongoing challenges posed by wildfires in the region."
    },
    {
        "id": "bd450df3-28c4-497b-aa53-6bb4cf72c9ca",
        "name": "York Fire",
        "year": 2024,
        "county": "Kings",
        "latitude": 35.82553,
        "longitude": -120.05765,
        "location": "RWGR+6W Reef Station, CA, USA",
        "acres_burned": 60.0,
        "url": "https://media.cnn.com/api/v1/images/stellar/prod/230731231938-03-fire-whirls-california-nevada.jpg?q=w_1110,c_fill",
        "description": "The York Fire was a wildfire that took place in Kings County in the year 2024. This fire was located near RWGR+6W Reef Station, CA, USA and burned an estimated 60.0 acres. With coordinates at (35.82553, -120.05765), the fire posed a significant threat to nearby communities, natural habitats, and local infrastructure. Emergency response teams worked diligently to contain the spread and mitigate potential damage. Local authorities issued alerts to residents, urging them to take necessary precautions. Efforts such as firebreaks, controlled burns, and aerial firefighting were employed to limit its impact. While the fire was eventually brought under control, its effects highlighted the ongoing challenges posed by wildfires in the region."
    },
    {
        "id": "bc6db02b-254b-4857-9bd9-2ec52580960e",
        "name": "Lake Fire",
        "year": 2024,
        "county": "Santa Barbara",
        "latitude": 34.785,
        "longitude": -120.044833,
        "location": "QXM4+X3 Los Olivos, CA, USA",
        "acres_burned": 38664.0,
        "url": "https://s.abcnews.com/images/US/lake-fire-california-rt-lv-240706_1720359034775_hpMain_16x9_1600.jpg",
        "description": "The Lake Fire was a wildfire that took place in Santa Barbara County in the year 2024. This fire was located near QXM4+X3 Los Olivos, CA, USA and burned an estimated 38664.0 acres. With coordinates at (34.785, -120.044833), the fire posed a significant threat to nearby communities, natural habitats, and local infrastructure. Emergency response teams worked diligently to contain the spread and mitigate potential damage. Local authorities issued alerts to residents, urging them to take necessary precautions. Efforts such as firebreaks, controlled burns, and aerial firefighting were employed to limit its impact. While the fire was eventually brought under control, its effects highlighted the ongoing challenges posed by wildfires in the region."
    },
    {
        "id": "a34d2d90-9bc3-4d2c-bf8f-66b01d3792c3",
        "name": "Plenty Fire",
        "year": 2024,
        "county": "Los Angeles",
        "latitude": 34.4792756,
        "longitude": -118.506107,
        "location": "FFHV+PH Santa Clarita, CA, USA",
        "acres_burned": 77.0,
        "url": "https://cdn.abcotvs.com/dip/images/15033628_homeland-plenty-fires.jpg",
        "description": "The Plenty Fire was a wildfire that took place in Los Angeles County in the year 2024. This fire was located near FFHV+PH Santa Clarita, CA, USA and burned an estimated 77.0 acres. With coordinates at (34.4792756, -118.506107), the fire posed a significant threat to nearby communities, natural habitats, and local infrastructure. Emergency response teams worked diligently to contain the spread and mitigate potential damage. Local authorities issued alerts to residents, urging them to take necessary precautions. Efforts such as firebreaks, controlled burns, and aerial firefighting were employed to limit its impact. While the fire was eventually brought under control, its effects highlighted the ongoing challenges posed by wildfires in the region."
    },
    {
        "id": "1fee6b10-8868-412b-973d-9af87fd96c06",
        "name": "Rancho Fire",
        "year": 2024,
        "county": "Ventura",
        "latitude": 34.173631,
        "longitude": -118.853661,
        "location": "54FW+FG Thousand Oaks, CA, USA",
        "acres_burned": 13.6,
        "url": "https://i0.wp.com/wildfiretoday.com/wp-content/uploads/2018/08/Mendo_231amPDT_8-27.jpg?ssl=1",
        "description": "The Rancho Fire was a wildfire that took place in Ventura County in the year 2024. This fire was located near 54FW+FG Thousand Oaks, CA, USA and burned an estimated 13.6 acres. With coordinates at (34.173631, -118.853661), the fire posed a significant threat to nearby communities, natural habitats, and local infrastructure. Emergency response teams worked diligently to contain the spread and mitigate potential damage. Local authorities issued alerts to residents, urging them to take necessary precautions. Efforts such as firebreaks, controlled burns, and aerial firefighting were employed to limit its impact. While the fire was eventually brought under control, its effects highlighted the ongoing challenges posed by wildfires in the region."
    },
    {
        "id": "2b097232-3f87-4cf3-85de-169a64cddc14",
        "name": "Vestal Fire",
        "year": 2024,
        "county": "Tehama",
        "latitude": 40.200879,
        "longitude": -122.539089,
        "location": "14500 Pope Dr, Red Bluff, CA 96080, USA",
        "acres_burned": 19.1,
        "url": "https://i.ytimg.com/vi/G9FMfezhJik/hq720.jpg?sqp=-oaymwEhCK4FEIIDSFryq4qpAxMIARUAAAAAGAElAADIQj0AgKJD&rs=AOn4CLBmnOhfSyMiG2RwOCFDZ010DvngGQ",
        "description": "The Vestal Fire was a wildfire that took place in Tehama County in the year 2024. This fire was located near 14500 Pope Dr, Red Bluff, CA 96080, USA and burned an estimated 19.1 acres. With coordinates at (40.200879, -122.539089), the fire posed a significant threat to nearby communities, natural habitats, and local infrastructure. Emergency response teams worked diligently to contain the spread and mitigate potential damage. Local authorities issued alerts to residents, urging them to take necessary precautions. Efforts such as firebreaks, controlled burns, and aerial firefighting were employed to limit its impact. While the fire was eventually brought under control, its effects highlighted the ongoing challenges posed by wildfires in the region."
    },
    {
        "id": "5c70cc79-8ef5-4306-97fa-74093ab5bd89",
        "name": "Pocket Fire",
        "year": 2024,
        "county": "Sonoma",
        "latitude": 38.742834,
        "longitude": -122.907373,
        "location": "1126 Ridge Oaks Rd, Geyserville, CA 95441, USA",
        "acres_burned": 11.0,
        "url": "https://i0.wp.com/wildfiretoday.com/wp-content/uploads/2017/10/FireMap_10-15-2017.jpg?fit=904%2C735&ssl=1",
        "description": "The Pocket Fire was a wildfire that took place in Sonoma County in the year 2024. This fire was located near 1126 Ridge Oaks Rd, Geyserville, CA 95441, USA and burned an estimated 11.0 acres. With coordinates at (38.742834, -122.907373), the fire posed a significant threat to nearby communities, natural habitats, and local infrastructure. Emergency response teams worked diligently to contain the spread and mitigate potential damage. Local authorities issued alerts to residents, urging them to take necessary precautions. Efforts such as firebreaks, controlled burns, and aerial firefighting were employed to limit its impact. While the fire was eventually brought under control, its effects highlighted the ongoing challenges posed by wildfires in the region."
    },
    {
        "id": "e99e51fc-7eb4-40eb-82a0-22bc6989543f",
        "name": "Pay Fire",
        "year": 2024,
        "county": "El Dorado",
        "latitude": 38.7231,
        "longitude": -120.7549,
        "location": "Placerville Airport, 3501 Airport Rd #1, Placerville, CA 95667, USA",
        "acres_burned": 77.0,
        "url": "https://media.abc10.com/assets/KXTV/images/e0e9bace-260f-4165-8043-4842e625f68a/20240707T011618/e0e9bace-260f-4165-8043-4842e625f68a_1920x1080.jpg",
        "description": "The Pay Fire was a wildfire that took place in El Dorado County in the year 2024. This fire was located near Placerville Airport, 3501 Airport Rd #1, Placerville, CA 95667, USA and burned an estimated 77.0 acres. With coordinates at (38.7231, -120.7549), the fire posed a significant threat to nearby communities, natural habitats, and local infrastructure. Emergency response teams worked diligently to contain the spread and mitigate potential damage. Local authorities issued alerts to residents, urging them to take necessary precautions. Efforts such as firebreaks, controlled burns, and aerial firefighting were employed to limit its impact. While the fire was eventually brought under control, its effects highlighted the ongoing challenges posed by wildfires in the region."
    },
    {
        "id": "b7ae358d-2766-4f99-a677-f231fae07dd8",
        "name": "Cahuilla Fire",
        "year": 2024,
        "county": "San Bernardino",
        "latitude": 34.5444065,
        "longitude": -117.131163,
        "location": "24595 Cahuilla Rd, Apple Valley, CA 92307, USA",
        "acres_burned": 75.0,
        "url": "https://www.vvdailypress.com/gcdn/authoring/authoring-images/2024/07/07/NVIC/74319298007-cahuilla-fire-apple-valley-june-47-copy.JPG",
        "description": "The Cahuilla Fire was a wildfire that took place in San Bernardino County in the year 2024. This fire was located near 24595 Cahuilla Rd, Apple Valley, CA 92307, USA and burned an estimated 75.0 acres. With coordinates at (34.5444065, -117.131163), the fire posed a significant threat to nearby communities, natural habitats, and local infrastructure. Emergency response teams worked diligently to contain the spread and mitigate potential damage. Local authorities issued alerts to residents, urging them to take necessary precautions. Efforts such as firebreaks, controlled burns, and aerial firefighting were employed to limit its impact. While the fire was eventually brought under control, its effects highlighted the ongoing challenges posed by wildfires in the region."
    },
    {
        "id": "7701bdad-0622-432c-a822-1d6bf6de8c2d",
        "name": "Lucerne Fire",
        "year": 2024,
        "county": "San Bernardino",
        "latitude": 34.45196,
        "longitude": -117.03341,
        "location": "11287 High Rd, Lucerne Valley, CA 92356, USA",
        "acres_burned": 419.0,
        "url": "https://sbcfire.org/wp-content/uploads/sites/46/2023/06/20230608_Two-Alarm-Fire-Burns-in-Lucerne-Valley-2.jpg",
        "description": "The Lucerne Fire was a wildfire that took place in San Bernardino County in the year 2024. This fire was located near 11287 High Rd, Lucerne Valley, CA 92356, USA and burned an estimated 419.0 acres. With coordinates at (34.45196, -117.03341), the fire posed a significant threat to nearby communities, natural habitats, and local infrastructure. Emergency response teams worked diligently to contain the spread and mitigate potential damage. Local authorities issued alerts to residents, urging them to take necessary precautions. Efforts such as firebreaks, controlled burns, and aerial firefighting were employed to limit its impact. While the fire was eventually brought under control, its effects highlighted the ongoing challenges posed by wildfires in the region."
    },
    {
        "id": "4377f847-6f0f-470b-8319-4cafd43eb902",
        "name": "Top Fire",
        "year": 2024,
        "county": "Riverside",
        "latitude": 33.964275,
        "longitude": -117.3048,
        "location": "20510 Hill Top Dr, Riverside, CA 92507, USA",
        "acres_burned": 48.5,
        "url": "https://s.abcnews.com/images/US/graphic-top-10-largest-california-wildfires-nc-jc-180807_hpEmbed_27x16_992.jpg",
        "description": "The Top Fire was a wildfire that took place in Riverside County in the year 2024. This fire was located near 20510 Hill Top Dr, Riverside, CA 92507, USA and burned an estimated 48.5 acres. With coordinates at (33.964275, -117.3048), the fire posed a significant threat to nearby communities, natural habitats, and local infrastructure. Emergency response teams worked diligently to contain the spread and mitigate potential damage. Local authorities issued alerts to residents, urging them to take necessary precautions. Efforts such as firebreaks, controlled burns, and aerial firefighting were employed to limit its impact. While the fire was eventually brought under control, its effects highlighted the ongoing challenges posed by wildfires in the region."
    },
    {
        "id": "47d84716-507a-4630-af90-8ecdf542bc9d",
        "name": "Granite Fire",
        "year": 2024,
        "county": "Mariposa",
        "latitude": 37.7133123,
        "longitude": -120.325444,
        "location": "3292 Hormiga Way, Coulterville, CA 95311, USA",
        "acres_burned": 55.0,
        "url": "https://static.abcotvs.com/kfsn/images/cms/070624-kfsn-granite-fire-img.jpg",
        "description": "The Granite Fire was a wildfire that took place in Mariposa County in the year 2024. This fire was located near 3292 Hormiga Way, Coulterville, CA 95311, USA and burned an estimated 55.0 acres. With coordinates at (37.7133123, -120.325444), the fire posed a significant threat to nearby communities, natural habitats, and local infrastructure. Emergency response teams worked diligently to contain the spread and mitigate potential damage. Local authorities issued alerts to residents, urging them to take necessary precautions. Efforts such as firebreaks, controlled burns, and aerial firefighting were employed to limit its impact. While the fire was eventually brought under control, its effects highlighted the ongoing challenges posed by wildfires in the region."
    },
    {
        "id": "59096d89-7195-4b37-b4cc-6d02ab922848",
        "name": "View Fire",
        "year": 2024,
        "county": "Ventura",
        "latitude": 34.19518,
        "longitude": -118.90918,
        "location": "1168 Arroyo View St, Thousand Oaks, CA 91320, USA",
        "acres_burned": 14.2,
        "url": "https://landsat.gsfc.nasa.gov/wp-content/uploads/2019/02/Camp_Fire_L8_MarkusePierre.jpg",
        "description": "The View Fire was a wildfire that took place in Ventura County in the year 2024. This fire was located near 1168 Arroyo View St, Thousand Oaks, CA 91320, USA and burned an estimated 14.2 acres. With coordinates at (34.19518, -118.90918), the fire posed a significant threat to nearby communities, natural habitats, and local infrastructure. Emergency response teams worked diligently to contain the spread and mitigate potential damage. Local authorities issued alerts to residents, urging them to take necessary precautions. Efforts such as firebreaks, controlled burns, and aerial firefighting were employed to limit its impact. While the fire was eventually brought under control, its effects highlighted the ongoing challenges posed by wildfires in the region."
    },
    {
        "id": "c709ed98-7c0b-4b1f-880b-ca435696b8fa",
        "name": "Blue Water Fire",
        "year": 2024,
        "county": "San Bernardino",
        "latitude": 34.169517,
        "longitude": -114.276308,
        "location": "5P9F+RF Bluewater, AZ, USA",
        "acres_burned": 150.0,
        "url": "https://www.circleofblue.org/wp-content/uploads/2019/03/2019-02-California-Paradise-Fire-BWalton-IMG_5076.jpg",
        "description": "The Blue Water Fire was a wildfire that took place in San Bernardino County in the year 2024. This fire was located near 5P9F+RF Bluewater, AZ, USA and burned an estimated 150.0 acres. With coordinates at (34.169517, -114.276308), the fire posed a significant threat to nearby communities, natural habitats, and local infrastructure. Emergency response teams worked diligently to contain the spread and mitigate potential damage. Local authorities issued alerts to residents, urging them to take necessary precautions. Efforts such as firebreaks, controlled burns, and aerial firefighting were employed to limit its impact. While the fire was eventually brought under control, its effects highlighted the ongoing challenges posed by wildfires in the region."
    },
    {
        "id": "3a6eccd0-40fa-4d68-97fa-e38f93f0458c",
        "name": "Vista Fire",
        "year": 2024,
        "county": "San Bernardino",
        "latitude": 34.292101,
        "longitude": -117.606101,
        "location": "79RV+RH Wrightwood, CA, USA",
        "acres_burned": 2936.0,
        "url": "https://cdn.shopify.com/s/files/1/0677/4059/8571/articles/LakeFire_Desk.jpg?v=1720545625",
        "description": "The Vista Fire was a wildfire that took place in San Bernardino County in the year 2024. This fire was located near 79RV+RH Wrightwood, CA, USA and burned an estimated 2936.0 acres. With coordinates at (34.292101, -117.606101), the fire posed a significant threat to nearby communities, natural habitats, and local infrastructure. Emergency response teams worked diligently to contain the spread and mitigate potential damage. Local authorities issued alerts to residents, urging them to take necessary precautions. Efforts such as firebreaks, controlled burns, and aerial firefighting were employed to limit its impact. While the fire was eventually brought under control, its effects highlighted the ongoing challenges posed by wildfires in the region."
    },
    {
        "id": "ac4229e1-c4aa-498e-b407-4c19021a5cee",
        "name": "Post Fire",
        "year": 2024,
        "county": "Riverside",
        "latitude": 33.788907,
        "longitude": -117.293584,
        "location": "22850 Post Rd, Perris, CA 92570, USA",
        "acres_burned": 11.0,
        "url": "https://i0.wp.com/www.directrelief.org/wp-content/uploads/2024/06/post_fire.jpg?fit=1280%2C720&ssl=1",
        "description": "The Post Fire was a wildfire that took place in Riverside County in the year 2024. This fire was located near 22850 Post Rd, Perris, CA 92570, USA and burned an estimated 11.0 acres. With coordinates at (33.788907, -117.293584), the fire posed a significant threat to nearby communities, natural habitats, and local infrastructure. Emergency response teams worked diligently to contain the spread and mitigate potential damage. Local authorities issued alerts to residents, urging them to take necessary precautions. Efforts such as firebreaks, controlled burns, and aerial firefighting were employed to limit its impact. While the fire was eventually brought under control, its effects highlighted the ongoing challenges posed by wildfires in the region."
    },
    {
        "id": "f2edef16-123c-47df-8cfb-5822aaa4e6eb",
        "name": "North Fire",
        "year": 2024,
        "county": "Modoc",
        "latitude": 41.256864,
        "longitude": -120.503588,
        "location": "7F4W+PH Likely, CA, USA",
        "acres_burned": 4685.0,
        "url": "https://sierranevada.ca.gov/wp-content/uploads/sites/326/2021/02/CAmap-waterFires.jpg",
        "description": "The North Fire was a wildfire that took place in Modoc County in the year 2024. This fire was located near 7F4W+PH Likely, CA, USA and burned an estimated 4685.0 acres. With coordinates at (41.256864, -120.503588), the fire posed a significant threat to nearby communities, natural habitats, and local infrastructure. Emergency response teams worked diligently to contain the spread and mitigate potential damage. Local authorities issued alerts to residents, urging them to take necessary precautions. Efforts such as firebreaks, controlled burns, and aerial firefighting were employed to limit its impact. While the fire was eventually brought under control, its effects highlighted the ongoing challenges posed by wildfires in the region."
    },
    {
        "id": "fb03fcdb-e84c-4edd-8457-126b805119f2",
        "name": "Royal Fire",
        "year": 2024,
        "county": "Placer",
        "latitude": 39.2393,
        "longitude": -120.4168,
        "location": "6HQM+P7 The Cedars, CA, USA",
        "acres_burned": 215.0,
        "url": "https://media.abc10.com/assets/KXTV/images/267d5e6b-be31-4dad-b74c-22ab6e8584a7/20240708T060940/267d5e6b-be31-4dad-b74c-22ab6e8584a7_1920x1080.jpg",
        "description": "The Royal Fire was a wildfire that took place in Placer County in the year 2024. This fire was located near 6HQM+P7 The Cedars, CA, USA and burned an estimated 215.0 acres. With coordinates at (39.2393, -120.4168), the fire posed a significant threat to nearby communities, natural habitats, and local infrastructure. Emergency response teams worked diligently to contain the spread and mitigate potential damage. Local authorities issued alerts to residents, urging them to take necessary precautions. Efforts such as firebreaks, controlled burns, and aerial firefighting were employed to limit its impact. While the fire was eventually brought under control, its effects highlighted the ongoing challenges posed by wildfires in the region."
    },
    {
        "id": "f500704e-ed06-4a63-8ac4-55dc34c688d2",
        "name": "Hilldale Fire",
        "year": 2024,
        "county": "Merced",
        "latitude": 37.081199,
        "longitude": -120.998125,
        "location": "14301 Hilldale Ave, Los Banos, CA 93635, USA",
        "acres_burned": 10.4,
        "url": "https://d13jicmd7uan86.cloudfront.net/ae10aca3-27a1-4b79-bb2d-b20500fa6214.jpg",
        "description": "The Hilldale Fire was a wildfire that took place in Merced County in the year 2024. This fire was located near 14301 Hilldale Ave, Los Banos, CA 93635, USA and burned an estimated 10.4 acres. With coordinates at (37.081199, -120.998125), the fire posed a significant threat to nearby communities, natural habitats, and local infrastructure. Emergency response teams worked diligently to contain the spread and mitigate potential damage. Local authorities issued alerts to residents, urging them to take necessary precautions. Efforts such as firebreaks, controlled burns, and aerial firefighting were employed to limit its impact. While the fire was eventually brought under control, its effects highlighted the ongoing challenges posed by wildfires in the region."
    },
    {
        "id": "14837591-2b5d-43c0-bfa9-48d9ed8da226",
        "name": "Tesla Fire",
        "year": 2024,
        "county": "Alameda",
        "latitude": 37.66504,
        "longitude": -121.696665,
        "location": "4180 Greenville Rd, Livermore, CA 94550, USA",
        "acres_burned": 27.0,
        "url": "https://wsvn.com/wp-content/uploads/sites/2/2022/06/6-23-TESLA-CAR-FIRE.jpg?quality=60&strip=color&w=1024",
        "description": "The Tesla Fire was a wildfire that took place in Alameda County in the year 2024. This fire was located near 4180 Greenville Rd, Livermore, CA 94550, USA and burned an estimated 27.0 acres. With coordinates at (37.66504, -121.696665), the fire posed a significant threat to nearby communities, natural habitats, and local infrastructure. Emergency response teams worked diligently to contain the spread and mitigate potential damage. Local authorities issued alerts to residents, urging them to take necessary precautions. Efforts such as firebreaks, controlled burns, and aerial firefighting were employed to limit its impact. While the fire was eventually brought under control, its effects highlighted the ongoing challenges posed by wildfires in the region."
    },
    {
        "id": "f030fe29-09cc-4912-91ce-4c47048f6fb4",
        "name": "Sand Fire",
        "year": 2024,
        "county": "Tulare",
        "latitude": 36.640352,
        "longitude": -119.242623,
        "location": "14414 Sand Creek Rd, Orange Cove, CA 93646, USA",
        "acres_burned": 31.0,
        "url": "https://eoimages.gsfc.nasa.gov/images/imagerecords/88000/88442/sands_tmo_2016205.jpg",
        "description": "The Sand Fire was a wildfire that took place in Tulare County in the year 2024. This fire was located near 14414 Sand Creek Rd, Orange Cove, CA 93646, USA and burned an estimated 31.0 acres. With coordinates at (36.640352, -119.242623), the fire posed a significant threat to nearby communities, natural habitats, and local infrastructure. Emergency response teams worked diligently to contain the spread and mitigate potential damage. Local authorities issued alerts to residents, urging them to take necessary precautions. Efforts such as firebreaks, controlled burns, and aerial firefighting were employed to limit its impact. While the fire was eventually brought under control, its effects highlighted the ongoing challenges posed by wildfires in the region."
    },
    {
        "id": "d08b8b6b-585b-40c2-9b40-99ec5adf5513",
        "name": "Mina Fire",
        "year": 2024,
        "county": "Mendocino",
        "latitude": 39.970543,
        "longitude": -123.38746,
        "location": "XJC7+62 Mina, CA, USA",
        "acres_burned": 98.0,
        "url": "https://s.abcnews.com/images/GMA/240713_gma_newsvo_wildfire1_hpMain_16x9_1600.jpg",
        "description": "The Mina Fire was a wildfire that took place in Mendocino County in the year 2024. This fire was located near XJC7+62 Mina, CA, USA and burned an estimated 98.0 acres. With coordinates at (39.970543, -123.38746), the fire posed a significant threat to nearby communities, natural habitats, and local infrastructure. Emergency response teams worked diligently to contain the spread and mitigate potential damage. Local authorities issued alerts to residents, urging them to take necessary precautions. Efforts such as firebreaks, controlled burns, and aerial firefighting were employed to limit its impact. While the fire was eventually brought under control, its effects highlighted the ongoing challenges posed by wildfires in the region."
    },
    {
        "id": "1d2f4147-5768-4f7a-b777-42f72c9d75b4",
        "name": "Bogus Fire",
        "year": 2024,
        "county": "Siskiyou",
        "latitude": 41.884429,
        "longitude": -122.392257,
        "location": "10284 Little Bogus Creek Rd, Montague, CA 96064, USA",
        "acres_burned": 411.0,
        "url": "https://media.newscentermaine.com/assets/VERIFY/images/a158cb95-06eb-42a8-93b0-a47028610b7b/20250109T214452/a158cb95-06eb-42a8-93b0-a47028610b7b_1920x1080.jpg",
        "description": "The Bogus Fire was a wildfire that took place in Siskiyou County in the year 2024. This fire was located near 10284 Little Bogus Creek Rd, Montague, CA 96064, USA and burned an estimated 411.0 acres. With coordinates at (41.884429, -122.392257), the fire posed a significant threat to nearby communities, natural habitats, and local infrastructure. Emergency response teams worked diligently to contain the spread and mitigate potential damage. Local authorities issued alerts to residents, urging them to take necessary precautions. Efforts such as firebreaks, controlled burns, and aerial firefighting were employed to limit its impact. While the fire was eventually brought under control, its effects highlighted the ongoing challenges posed by wildfires in the region."
    },
    {
        "id": "50cb3627-a575-44c7-b740-498a14c33a1f",
        "name": "Franklin Fire",
        "year": 2024,
        "county": "San Luis Obispo",
        "latitude": 35.591462,
        "longitude": -120.645939,
        "location": "3180 Creston Rd, Paso Robles, CA 93446, USA",
        "acres_burned": 53.0,
        "url": "https://i0.wp.com/www.directrelief.org/wp-content/uploads/2024/12/Calfire2.jpg?fit=1280%2C720&ssl=1",
        "description": "The Franklin Fire was a wildfire that took place in San Luis Obispo County in the year 2024. This fire was located near 3180 Creston Rd, Paso Robles, CA 93446, USA and burned an estimated 53.0 acres. With coordinates at (35.591462, -120.645939), the fire posed a significant threat to nearby communities, natural habitats, and local infrastructure. Emergency response teams worked diligently to contain the spread and mitigate potential damage. Local authorities issued alerts to residents, urging them to take necessary precautions. Efforts such as firebreaks, controlled burns, and aerial firefighting were employed to limit its impact. While the fire was eventually brought under control, its effects highlighted the ongoing challenges posed by wildfires in the region."
    },
    {
        "id": "6436e8b1-ccaf-427b-87f1-25334be1ab1a",
        "name": "Caliente Fire",
        "year": 2024,
        "county": "Kern",
        "latitude": 35.273067,
        "longitude": -118.651434,
        "location": "78FX+6C Keene, CA, USA",
        "acres_burned": 60.0,
        "url": "https://media-cldnry.s-nbcnews.com/image/upload/MSNBC/Components/Video/201908/tdy_news_guth_fire_190802_1920x1080.jpg",
        "description": "The Caliente Fire was a wildfire that took place in Kern County in the year 2024. This fire was located near 78FX+6C Keene, CA, USA and burned an estimated 60.0 acres. With coordinates at (35.273067, -118.651434), the fire posed a significant threat to nearby communities, natural habitats, and local infrastructure. Emergency response teams worked diligently to contain the spread and mitigate potential damage. Local authorities issued alerts to residents, urging them to take necessary precautions. Efforts such as firebreaks, controlled burns, and aerial firefighting were employed to limit its impact. While the fire was eventually brought under control, its effects highlighted the ongoing challenges posed by wildfires in the region."
    },
    {
        "id": "704f4c46-c67f-4cd6-ad76-1bb893764f0e",
        "name": "Cow 2 Fire",
        "year": 2024,
        "county": "Tulare",
        "latitude": 36.026333,
        "longitude": -118.801528,
        "location": "194 Cow Mountain Rd, Porterville, CA 93257, USA",
        "acres_burned": 509.0,
        "url": "https://media.defense.gov/2016/Nov/18/2001670174/2000/2000/0/161102-F-ZH169-088.JPG",
        "description": "The Cow 2 Fire was a wildfire that took place in Tulare County in the year 2024. This fire was located near 194 Cow Mountain Rd, Porterville, CA 93257, USA and burned an estimated 509.0 acres. With coordinates at (36.026333, -118.801528), the fire posed a significant threat to nearby communities, natural habitats, and local infrastructure. Emergency response teams worked diligently to contain the spread and mitigate potential damage. Local authorities issued alerts to residents, urging them to take necessary precautions. Efforts such as firebreaks, controlled burns, and aerial firefighting were employed to limit its impact. While the fire was eventually brought under control, its effects highlighted the ongoing challenges posed by wildfires in the region."
    },
    {
        "id": "8887929d-bf06-47d5-aa8b-c592cbe60134",
        "name": "Teresa Fire",
        "year": 2024,
        "county": "Santa Clara",
        "latitude": 37.201128,
        "longitude": -121.736403,
        "location": "SANTA TERESA and BAILEY, San Jose, CA, USA",
        "acres_burned": 20.0,
        "url": "https://southpasadenan.com/wp-content/uploads/South-Pasadena-News-1-12-2025-Fire-Monterey-Hills-Teresa-Street-Jan-6-Eaton-Fire-Department-SPFD-02.jpg",
        "description": "The Teresa Fire was a wildfire that took place in Santa Clara County in the year 2024. This fire was located near SANTA TERESA and BAILEY, San Jose, CA, USA and burned an estimated 20.0 acres. With coordinates at (37.201128, -121.736403), the fire posed a significant threat to nearby communities, natural habitats, and local infrastructure. Emergency response teams worked diligently to contain the spread and mitigate potential damage. Local authorities issued alerts to residents, urging them to take necessary precautions. Efforts such as firebreaks, controlled burns, and aerial firefighting were employed to limit its impact. While the fire was eventually brought under control, its effects highlighted the ongoing challenges posed by wildfires in the region."
    }
]